Title,Published(Kor),Description,Link
Is the Coros Nomad really an adventure watch?,2025-10-11 10:17:38 (KST),"Coros' Nomad is marketed as a ""go-anywhere, do-anything"" adventure watch.
It's got GPS and offline maps and will track a lot of activities, from yoga to bouldering.
There's an ""Adventure Journal,"" which the marketing copy promises will help you record ""every …",https://www.theverge.com/tech/798613/coros-nomad-thru-hike-rucking
I was ready to die for the Taliban. Now I hope I can prevent others becoming radicalised,2025-10-11 11:32:46 (KST),"Born in Afghanistan, Maiwand Banaye says he was radicalised as a teenager in a refugee camp in Pakistan, after his family fled civil war at home.",https://www.bbc.com/news/articles/cy50yk5kvxno
How to use AI on your Android phone,2025-10-11 21:08:54 (KST),"AI is everywhere, and your phone has plenty of cool features that use machine learning.
Yet to get started? Let's take a look at what you can do with AI on your phone today.",https://www.androidcentral.com/apps-software/how-to-use-ai-on-your-android-phone
This meeting hack is a game changer for productivity,2025-10-11 19:34:01 (KST),"My trick for optimizing your workweek is to do a meeting binge.
Here's how to do it.",https://www.businessinsider.com/meeting-binge-hack-for-productivity-2025-10
Tech CEOs marvel — and worry — about Sam Altman's dizzying race to dominate AI,2025-10-11 18:45:02 (KST),"Tech CEOs say the OpenAI leader's torrent of activity stands out even by startup standards, with some calling it bold and others reckless.",https://www.businessinsider.com/tech-ceos-weigh-in-openai-chief-sam-altman-leadership-2025-10
Trump threatens China with export controls on Boeing parts,2025-10-11 11:06:48 (KST),WASHINGTON (Reuters) -The United States could impose export controls on Boeing plane parts as part of Washington's response to Chinese export limits on rare ...,https://finance.yahoo.com/news/trump-threatens-china-export-controls-020648114.html
Messi sits out Argentina victory in Miami friendly,2025-10-11 11:50:09 (KST),"The Argentina national team, playing without Lionel Messi, beat Venezuela 1-0 on Friday in a friendly at Hard Rock Stadium in Miami, Florida.",https://www.espn.com/soccer/story/_/id/46555014/lionel-messi-sits-argentina-win-venezuela-miami
How the Math That Powers Google Foresaw the New Pope,2025-10-11 21:00:00 (KST),A decades-old technique from network science saw something in the papal conclave that AI missed,https://www.scientificamerican.com/article/how-the-math-that-powers-google-foresaw-the-new-pope/
"The Tim Ferriss Show Transcripts: Nick Kokonas and Richard Thaler, Nobel Prize Laureate — Realistic Economics, Avoiding The Winner’s Curse, Using Temptation Bundling, and Going Against the Establishment (#830)",2025-10-11 14:42:59 (KST),"Please enjoy this transcript of my conversation with Richard Thaler and Nick Kokonas.
Richard H.
Thaler (@r_thaler) is the 2017 recipient of the Nobel Memorial Prize in Economic Sciences for his contributions to behavioral economics and the Charles R.
Walgree…",https://tim.blog/2025/10/10/richard-thaler-transcript/
"The Blessing, Part Three",2025-10-11 09:57:00 (KST),"I'm about to head to my Jackbox panel, but I wanted to check in: how are things with you? Oh, feeling fragile? Today's strip probably won't help.",https://www.penny-arcade.com/news/post/2025/10/11/the-blessing-part-three
Here's why vertically mounted GPUs may sometimes run hotter,2025-10-11 09:00:20 (KST),Discover the potential thermal drawbacks of vertically mounting your GPU and how to avoid performance penalties in your PC build.,https://www.xda-developers.com/why-vertical-mount-gpu-run-hot/
The Gruesome Origins of 7 Safety Laws,2025-10-11 20:52:00 (KST),"From tragic factory fires to toxic food scandals, some safety laws we may take for granted today actually have some pretty unsettling backstories.",https://www.mentalfloss.com/history/law/gruesome-origins-of-safety-laws
"A ""Skate To Empower"" Mentality Molds Crenshaw Skate Club First Fall/Winter 2025 Drop",2025-10-11 14:03:42 (KST),"SummaryCrenshaw Skate Club has revealed the first release of its Fall/Winter 2025 collection, which builds on the brand's new mantra of ""Skate To Empower""Staged in a NYC-shot lookbook, the concept informs garments like camouflage dyed work jackets and new gra…",https://hypebeast.com/2025/10/a-skate-to-empower-mentality-molds-crenshaw-skate-club-first-fall-winter-2025-drop
14 unusual Android apps I always install on my phone,2025-10-11 21:00:26 (KST),"We all have our best Android apps, but what about those apps that fulfill unique needs? I look at the unusual Android apps I always install.",https://www.androidauthority.com/unusual-android-apps-3605365/
Why Snapdragon phones keep outperforming Pixel — and what Google can do about it,2025-10-11 20:00:49 (KST),Google’s Tensor G5 trails Snapdragon 8 Elite Gen 5 in raw power — but cost consciousness and an AI focus explain why Google’s okay with that.,https://www.androidauthority.com/why-snapdragon-leads-pixel-3603726/
Gemini could be the big Google Maps upgrade we’ve been waiting for,2025-10-11 21:01:10 (KST),"Google Maps is getting a big Gemini-infused upgrade, while Android is becoming agentic and Google Lens is getting creative.",https://www.androidauthority.com/authority-insights-podcast-008-3606075/
The world is producing more food crops than ever before,2025-10-11 21:20:40 (KST),"If you ever find yourself in Battery Park City in Lower Manhattan, turn down Vesey Street toward North End Avenue.
You’ll arrive at something unusual: a collection of stones, soil and moss, artfully arranged to look over the Hudson River.
It’s the Irish Hung…",https://www.vox.com/future-perfect/464478/farming-crop-harvest-global-hunger-wheat-famine
Cardi B Delayed Video for BIA Diss Track to Avoid ‘Bullying’ Rapper on Her Album Release Day,2025-10-11 09:01:27 (KST),"Cardi B says she’s “not a bully,” explaining she delayed her BIA diss “Pretty & Petty” video to avoid overshadowing her rival’s album release.",http://www.rollingstone.com/music/music-news/cardi-b-bia-pretty-and-petty-video-bully-album-release-1235445366/
North Korea unveils ‘most powerful’ missile at 80th anniversary parade,2025-10-11 15:27:09 (KST),The Hwasong-20 ICBM was revealed on the 80th anniversary of North Korea's ruling Workers' Party.,https://www.aljazeera.com/news/2025/10/11/north-korea-unveils-most-powerful-missile-at-80th-anniversary-parade
MVP A’ja Wilson scores 31 as Aces beat Mercury for third WNBA title,2025-10-11 16:39:54 (KST),"Wilson becomes the first player to win the regular MVP, Defensive Player of the Year and Finals MVP in the same season.",https://www.aljazeera.com/sports/2025/10/11/mvp-aja-wilson-scores-31-as-aces-beat-mercury-for-third-wnba-title
