Title,Published(Kor),Description,Link
Should You Start 'Fibermaxxing'? Registered Dietitians Explain the Viral TikTok Wellness Trend,2025-10-04 17:32:03 (KST),"Most US adults and kids fall short of their daily recommended fiber intake.
Are you one of them?",https://www.cnet.com/health/nutrition/should-you-start-fibermaxxing-registered-dietitians-explain-viral-tiktok-wellness-trend/
Why Goldman's CEO thinks the bank will have more people in 10 years — not less — thanks to AI,2025-10-04 18:04:01 (KST),"Many have predicted Wall Street could lose jobs because of artificial intelligence.
David Solomon thinks the opposite — here's why.",https://www.businessinsider.com/goldman-ceo-david-solomon-ai-headcount-investment-spending-2025-10
Taylor Swift's 12th album is out. BI breaks down what 'The Life of a Showgirl' is all about.,2025-10-04 19:37:01 (KST),"In this Saturday edition of Business Insider Today, we're talking about Taylor Swift's latest album, ""The Life of a Showgirl.""",https://www.businessinsider.com/bi-today-saturday-newsletter-taylor-swift-life-of-a-showgirl-2025-10
Telegram's CEO explains his philosophy for using a phone as little as possible — and allocating 11 to 12 hours for sleep,2025-10-04 18:48:01 (KST),"Pavel Durov, Telegram's CEO, discusses his approach to limiting mobile phone distractions and prioritizing 11 to 12 hours of sleep.",https://www.businessinsider.com/how-telegram-ceo-pavel-durov-limits-his-phone-usage-2025-10
Naomi Watts read about infertility 'in secret' when her perimenopause began at 36: 'It's a sin to age in our industry.',2025-10-04 20:19:02 (KST),"Naomi Watts was diagnosed with perimenopause at 36.
It took her over a decade to publicly speak about symptoms like infertility and dry skin.",https://www.businessinsider.com/naomi-watts-infertility-menopause-perimenopause-2025-10
This is your doctor on ChatGPT,2025-10-04 18:36:01 (KST),Over a dozen healthcare professionals told Business Insider how they use AI — including one way it could help cure their burnout.,https://www.businessinsider.com/how-doctors-use-ai-chatgpt-including-to-help-avoid-burnout-2025-10
Nicolet High School student injured in crash will not survive,2025-10-04 11:18:35 (KST),"A Nicolet High School student will not survive injuries sustained in a car crash that happened on Wednesday, Oct.
1.",https://www.fox6now.com/news/nicolet-student-crash-organ-donation
"Buc-ee's billboards decorate Florida highways, but where can you get its fudge in Florida?",2025-10-04 18:00:29 (KST),"Is it a sign that Buc-ee's is officially coming to town, or is it just a new Buc-ee's sign in town?",https://www.tcpalm.com/story/news/local/st-lucie-county/2025/10/04/buc-ees-florida-gas-stations-daytona-st-augustine-st-lucie-fudge-brisket/86459462007/
Cloudflare Introduces NET Dollar stable coin,2025-10-04 17:02:48 (KST),"Cloudflare, Inc.
(NYSE: NET), the leading connectivity cloud company, today announced plans to introduce NET Dollar, a new U.S.
dollar-backed stablecoin that will enable instant, secure transactions for the agentic web.
NET Dollar will help power a new busine…",https://www.cloudflare.com/en-au/press/press-releases/2025/cloudflare-introduces-net-dollar-to-support-a-new-business-model-for-the-ai-driven-internet/
Why Toyota Runs a Car-Hacking Event (2024),2025-10-04 12:11:28 (KST),"Toyota organizes a car-hacking event that captivates participating students.
We uncovered the important purpose behind the event.
#TOYOTATIMES",http://toyotatimes.jp/en/spotlights/1061.html
Is Dark Energy Born inside Black Holes?,2025-10-04 19:00:00 (KST),A controversial prediction about black holes and the expansion force of the universe could explain a cosmology mystery,https://www.scientificamerican.com/article/is-dark-energy-born-inside-black-holes/
A tiny detector could unveil gravitational waves we’ve never seen before,2025-10-04 12:24:10 (KST),"Researchers have designed a new type of gravitational wave detector that operates in the milli-Hertz range, a region untouched by current observatories.
Built with optical resonators and atomic clocks, the compact detectors can fit on a lab table yet probe si…",https://www.sciencedaily.com/releases/2025/10/251003033920.htm
Nvidia's stronghold on PC gaming and AMD's failure to save us,2025-10-04 09:00:20 (KST),"Nvidia's dominance in the GPU market is making PC gaming worse, with high prices and proprietary technologies.",https://www.xda-developers.com/nvidia-is-making-pc-gaming-worse-amd-isnt-saving-us-either/
"Maximize Your AI Visibility Before Your Competitors Do [Webinar] via @sejournal, @lorenbaker",2025-10-04 16:45:44 (KST),"Learn how to boost your brand’s AI visibility.
Discover the key signals that drive AI citations and modernize your SEO strategy with AEO.
The post Maximize Your AI Visibility Before Your Competitors Do [Webinar] appeared first on Search Engine Journal.",https://www.searchenginejournal.com/maximize-your-ai-visibility-before-your-competitors-do/556164/
N.HOOLYWOOD COMPILE x Baracuta Channel British Heritage in Debut Collab,2025-10-04 09:39:22 (KST),"SummaryN.HOOLYWOOD COMPILE x Baracuta have connected for their first-ever collab capsule inspired by Daisuke Obana's recent visit to the UKThe pair presents two collaborative versions of staple Baracuta silhouettes, including the G9 jacketFor the first time e…",https://hypebeast.com/2025/10/n-hoolywood-compile-x-baracuta-fw25-first-collab-release-info
Things We Loved in Music This Week: October 4,2025-10-04 12:59:46 (KST),"As the week in music comes to a close, Hypebeast has rounded up the most notable music-related headlines – new releases, live performances, merch drops, fashion and footwear collaborations, and more.Young Thug Performs Outside Atlanta CourthouseOn Sunday, You…",https://hypebeast.com/2025/10/things-we-loved-in-music-this-week-october-4-young-thug-kali-uchis
The One UI 8.5 leaks that has us most excited about the Samsung Galaxy S26,2025-10-04 21:00:16 (KST),"We analyze One UI 8.5 leaks and what they reveal about the Galaxy S26, plus news of Handoff coming to Android & a new Pixel Watch feature.",https://www.androidauthority.com/authority-insights-podcast-007-3603279/
Android’s new Computer Control feature shows the Rabbit R1 was ahead of its time,2025-10-04 21:00:18 (KST),"Google’s new Computer Control feature could enable automated control of Android apps similar to the Rabbit R1.
Here’s how.",https://www.androidauthority.com/android-computer-control-feature-3603862/
World Space Week 2025 explores what it means to live beyond Earth,2025-10-04 21:00:00 (KST),"""Living in Space"" isn't just about designing spacecraft or stations — it's about solving the complex challenges that come with turning space into a home.",https://www.space.com/space-exploration/world-space-week-2025-explores-what-it-means-to-live-beyond-earth
International Observe the Moon Night 2025: 4 things to see on the lunar surface on Oct. 4,2025-10-04 19:00:00 (KST),"Grab your telescope and hunt down these four lunar features to celebrate International Observe the Moon Night 2025 on Oct.
4.",https://www.space.com/stargazing/international-observe-the-moon-night-2025-4-things-to-see-on-the-lunar-surface-on-oct-4
