Title,Published(Kor),Description,Link
[날씨] 일요일 남부 30도 웃돌며 더위…수요일 전국 비,2025-09-13 21:20:00 (KST),"간밤 많은 비가 내린 중부지방은 오늘(13일) 종일 선선함이 감돌았습니다.
휴일인 내일은 오늘보다는 낮 기온이 조금 더 오르겠는데요.
서울 낮 기온 29도로 예년 수준을 3도가량 웃돌겠고, 특히 남부지방, 경남과 전남...",https://n.news.naver.com/mnews/article/055/0001292226?sid=103
"""오늘 나의 갤러리 복장""…김이나, 여유로운 골프장 나들이→가을의 도...",2025-09-13 21:20:00 (KST),"김이나는 ""뮤지션 덕질과는 또다른 도파민 오늘 나의 갤러리 복장""이라고 전했다.
익숙한 무대가 아닌, 필드 위에서 내면의 리듬을 조금은 다른 방식으로 끌어안은 듯한 메시지가 여운을 남겼다.
팬들은 그녀의 담백한 일상...",https://www.topstarnews.net/news/articleView.html?idxno=15804461
"'지긋지긋 서울E 징크스 끊었다' 수원 변성환 감독 ""간절함이 닿은 것 같...",2025-09-13 21:20:00 (KST),"오늘 준비했던 전술에 대해 ""백포와 백쓰리를 넘나들며 경기하는 것이 플랜이었다.
김민우, 장석환, 정동윤 등 멀티플레이어의 역할이 중요했다.
로우 포지션에서 상대의 압박 트리거가 석호에게 걸리는 모습을 봐서...",https://m.sports.naver.com/kfootball/article/409/0000022286
[오늘 로또]1189회 로또 1등 13명 중 12명이 자동 당첨…로또 명당은(종...,2025-09-13 21:18:00 (KST),"당첨금.
13일 저녁 8시 35분 MBC '생방송 행복드림 로또 6/45'를 통해 진행된 제1189회 로또 당첨번호 추첨 결과 1등은 '9, 19, 29, 35, 37, 38'번이 뽑혔다.
2등 보너스 번호는 '31'번이다.
당첨번호 6개를 모두 맞힌 1등은...",http://www.namdonews.com/news/articleView.html?idxno=832874
[케이메디 칼럼] 불철주야 재판 생각뿐인 변호사…야근과 과로에 '목 디...,2025-09-13 21:18:00 (KST),"오늘은 대한민국 법원의 날이다.
사법부 설립을 기념하고, 시민의 권리와 자유를 지켜온 법원의 의미를 되새기는 날이다.
이 같은 시기와 맞물려 국민 권익 보호를 위해 일선에서 뛰는 변호사들의 건강 문제에 대해...",http://www.thefirstmedia.net/news/articleView.html?idxno=180876
"[55추계] “계단 같은 팀” 홍대부고, 4강 약속 지켰다",2025-09-13 21:18:00 (KST),"종별에서 용산고에 패한 후 육성혁은 “오늘 진 것은 잊어버리고, 좋은 것만 갖고 나쁜 것은 버려서 다음 대회는 더 좋은 결과를 만들겠다”고 약속했다.
그 약속을 지킬 수 있을까? 결과는 16일 오후에 확인할 수 있다....",https://m.sports.naver.com/basketball/article/065/0000284400
"레고랜드, 오싹달콤한 가을 축제 '몬스터 캐슬' 오는 20일 오픈",2025-09-13 21:18:00 (KST),"가장 멋진 분장을 한 참가자를 뽑는 '오늘의 몬스터 스타' 콘테스트가 레고 캐슬에서 열리며, 몬스터 파티를 찾아 떠나는 여정 이야기 '홉시쇼' 가 브릭토피아 크리에이티브 정글에서 관객을 맞이한다.
오싹한 마술사가...",http://www.thefirstmedia.net/news/articleView.html?idxno=180887
"가톨릭대학교 서울성모병원, 제25대 병원장 이지열 취임식 성료",2025-09-13 21:18:00 (KST),"민창기 가톨릭중앙의료원장은 격려사를 통해 ""오늘 취임식은 서울성모병원이 미래를 향해 한 단계 더 도약할 수 있는 소중한 기회""라며 ""변화와 혁신을 두려워하지 않고 미래를 향한 확고한 의지를 갖고 나아갈 때...",http://www.thefirstmedia.net/news/articleView.html?idxno=180888
전설 '최동원 정신' 다짐한 롯데…가을야구 '불씨' 살릴까,2025-09-13 21:18:00 (KST),"선수들이 오늘 최동원 동상에 헌화하고 추모했습니다.
가을야구 마지막 티켓, 5위에 도전하는 롯데에게는 1984년 우승 당시 전설 최동원이 보여줬던 불굴의 정신이 절실한 시점인데요.
오늘 3위 SSG와 맞붙었습니다....",https://m.sports.naver.com/kbaseball/article/437/0000456731
"프로배구 컵대회, FIVB 제동에 '남자부 경기 무산' 위기",2025-09-13 21:18:00 (KST),"한국배구연맹(KOVO)은 오늘(13일) 오후 4시부터 전남 여수 진남체육관에서 진행할 예정이던 남자부 A조...
만약 FIVB가 오늘 자정까지 대회 승인을 해주지 않거나 승인 요청을 거부하면 컵대회를 전면 취소하는 초유의...",https://m.sports.naver.com/volleyball/article/055/0001292225
세계선수권서 한국 선수 실격…일본 주최 측 '황당 실수',2025-09-13 21:16:00 (KST),"오늘(13일) 개막한 2025 도쿄 세계육상선수권.
남자 35㎞ 경보를 마친 우리 대표팀의 김민규 이름 옆에 경기를 완주하지 못했다는 뜻의 'DNF' 사인이 붙어 있습니다.
오늘 오전 일본 도쿄 국립경기장 인근에서 열린 남자 35...",https://m.sports.naver.com/general/article/055/0001292224
“상대 결과 신경쓰지 않고 우리 팀 승리에만 집중할 것”…기분좋은 2...,2025-09-13 21:15:00 (KST),"경기 후 이범호 감독은 “어제의 끝내기 승리 기운이 오늘 경기에도 긍정적인 영향을 준 것 같다”며...
계투진은 오늘도 팀의 리드를 잘 지켜줬다.
성영탁이 시즌 내내 정말 잘해주고 있다”고 밝은 미소를 지었다....",https://m.sports.naver.com/kbaseball/article/410/0001089235
"고창석, 오늘(13일) ‘폭군의 셰프’ 첫 등장…장영실 후손 역할",2025-09-13 21:15:00 (KST),"‘폭군의 셰프’ 배우 고창석이 ‘장영실 후손’ 장춘생으로 등장한다.
고창석은 tvN 토일드라마 '폭군의 셰프'(연출 장태유, 극본 fGRD, 기획 스튜디오드래곤, 제작 필름그리다, 정유니버스)에 장춘생 역으로 캐스팅돼 13일...",https://m.entertain.naver.com/article/408/0000280411
성수대교 음주운전으로 7명 다쳐…해병 총기 사고로 사망,2025-09-13 21:15:00 (KST),"운전 오늘(13일) 새벽 성수대교에선 실제 사고로 이어졌습니다.
먼저 보시고 해병대 총기 사고 소식 전하겠습니다.
민정희 기잡니다.
[리포트] 다리 위 택시 앞부분이 찌그러졌고, 운전석 에어백도 터져있습니다.
오늘...",https://n.news.naver.com/mnews/article/056/0012028808?sid=102
"김종민, '놀토'에 ""오랫동안 버텨줘서 고마워""...키 '헌터' 앵콜 무대",2025-09-13 21:14:00 (KST),"빽가는 ""빽가씨 오늘 어떠셨습니까""라는 붐의 질문에 ""더 이상 저런 급의 애들과 저를 함께 하지 말아주십쇼""라고 했고 신지는 ""놀토에 왔다는거 자체가 기분이 좋고 행복했어요""라고 털어놨다.
김종민은 ""오랜만에 봐도...",https://www.slist.kr/news/articleView.html?idxno=677574
"피치, 프랑스 신용등급 강등…정부 불신임 속 사상 최저(종합)",2025-09-13 21:13:00 (KST),"사임한 브뤼노 르타이오 내무장관도 같은 채널에 ""신용등급 하락은 혼란 조장 세력들이 초래한 만성적 불안정뿐 아니라 수십년간 지속된 재정 방만과 사회주의 국가식 정책 방황에 대한 응징""이라며 ""오늘 우리가...",https://n.news.naver.com/mnews/article/001/0015624167?sid=104
"‘폭군의 셰프’ 이채민, ♥임윤아 지키기 위해 치열한 사투",2025-09-13 21:13:00 (KST),"오늘(13일) 방송될 tvN 토일드라마 ‘폭군의 셰프’(연출 장태유, 극본 fGRD, 기획 스튜디오드래곤, 제작 필름그리다, 정유니버스) 7회에서는 자객들의 공격으로부터 대령숙수 연지영(임윤아 분)을 구해내려는 왕 이헌(이채민...",https://m.entertain.naver.com/article/408/0000280410
"KIA, 공동 5위와 2경기 차 추격…이범호 감독 ""우리 승리에 집중""",2025-09-13 21:12:00 (KST),"이 감독은 ""전날(12일) 두산 베어스전 끝내기 승리의 기운이 오늘 경기에도 긍정적인 영향을 줬다""고 기뻐했다.
6이닝 2실점 역투를 펼쳐 팔꿈치 수술 후 첫 승을 따낸 이의리에 대해서는 ""구위에 힘이 느껴졌다.
볼넷...",https://m.sports.naver.com/kbaseball/article/421/0008484348
"정일우, 정인선 챙기는 윤현민 질투 ""지가 남친이야, 뭐야"" ('화려한 날...",2025-09-13 21:12:00 (KST),"잠깐, 오늘 바닥 치면 3일 후에 공사 끝나잖아.
잔금으로 돈 줘야 하는데, 소리 뻥뻥 쳐놨잖아""라며 대출 가능 여부를 확인하는 모습을 보였다.
카페에 돌아온 뒤에도 작업에 파묻혀 있는 은오에 친구 수정은 ""너 오늘 여기서...",https://m.entertain.naver.com/article/213/0001352642
나이키 오버핏 반팔 티셔츠 캐시닥 용돈퀴즈 출제,2025-09-13 21:12:00 (KST),"오늘만! 2만원대 최저가""라는 문제를 냈다.
이 문제의 빈칸에 들어갈 정답은 '그래픽'이다.
용돈퀴즈 참여는 앱을 통해 할 수 있다.
퀴즈 정답을 맞히면 랜덤하게 상금의 일부를 캐시로 받을 수 있다.",https://www.rapportian.com/news/articleView.html?idxno=226126
