Title,Published(Kor),Description,Link
Google Gemini’s AI coding tool is now free for individual users,2025-02-25 20:02:47 (KST),"A free version of Gemini Code Assist, Google’s enterprise-focused AI coding tool, is now available globally for solo developers.
Google announced today that Gemini Code Assist for individuals is launching in public preview, aiming to make coding assistants “w…",https://www.theverge.com/news/618839/google-gemini-ai-code-assist-free-individuals-availability
"Three years later, the Steam Deck has dominated handheld PC gaming",2025-02-25 16:18:34 (KST),"Today is the third anniversary of Valveâs Steam Deck, the handheld gaming PC that all but created the market for handheld gaming PCs.
It was a mess to start! But three years later, The Verge has data showing how it has dominated the nascent market.
While Va…",https://www.theverge.com/pc-gaming/618709/steam-deck-3-year-anniversary-handheld-gaming-shipments-idc
First cross-party talks on social care reform postponed,2025-02-25 10:03:07 (KST),The five largest parties in England were due to meet this week - but the BBC has learned the talks have been cancelled.,https://www.bbc.com/news/articles/cg5d2jg8dr1o
"Google adds free Gemini Code Assist tier with 180,000 monthly code completions",2025-02-25 20:00:00 (KST),"Gemini Code Assist is now available in a free version, offering developers up to 180,000 code completions per month with AI at no cost.",https://www.androidcentral.com/apps-software/google-adds-free-gemini-code-assist-tier-with-180-000-monthly-code-completions
ChatGPT Can Be Used as Default Safari Search Engine With New Extension,2025-02-25 09:39:54 (KST),"OpenAI today updated the ChatGPT app to add a new Safari Extension that allows ChatGPT to be used as the default search engine for searches made through the Safari search bar.
After updating to the latest version of the ChatGPT app, the ChatGPT Search Ex…",https://www.macrumors.com/2025/02/24/chatgpt-safari-search-extension/
"Who is Alice Marie Johnson, Trump's newly appointed 'pardon czar'?",2025-02-25 21:20:21 (KST),"Johnson, now 69, was facing life in prison without the possibility of parole for being a first-time nonviolent drug offender.",https://www.npr.org/2025/02/25/nx-s1-5307330/trump-pardon-czar-who-is-alice-marie-johnson
"Clint Hill, the Secret Service agent who tried to shield the Kennedys, dies at 93",2025-02-25 15:58:28 (KST),"Hill received Secret Service awards and was promoted for his actions that day, but for decades blamed himself for Kennedy's death, saying he would gladly have given his life to save the president.",https://www.npr.org/2025/02/25/g-s1-50565/clint-hill-secret-service-obit
Reconciliation is the key to unlocking Trump's agenda. Here's how it works,2025-02-25 19:00:00 (KST),Republicans in Congress are turning to a tool of the budget process to pass major elements of President Trump's agenda without the threat of a filibuster from Senate Democrats.,https://www.npr.org/2025/02/25/g-s1-50474/reconciliation-trump-republicans-congress
Archaeologists are finding mysterious ancient objects on Norway's melting glaciers. Take a look.,2025-02-25 19:16:01 (KST),"Ancient humans trekked across mountain glaciers for hunting or trade.
The objects they left behind were frozen into the ice for centuries.",https://www.businessinsider.com/archaeologists-discovering-ancient-artifacts-norways-melting-glaciers-photos-2025-2
The AI coding apocalypse,2025-02-25 18:04:02 (KST),"In the age of artificial intelligence, entry-level coders are doomed.
But some engineers are thriving.",https://www.businessinsider.com/career-ladder-software-engineers-collapsing-ai-google-meta-coding-2025-2
Elon Musk hates OpenAI's for-profit transformation plan. He's not the only one.,2025-02-25 19:00:02 (KST),"Meta, AI entrepreneurs, academics, and other charities and activists are criticizing the startup's plan to shed its ties to its non-profit parent.",https://www.businessinsider.com/openai-elon-musk-sam-altman-for-profit-conversion-2025-2
Organic farmers spent 12 years developing this new rice. It’s better for you and the planet,2025-02-25 19:00:00 (KST),"Lundberg Family Farms focuses on regenerative organic farming; its new black pearl rice thrives with these practices.
Twelve years ago, rice breeders with Lundberg Family Farms crossed two rice plant “parents” in hopes of cultivating a better black pearl ri…",https://www.fastcompany.com/91283696/organic-farmers-spent-12-years-developing-this-new-rice-its-better-for-you-and-the-planet
Boca businessman who stole $1.45 million from 'friend' asks judge to spare him from prison,2025-02-25 19:01:04 (KST),"David Bruce Cohen, 61, said a lengthy prison sentence would eliminate any chance for him to repay the $1.45 million he stole from Tonia Deutsch.",https://www.palmbeachpost.com/story/news/crime/2025/02/25/boca-raton-businessman-david-cohen-stole-million-tania-deutsch-asks-judge-for-mercy-prison-sentence/75775628007/
Breaking Down the Details in Andor Season 2’s Riotous First Trailer,2025-02-25 09:15:30 (KST),Our first major look at Andor's return gives us plenty of intriguing details to chew on.,https://gizmodo.com/star-wars-andor-season-2-trailer-breakdown-2000567824
The Human-Neanderthal Love-Story Mystery,2025-02-25 20:00:00 (KST),How a pandemic travel restriction led to a revolutionary discovery about early humans,https://www.theatlantic.com/podcasts/archive/2025/02/the-human-neanderthal-mystery/681737/
Hamas’s Theater of the Macabre,2025-02-25 21:00:00 (KST),"The terrorist group has dragooned its hostages, Jewish and not, into perverse performance art.",https://www.theatlantic.com/international/archive/2025/02/hamass-theater-of-the-macabre/681826/
"Goodbye Camelot, Hello MAGAlot",2025-02-25 21:00:00 (KST),"Trump seeks to emulate JFK’s power over American art.
But bending culture to his will might not be as easy as he thinks.",https://www.theatlantic.com/culture/archive/2025/02/what-trump-misses-turning-camelot-magalot/681820/
Even Iraq Wants to Leave Iran’s Axis,2025-02-25 21:00:00 (KST),Welcome to the new balance of power in the Middle East.,https://www.theatlantic.com/international/archive/2025/02/iraq-leaving-irans-axis/681825/
Secret Service agent who leapt onto JFK's car during assassination dies at 93,2025-02-25 12:22:10 (KST),Clint Hill spent decades blaming himself for Kennedy's death before re-evaluating his role.,https://www.bbc.com/news/articles/cx2rnv1zj4go
