Title,Published(Kor),Description,Link
"Apple Watch Owners, Cash In on This $20 Million Settlement Today",2025-02-08 20:00:04 (KST),"If you own a certain Apple Watch model, you might be eligible for a cash payout, and should file your claim now.",https://www.cnet.com/tech/mobile/apple-watch-owners-heres-how-you-can-claim-part-of-a-20-million-settlement-how-to-file/
Trump supporters welcome the first steps in his immigration crackdown,2025-02-08 19:00:00 (KST),"President Trump kicked off his second term with a dramatic crackdown on immigration.
Critics call those moves cruel and unnecessary.
But many of Trump's supporters are applauding these early steps.",https://www.npr.org/2025/02/08/nx-s1-5279370/trump-supporters-welcome-immigration-crackdown
What's Trump's beef with South Africa?,2025-02-08 09:01:13 (KST),"Trump has accused South Africa of ""human rights violations"" and a land grab.
The South African government has hit back.",https://www.npr.org/2025/02/08/nx-s1-5290131/south-africa-land-trump-musk-ramaphosa
Linda McMahon led WWE and the SBA. The U.S. Education Dept. may be next,2025-02-08 19:00:00 (KST),"McMahon has a limited background in education, and a long career as a business executive.
She'd be stepping into an agency the president hopes to dissolve.",https://www.npr.org/2025/02/08/nx-s1-5251642/linda-mcmahon-trump-wwe-education-secretary-nominee
"Tourists flee and homes break apart in Santorini, but resilient locals remain",2025-02-08 09:22:44 (KST),People started evacuating the island as it was shook by tremors - but not everyone is fleeing.,https://www.bbc.com/news/articles/c8059mny2g3o
Docker Bake Is Now Generally Available,2025-02-08 12:39:46 (KST),"Learn more about the new release of Docker Bake, including what it is, how it simplifies complex builds, and where to get started.",https://www.docker.com/blog/ga-launch-docker-bake/
Apple @ Work: Is 2025 the year Apple releases a Google Workspace competitor?,2025-02-08 21:00:00 (KST),"Apple @ Work is exclusively brought to you by Mosyle, the only Apple Unified Platform.
Mosyle is the only solution that integrates in a single professional-grade platform all the solutions necessary to seamlessly and automatically deploy, manage & protect App…",https://9to5mac.com/2025/02/08/is-2025-the-year-apple-releases-a-basic-google-workspace-competitor/
US edition of Dezeen Agenda features all the news from the last fortnight in America,2025-02-08 17:00:04 (KST),"The latest newsletter in our US edition of Dezeen Agenda features all the news from the US, including office-to-residential plans in New York and 3D-printed houses in Texas .
Subscribe today! In this US edition of our Dezeen Agenda newsletter, we reported on …",https://www.dezeen.com/2025/02/08/us-agenda-newsletter-gensler-foster-partners/
Teen on Musk’s DOGE Team Graduated from ‘The Com’,2025-02-08 09:32:53 (KST),Wired reported this week that a 19-year-old working for Elon Musk's so-called Department of Government Efficiency (DOGE) was given access to sensitive US government systems even though his past association with cybercrime communities should have precluded him…,https://krebsonsecurity.com/2025/02/teen-on-musks-doge-team-graduated-from-the-com/
Video: Kendrick Perkins Calls Out Kevin Durant's Suns Leadership After Trade Deadline,2025-02-08 10:16:09 (KST),ESPN analyst and former NBA center Kendrick Perkins brought up Kevin Durant's leadership abilities once again after the Phoenix Suns superstar called him out…,https://bleacherreport.com/articles/10154026-video-kendrick-perkins-calls-out-kevin-durants-suns-leadership-after-trade-deadline
"Bronny James Scores 28, Excites NBA Fans as G League Lakers Defeat Suns",2025-02-08 13:04:15 (KST),"Bronny James put the South Bay Lakers on his back in Friday night's action.
The 19-year-old led all scorers with 28 points while adding six rebounds, two…",https://bleacherreport.com/articles/10154032-bronny-james-scores-28-excites-nba-fans-as-g-league-lakers-defeat-suns
"A Fancy Feast of Feline Feel-Goods for Pet Pawrents Battling the Winter Blues (February 8th, 2025)",2025-02-08 20:00:00 (KST),"Another Caturday, another feline feel-good.
You know the deal, cat meowthers and pawthers.
Today is one of many days you should set aside for your favorite feline friend, especially because you probably have the day off of work and you can give them all of yo…",https://cheezburger.com/39115525/a-fancy-feast-of-feline-feel-goods-for-pet-pawrents-battling-the-winter-blues-february-8th-2025
Why has Pakistan’s Punjab province imposed a complete ban on kite flying?,2025-02-08 14:10:19 (KST),"The new penalties will also target kite makers and transporters, in addition to those who fly kites.",https://www.aljazeera.com/features/2025/2/8/why-has-pakistans-punjab-province-imposed-a-complete-ban-on-kite-flying
OnePlus smartphone launch roadmap leaks,2025-02-08 11:03:01 (KST),"Today in China, OnePlus has had its entire 2025 smartphone release roadmap leaked.
It all starts with the OnePlus 13T, which is apparently the name under which the OnePlus 13 Mini is actually launching - in April.
Then, in May, the brand will release the One…",https://www.gsmarena.com/oneplus_smartphone_launch_roadmap_leaks-news-66447.php
"20 million OpenAI users hacked? Here’s how to stay safe, just in case",2025-02-08 19:00:00 (KST),"Have you ever tried ChatGPT? You may want to take a quick moment to freshen up your account’s security.
A Russian hacker is claiming to have login data for over 20 million OpenAI users—and the information includes email addresses and passwords.
On Friday, sam…",https://www.pcworld.com/article/2602780/20-million-openai-users-hacked-heres-how-to-stay-safe.html
‘Angry Chef’: 80 Funny And Relatable Food And Cooking Memes,2025-02-08 09:00:31 (KST),"Food and cooking have the potential to bring us all together.
After all, eating is something that all human beings have to do.
So, sitting down for a shared meal has the potential to strengthen your relationships with your family, friends, coworkers, communit…",https://www.boredpanda.com/funny-cooking-chef-memes/
"Insomniac Games pitched a ""wonderful concept"" for Resistance 4, but Sony said no",2025-02-08 09:04:45 (KST),"It's been over 14 years since developer Insomniac's fondly remembered alternate history shooter series drew to a close with Resistance 3, but it turns out fans might have seen a fourth entry if the studio had got its way.
Outgoing Insomniac boss has revealed …",https://www.eurogamer.net/insomniac-games-pitched-a-wonderful-concept-for-resistance-4-but-sony-said-no
"Critics Choice Awards Host Chelsea Handler Slays In Opening Monologue; Roasts Blake Lively, Justin Baldoni, Ralph Fiennes & Colin Farrell",2025-02-08 09:22:02 (KST),"Without saying the actual words ‘Donald Trump’, Critics Choice Awards host Chelsea Handler fired up her monologue with jokes where Golden Globe host Nikki Glaser feared to go: Blake Lively and Justin Baldoni.
“Thank you for providing us with distraction,” Han…",http://deadline.com/2025/02/critics-choice-awards-chelsea-handler-opening-monologue-2025-blake-lively-justin-baldoni-1236281704/
Have You Seen John Carpenter’s 7 Best Movies?,2025-02-08 09:00:00 (KST),Can you even call yourself a Carpenter fan if you haven't seen these 7 epic films?,https://thoughtcatalog.com/richard-chachowski/2025/02/have-you-seen-john-carpenters-7-best-movies/
Velocity Micro Vector Z35 review: built to last,2025-02-08 14:00:00 (KST),Can a mid-range white-glove custom build meet your needs?,https://www.creativebloq.com/tech/computers/velocity-micro-vector-z35-review-built-to-last
