Title,Published(Kor),Description,Link
How Is Kalshi Not Gambling?,2026-03-04 20:00:00 (KST),"Kalshi lets you place bets on everything from football games to foreign invasions.
The prediction market’s CEO, Tarek Mansour, says this doesn’t count as gambling—and is actually good for society.",https://www.wired.com/story/big-interview-tarek-mansour-kalshi/
The Uncanny Valley,2026-03-04 19:03:00 (KST),"It used to be an obscure oddity, now we all need to understand it.
18 years ago, I posted this image: …and I still can’t get it out of my head.
Sorry.
Why do we have such a creeped-out reaction to images that aren’t quite right? A robot that looks too much li…",https://seths.blog/2026/03/the-uncanny-valley/
CoreWeave's new AI investment: Chance the Rapper,2026-03-04 18:47:01 (KST),CoreWeave enlisted Chance the Rapper for a new marketing push at a crucial moment in the AI hype cycle as investors worry about spending.,https://www.businessinsider.com/inside-ai-company-coreweave-chance-the-rapper-marketing-push-2026-3
I'm a CMO who uses a '10-80-10' rule with AI. It's transformed everything from photo shoots to customer feedback.,2026-03-04 18:22:01 (KST),"Alan Magee, CMO at Orangetheory franchisee Empire Portfolio Group, is using AI to spot data trends and save time on photo shoots and customer reviews.",https://www.businessinsider.com/empire-cmo-using-10-80-10-rule-manage-ai-transformation-2026-3
Inside SKALA: How Chernobyl’s Reactor Was Actually Controlled,2026-03-04 12:00:11 (KST),"Running a nuclear power plant isn’t an easy task, even with the level of automation available to a 1980s Soviet RBMK reactor.
In their continuing efforts to build a full-sized, functional rep…",https://hackaday.com/2026/03/03/inside-skala-how-chernobyls-reactor-was-actually-controlled/
OpenAI investor Vinod Khosla predicts today’s 5-year-olds won’t ever need to get jobs thanks to AI,2026-03-04 18:42:00 (KST),"“The need to work will go away,” Khosla said.
“People will still work on the things they want to work on, not because they need to work.”",https://finance.yahoo.com/news/openai-investor-vinod-khosla-predicts-094200688.html
31.6 Million ETH Leaves Exchanges as Vitalik Calls for Ethereum “Sanctuary” Tech,2026-03-04 16:02:49 (KST),"ETH accumulation off exchanges continues to surge in early March, while Vitalik Buterin calls for building sanctuary technologies for ETH.",https://beincrypto.com/investors-accelerate-eth-withdrawals-from-cexs/
Amazon Has a Brilliant Discount on Edge of Eternities Boosters Today,2026-03-04 20:29:00 (KST),"Score a discount on the best MTG set of 2025, with booster bundles back in stock and discounted at Amazon today.",https://www.ign.com/articles/amazon-has-a-brilliant-discount-on-edge-of-eternities-boosters-today
The JVG algorithm could break RSA-2048 encryption with fewer than 5k qubits,2026-03-04 21:04:21 (KST),"A breakthrough quantum algorithm could shatter global encryption years ahead of schedule, forcing an urgent race to secure our digital world from a new threat.",https://briefglance.com/articles/new-quantum-algorithm-warns-of-an-accelerated-crypto-apocalypse
Early benchmarks show the likely performance gains of the iPad Air’s new M4 chip,2026-03-04 12:29:43 (KST),"As it usually happens when new Apple products are about to hit the shelves, early Geekbench benchmark results are already making the rounds.
Here’s how two results credited to the M4 iPad Air turned out.
more…",https://9to5mac.com/2026/03/03/early-benchmarks-show-the-likely-performance-gains-of-the-ipad-airs-new-m4-chip/
Google and iVerify reveal government-grade iPhone exploit kit spreading to hackers,2026-03-04 10:02:09 (KST),"Google’s Threat Intelligence Group and security company iVerify have shared details about Coruna, an exploit kit that chains multiple vulnerabilities to target iPhones running older iOS versions.
Here are the details.
more…",https://9to5mac.com/2026/03/03/google-and-iverify-reveal-government-grade-iphone-exploit-kit-spreading-to-hackers/
See the world’s oldest fossilized ‘butthole’ imprint,2026-03-04 20:30:00 (KST),"Fossils show exceptionally rare evidence of a cloacal vent—the slit that most vertebrates use to excrete, have sex and lay egg—which could shed light on the evolution of the orifice",https://www.scientificamerican.com/article/see-the-worlds-oldest-fossilized-butthole-imprint/
This BBC tech reporter hacked ChatGPT with a simple trick involving hot dogs,2026-03-04 20:00:00 (KST),BBC tech journalist Thomas Germain’s simple—and hilarious—experiment exposes a serious flaw in common artificial intelligence tools,https://www.scientificamerican.com/podcast/episode/this-bbc-tech-reporter-hacked-chatgpt-with-a-simple-trick-involving-hot-dogs/
The Inherited Furniture Dilemma: 17 Ways to Honor Gifts Without Sacrificing Style,2026-03-04 21:30:00 (KST),"Most homes hold at least one object that wasn’t chosen , it was inherited.
A China cabinet from your grandmother.
A heavy bedroom set from your parents.
A chair you never would have bought yourself, but could never give away.
These pieces carry stories, love,…",https://www.home-designing.com/the-inherited-furniture-dilemma-17-ways-to-honor-gifts-without-sacrificing-style
L’Arcom ordonne aux opérateurs français de bloquer 35 sites pro-russes,2026-03-04 18:30:42 (KST),"Le gendarme de l'audiovisuel français frappe fort en demandant le blocage et le déréférencement de dizaines de sites liés à des médias russes.
Orange, Free, SFR et Bouygues sont en première ligne.",https://www.journaldugeek.com/2026/03/04/larcom-ordonne-aux-operateurs-francais-de-bloquer-35-sites-pro-russes/
Apple Maps just did something I never expected,2026-03-04 21:00:16 (KST),"The Apple Maps service is now accessible on Android devices, but it's not the cross-platform solution you might expect.",https://www.makeuseof.com/apple-maps-just-did-something-i-never-expected/
"I used to count down to the next Android version, but now I barely notice",2026-03-04 19:00:40 (KST),"In the early days of Android I found that every new version jump was like a major event, but the excitement has died over time.",https://www.androidauthority.com/android-next-version-hype-3635689/
"YggTorrent Shuts Down After Hack, Leak and Stolen Crypto",2026-03-04 19:15:14 (KST),"YggTorrent, the largest francophone torrent community, has shut down permanently following a devastating hack.
The cyberattack compromised YggTorrent's infrastructure, wiped key information, and drained the site's crypto wallets.
The hacker publicly published…",https://torrentfreak.com/yggtorrent-shuts-down-after-hack-leak-and-stolen-crypto/
One Piece's Creator Finally Revealed What The Treasure Actually Is – But There's A Catch,2026-03-04 09:00:00 (KST),The creator of the hugely popular One Piece is sending fans on a real life treasure hunt to solve one of the biggest mysteries in the series.,https://www.slashfilm.com/2115133/one-piece-creator-eiichiro-oda-reveals-treasure/
