Title,Published(Kor),Description,Link
The Untold Story of the Birth of the iPhone,2026-03-03 20:00:00 (KST),"Apple turns 50 on April 1.
In his new book, “Apple: The First 50 Years,” David Pogue chronicles the secrecy-laden environment in which Steve Jobs willed the first iPhone into existence.",https://www.wired.com/story/the-untold-story-of-the-birth-of-the-iphone-david-pogue-book-excerpt/
"U.S. evacuates diplomats from Middle East. And, what to expect from N.C., Texas primaries",2026-03-03 21:36:29 (KST),"The U.S.
has evacuated diplomats in the Middle East and closed several embassies as war in Iran intensifies.
And, what to expect from the Senate races in the North Carolina and Texas primary elections.",https://www.npr.org/2026/03/03/g-s1-112278/up-first-newsletter-iran-us-israel-middle-east-nc-texas-primaries-kristi-noem-bill-clinton
The candy heir vs. chocolate skimpflation,2026-03-03 20:30:00 (KST),"The grandson of the Reese's Peanut Butter Cups creator has launched a campaign against The Hershey Company, which owns the Reese's brand.
He wants them to stop skimping on ingredients.",https://www.npr.org/sections/planet-money/2026/03/03/g-s1-111940/the-candy-heir-vs-chocolate-skimpflation
The 19th Century Silent Film That First Captured a Robot Attack,2026-03-03 19:00:00 (KST),"The Library of Congress has restored Gugusse et l'Automate, an 1897 short by Georges Melies that likely features the first robot ever shown on film.
Long thought lost, the reel was discovered in a box of decaying nitrate films donated from a Michigan family c…",https://hardware.slashdot.org/story/26/03/03/0439237/the-19th-century-silent-film-that-first-captured-a-robot-attack
Trump administration's mixed messaging on war with Iran: ANALYSIS,2026-03-03 12:20:20 (KST),"Now days into President Donald Trump's war against Iran, much of the administration's messaging has been confusing or contradictory.",https://abcnews.com/Politics/trump-administrations-mixed-messaging-war-iran-analysis/story?id=130691261
"Capcom Pulls Enigma DRM From Resident Evil 4 Remake, Following Performance Complaints",2026-03-03 20:24:48 (KST),"Capcom has removed a controversial new form of DRM from Resident Evil 4 Remake, following complaints that its recent addition was impacting performance.",https://www.ign.com/articles/capcom-pulls-enigma-drm-from-resident-evil-4-remake-following-performance-complaints
In Defense of Effeminate Gay Boys,2026-03-03 20:00:00 (KST),"If anyone had suggested that I might really be a girl, I don’t know how I would have responded.",https://www.theatlantic.com/ideas/2026/03/gay-boys-lgbtq-trans/686179/
I built a pint-sized Macintosh,2026-03-03 16:06:22 (KST),"To kick off MARCHintosh, I built this tiny pint-sized Macintosh with a Raspberry Pi Pico: This is not my own doing—I just assembled the parts to run Matt Evans' Pico Micro Mac firmware on a Raspberry Pi Pico (with an RP2040).
The version I built outputs to a …",https://www.jeffgeerling.com/blog/2026/pint-sized-macintosh-pico-micro-mac/
Arm's Cortex X925: Reaching Desktop Performance,2026-03-03 16:34:47 (KST),"A big, high performance core from Arm",https://chipsandcheese.com/p/arms-cortex-x925-reaching-desktop
Apple @ Work Podcast: 2 steps forward with cyber security using local AI,2026-03-03 20:00:00 (KST),"Apple @ Work is exclusively brought to you by Mosyle, the only Apple Unified Platform.
Mosyle is the only solution that integrates in a single professional-grade platform all the solutions necessary to seamlessly and automatically deploy, manage & protect App…",https://9to5mac.com/2026/03/03/2-steps-forward-with-cyber-security-using-local-ai/
"Security Bite Podcast: RCS finally gets end-to-end encryption, 1Password blowback, more",2026-03-03 10:23:09 (KST),"9to5Mac Security Bite is exclusively brought to you by Mosyle, the only Apple Unified Platform.
Making Apple devices work-ready and enterprise-safe is all we do.
Our unique integrated approach to management and security combines state-of-the-art Apple-specifi…",https://9to5mac.com/2026/03/02/security-bite-podcast-rcs-finally-gets-end-to-end-encryption-1password-blowback-more/
This Pokémon-style birding app is the only reason I'm going outside this weekend,2026-03-03 20:00:10 (KST),Birdex turns your real-life sightings into a Pokédex,https://www.androidpolice.com/this-pokemon-birding-app-is-only-reason-im-going-outside/
Experimental composer Holly Herndon built an AI voice clone that anyone can use,2026-03-03 21:30:00 (KST),Experimental composer Holly Herndon says this technology isn’t here to replace artists—and that the future of creativity belongs to collective intelligence,https://www.scientificamerican.com/article/experimental-composer-holly-herndon-built-an-ai-voice-clone-that-anyone-can/
Will El Niño return in 2026? Here’s what we know so far,2026-03-03 19:00:00 (KST),"Weather events like El Niño can be notoriously hard to predict, but this year could mark its return",https://www.scientificamerican.com/article/will-el-nino-return-in-2026-heres-what-we-know-so-far/
Help yourself to stronger immunity,2026-03-03 20:00:00 (KST),"Supplements, surprising treatments, immunity-boosting vaccines and even exercises can help the immune system do its job",https://www.scientificamerican.com/article/help-yourself-to-stronger-immunity/
Are prime numbers hiding inside black holes?,2026-03-03 20:30:00 (KST),The strange case for prime numbers at the heart of physics,https://www.scientificamerican.com/article/are-prime-numbers-hiding-inside-black-holes/
"Would aliens do physics, or is science a human invention?",2026-03-03 18:00:18 (KST),"Shaped by a different biology or culture, other intelligent civilisations – if they’re out there – might understand the universe in a completely different way than we do.
Physicist Daniel Whiteson explores what that could tell us about physics and ourselves",https://www.newscientist.com/article/2516990-would-aliens-do-physics-or-is-science-a-human-invention/
"The Adventures of Prince Achmed, the Oldest Surviving Animated Feature Film, Is Now in the Public Domain (1926)",2026-03-03 19:00:12 (KST),"Die Abenteuer des Prinzen Achmed, or The Adventures of Prince Achmed, lays fair claim to being the earliest animated feature film in existence.
If we do grant it that title, it beats the next contender by more than a decade.
While Prince Achmed came out a cen…",https://www.openculture.com/2026/03/the-adventures-of-prince-achmed-the-oldest-surviving-animated-feature-film.html
Why ‘quantum proteins’ could be the next big thing in biology,2026-03-03 09:00:00 (KST),Fluorescent proteins with a quantum upgrade could offer unprecedented views inside cells.,https://www.nature.com/articles/d41586-026-00662-1
How infighting led the Maya civilization to catastrophic collapse,2026-03-03 09:00:00 (KST),Fresh archaeological evidence hints at what caused the disappearance of this thriving ancient Mesoamerican culture.,https://www.nature.com/articles/d41586-026-00663-0
