Title,Published(Kor),Description,Link
Meta Has Smart Glasses Spiraling Towards Glasshole 2.0,2026-03-16 20:30:15 (KST),Maybe using people's naked videos to train AI wasn't such a good idea after all.,https://gizmodo.com/meta-has-smart-glasses-spiraling-towards-glasshole-2-0-2000733361
The Fairphone 6 is getting Android 16 earlier than expected,2026-03-16 20:36:34 (KST),"Fairphone is rolling out Android 16 to the Fairphone 6 today, bringing smarter notifications, stronger scam protections, and handy upgrades.",https://www.androidcentral.com/phones/the-fairphone-6-is-getting-android-16-earlier-than-expected
I was Facebook's youngest engineer at 17. I left Meta at a moment when AI's lead can change every few months.,2026-03-16 18:00:01 (KST),"An ex-Meta product executive, once Facebook's youngest engineer, joins Whop, highlighting AI's impact on tech and startup dynamics.",https://www.businessinsider.com/facebooks-youngest-engineer-at-17-leaving-meta-2026-3
"Senate prepares to vote on Trump's SAVE Act. And, takeaways from last night's Oscars",2026-03-16 20:28:21 (KST),"Senate Republicans are gearing up to vote on President Trump's controversial voting overhaul, the SAVE America Act.
And, key takeaways from the 2026 Oscars.",https://www.npr.org/2026/03/16/g-s1-113909/up-first-newsletter-middle-east-war-trump-voting-act-academy-awards
"As parents clamor for a treatment touted for autism, doctors hesitate to prescribe it",2026-03-16 18:00:00 (KST),"After the leucovorin got public attention as a potential autism treatment, families rushed to get it.
Many doctors are torn about prescribing an unproven drug but don't want to lose patients' trust.",https://www.npr.org/2026/03/16/nx-s1-5742676/leucovorin-autism-parents-treatment-prescribe
Sodium-Ion Battery Tested for Grid-Scale Storage in Wisconsin,2026-03-16 20:36:00 (KST),"""A new type of battery storage is about to be deployed on the Midwestern grid for the first time,"" reports Electrek: Sodium-ion battery storage manufacturer Peak Energy and global energy company RWE Americas will pilot a passively cooled sodium-ion battery …",https://hardware.slashdot.org/story/26/03/16/0320222/sodium-ion-battery-tested-for-grid-scale-storage-in-wisconsin
Our March Madness bracket is all business,2026-03-16 18:35:09 (KST),"Business Insider kicks off its March Madness bracket, featuring eight top business trends, including SaaS, private credit, and robotics.",https://www.businessinsider.com/march-madness-bracket-business-trends-saas-private-credit-voting-2026-3
3 digital nomads in Bali share the career journeys that led them to the tropical paradise,2026-03-16 09:00:01 (KST),"Three entrepreneurs — a consultant, supplements founder, and content creator — outline the global career twists that led them to Bali.",https://www.businessinsider.com/digital-nomads-career-pivots-led-them-bali-travel-backpacking-entrepreneurship-2026-3
Nissan Kills NissanConnect EV for Cars Made as Late as 2022,2026-03-16 18:30:04 (KST),Obsolescence is sneaking up on all the apps linking cars to smartphones.,https://gizmodo.com/nissan-kills-nissanconnect-ev-for-cars-made-as-late-as-2022-2000733816
I Love FreeBSD,2026-03-16 20:23:14 (KST),"A personal reflection on my first encounter with FreeBSD in 2002, how it shaped the way I design and run systems, and why its philosophy, stability, and community still matter to me more than twenty years later.",https://it-notes.dragas.net/2026/03/16/why-i-love-freebsd/
Samsung's Privacy Display is the sort of innovation smartphones really need,2026-03-16 21:30:11 (KST),Give the people what they need!,https://www.androidpolice.com/samsungs-privacy-display-innovation-smartphones-really-need/
"Everybody fights, no-one goes AFK in Starship Troopers: Ultimate Bug War, the new FPS from the makers of Warhammer 40K Boltgun",2026-03-16 19:37:31 (KST),"Starship Troopers: Ultimate Bug War is out today on PC.
It's another licensed retro first-person shooter from Auroch Digital, the creators of Warhammer 40,000: Boltgun.
It casts you as a Mobile Infantry soldier wrassling with the Arachnids on a bunch of human…",https://www.rockpapershotgun.com/everybody-fights-no-one-goes-afk-in-starship-troopers-ultimate-bug-war-the-new-fps-from-the-makers-of-warhammer-40k-boltgun
"Fallout Chicago, a DLC-sized New Vegas mod about the Brotherhood of Steel fighting a union mob, has a first demo out now",2026-03-16 19:17:56 (KST),"A chunky Fallout: New Vegas expansion mod which sees the courier set off east to the post-apocalyptic Illinois has released its first demo.
No prizes for guessing where this mod - Fallout Chicago - is set.
Though, you might want to brush up on your knowledge …",https://www.rockpapershotgun.com/fallout-chicago-a-dlc-sized-new-vegas-mod-about-the-brotherhood-of-steel-fighting-a-union-mob-has-a-first-demo-out-now
"Oil shock, nuclear doubts, climate‑change-driven hail, and new insights on the aging-gut-brain connection",2026-03-16 19:00:00 (KST),"From emergency oil reserves to nuclear scrutiny, bigger hail, and research on a connection between the aging gut and the brain",https://www.scientificamerican.com/podcast/episode/oil-shock-nuclear-doubts-climate-change-driven-hail-and-new-insights-on-the/
A 100-year-old theory might explain what’s wrong with quantum mechanics,2026-03-16 19:30:00 (KST),One physicist is on a mission to get scientists to look into Louis de Broglie’s pilot wave theory,https://www.scientificamerican.com/article/a-100-year-old-theory-might-explain-whats-wrong-with-quantum-mechanics/
Sennheiser CX 80U Review: Affordable USB-C wired earbuds with impressive sound,2026-03-16 21:34:11 (KST),Macworld At a glance Expert's Rating Pros Low price USB-C wired connection High-res support Comfortable fit Cons Wired-only No IP-rating No noise-can…,https://www.macworld.com/article/3062002/sennheiser-cx-80u-review.html
Repopulate! Repopulate! Two lost Doctor Who episodes turn up in private collection,2026-03-16 12:35:29 (KST),Two pieces of dark Dalek drama to stream this April Film preservation organization Film Is Fabulous! has found a pair of Doctor Who episodes thought to have been lost forever.…,https://www.theregister.com/2026/03/16/lost_doctor_who_episodes_found/
The Fascinating Engineering of the Titanic: How the Great Ocean Liner Was Built,2026-03-16 18:00:17 (KST),"When many of us first learned of the RMS Titanic, it was presented first as one of history’s greatest ironies: the “unsinkable” ocean liner that went down on its maiden voyage.
Of course, there’s a great deal more to the story, as anyone who becomes obsessed …",https://www.openculture.com/2026/03/the-fascinating-engineering-of-the-titanic-how-the-great-ocean-liner-was-built.html
AI and the PhD student: friend or foe?,2026-03-16 09:00:00 (KST),"Graduate students increasingly use artificial-intelligence tools to draft, code and search — but many fear it could erode the very skills a doctorate is meant to build.",https://www.nature.com/articles/d41586-026-00843-y
Trump Tariffs Have Made This the Worst Time for American Wine in Literally Decades,2026-03-16 20:38:04 (KST),"An American winery closed almost every day of 2025, as Trump tariffs resulted in an almost 80% drop of Canadian consumption of U.S.
wine.",https://www.jezebel.com/american-wine-industry-struggles-challenges-sales-tariffs-exports-decline-canada-closures-trump
