Title,Published(Kor),Description,Link
Amazon Has Made a Robot With a Sense of Touch,2025-05-07 17:00:00 (KST),"Vulcan, a robot with tactile senses, is a step towards automating more of picking and stowing work done by humans inside Amazon’s fulfillment centers.",https://www.wired.com/story/ai-lab-amazon-launches-vulcan-a-robot-that-can-feel/
Matter’s latest update brings tap-to-pair setup,2025-05-07 20:59:19 (KST),"Two new features coming to Matter are designed to make setting up smart gadgets easier.
Multi-device QR codes and a tap-to-pair onboarding via NFC are new options for adding devices like smart lights, plugs, locks, and more to a Matter home network.
The updat…",https://www.theverge.com/news/662266/matter-spec-update1-4-1-nfc-multi-device-setup
Joe Biden on Trump: 'What president ever talks like that? That's not who we are',2025-05-07 14:05:25 (KST),"The former president on his successor's first 100 days and his ""grave concern"" for the future of the Atlantic Alliance",https://www.bbc.com/news/articles/c89g491e8ewo
Google app on iOS gets a new feature that will 'Simplify' text online,2025-05-07 09:18:33 (KST),Simplify will spot jargon or technical concepts and make them understandable for the user.,https://www.androidcentral.com/apps-software/google-assistant/google-app-on-ios-gets-a-new-feature-that-will-simplify-text-online
Google's May 2025 Pixel update is here with bug fixes and a critical security patch,2025-05-07 09:31:09 (KST),"If you have a Google Pixel device, check for the May 2025 security patch immediately — it includes must-install, zero-day fixes.",https://www.androidcentral.com/apps-software/android-os/google-may-2025-pixel-update-is-here
"Fed Plans to Pause Interest Rate Cuts, Again. Here's Why You Should Care",2025-05-07 21:00:00 (KST),"Tariffs are threatening higher inflation, and that's putting pressure on the Fed to keep borrowing costs high.",https://www.cnet.com/personal-finance/banking/fed-plans-to-pause-interest-rate-cuts-again-heres-why-you-should-care/
"SCOTUS upholds Trump's transgender military ban. And, the papal conclave begins",2025-05-07 19:36:52 (KST),"The Supreme Court has allowed the Trump Administration to start executing its ban on trans military service members.
And, the conclave to elect the Catholic Church's new leader begins today.",https://www.npr.org/2025/05/07/g-s1-64703/up-first-newsletter-ban-transgender-military-pope-conclave-india-pakistan
"Word of the Week: Before the Birdman of Alcatraz, the island was known for its birds",2025-05-07 18:00:00 (KST),"The origin story of Alcatraz's name is a complicated mix of language, a history that dates back to the first Europeans to explore the coast of California, and, a flock of seabirds.",https://www.npr.org/2025/05/07/nx-s1-5388377/alcatraz-prison-island-trump-pelicans
Amazon's Zoox Robotaxi Unit Issues Software Recall After Recent Las Vegas Crash,2025-05-07 09:45:00 (KST),"Amazon's Zoox said it has issued a software recall for 270 of its robotaxis after a crash in Las Vegas last month.
CNBC reports: The recall surrounds a defect with the vehicle's automated driving system that could cause it to inaccurately predict the movement…",https://tech.slashdot.org/story/25/05/06/2141257/amazons-zoox-robotaxi-unit-issues-software-recall-after-recent-las-vegas-crash
Biden said Trump's pressure on Ukraine to give up territory to Russia is 'modern-day appeasement',2025-05-07 19:33:25 (KST),"In his first interview since leaving the White House, Biden told the BBC that Trump's approach to Russia is 'modern-day appeasement' that won't work.",https://www.businessinsider.com/biden-calls-trump-administration-ukraine-russia-approach-putin-appeasement-2025-5
Some importers are looking to park their stuff in a special type of warehouse until Trump makes up his mind on tariffs,2025-05-07 18:59:01 (KST),"Demand for bonded warehousing, in which cargo is exempt from tariffs for up to five years, skyrocketed in April, according to Flexe data shared with BI.",https://www.businessinsider.com/importers-demand-bonded-warehouses-us-increase-2025-5
Even Marvel has superhero fatigue. Its 'Thunderbolts*' marketing appeals to a new audience: cinephiles.,2025-05-07 20:42:41 (KST),"Marvel has referenced the industry darling A24 in its ""Thunderbolts*"" advertising, and nodded to stunt-heavy movies like ""Mission Impossible."" Will it be enough to cure superhero fatigue?",https://www.businessinsider.com/thunderbolts-a24-trailer-marvel-superhero-fatigue-marketing-new-audience-cinephiles-2025-5
Exclusive: Eyeo exits stealth to give cameras human-like colour vision,2025-05-07 09:01:35 (KST),"Dutch startup Eyeo has emerged from stealth with €15mn in funding to advance a breakthrough photonics technology for cameras that could radically disrupt the way we take images.
Eyeo spun out last year from Belgium’s Imec, one of the world’s leading nanoelect…",https://thenextweb.com/news/exclusive-eyeo-startup-exits-stealth-to-give-cameras-human-like-colour-vision
Elite Palm Beach Fire-Rescue team takes part in statewide rescue competition,2025-05-07 18:01:52 (KST),The specialized team competed May 1 at the Palm Beach State Invitational at Palm Beach State College.,https://www.palmbeachdailynews.com/story/news/local/2025/05/07/palm-beach-fire-rescue-rapid-intervention-team-takes-on-competition/83453812007/
The Arts of the Deal,2025-05-07 18:30:00 (KST),Are NEA grant recipients the next to fall by the chainsaw?,https://slate.com/podcasts/what-next/2025/05/how-trump-is-attacking-the-arts
EA Bucks Industry Trend And Says It Has No Plans to Increase Video Game Prices,2025-05-07 21:00:24 (KST),Publisher/ developer EA has confirmed it has no plans to raise the price of its games even as the likes of Microsoft and Nintendo jump to $80.,https://www.ign.com/articles/ea-bucks-industry-trend-and-says-it-has-no-plans-to-increase-video-game-prices
The Surprising History of Romantic Advice,2025-05-07 21:00:00 (KST),A 17th-century column shows that dating has always been an anxiety-riddled endeavor.,https://www.theatlantic.com/books/archive/2025/05/i-humbly-beg-your-speedy-answer-book-review/682714/
'Why would we play Putin's game?': Ukrainians see Russian lull as sideshow,2025-05-07 20:37:10 (KST),Russia is expected to begin a self-declared three-day pause in fighting against Ukraine on Wednesday night.,https://www.bbc.com/news/articles/c5y4y2252j3o
