Title,Published(Kor),Description,Link
Google’s iOS app will use AI to simplify jargon,2025-05-06 20:43:18 (KST),"Google has a new AI tool that can help iPhone users to better grasp complicated or confusing writing online.
The Simplify feature, rolling out in the Google app on iOS starting today, generates a simpler, more digestible version of any highlighted text withou…",https://www.theverge.com/news/661695/google-simplify-ai-gemini-feature-ios-app
"First Price Drop Comes Early, Beats Powerbeats Pro 2 Now at Its Lowest Yet on Amazon",2025-05-06 21:20:11 (KST),Save 20% on the Beats Powerbeats Pro 2 wireless Bluetooth earbuds for a limited time.,https://gizmodo.com/first-price-drop-comes-early-beats-powerbeats-pro-2-now-at-its-lowest-yet-on-amazon-2000598237
Visa applications for some nationalities could be restricted,2025-05-06 16:55:56 (KST),"People from Pakistan, Nigeria and Sri Lanka may find it more difficult to come to the UK, under new plans.",https://www.bbc.com/news/articles/cn0wd75ne82o
'That's me': Man from VE Day photo recalls life in bombed city,2025-05-06 13:52:33 (KST),"How Hull, the most heavily bombed city outside London, marked victory in 1945.",https://www.bbc.com/news/articles/cm2x0x5jvk8o
"Trump and Canadian PM to meet today. And, the best Met Gala looks",2025-05-06 19:28:39 (KST),"Trump and Canadian Prime Minister Mark Carney are set to meet today as tensions between their two countries rise.
And, the best looks from last night's star-studded Met Gala.",https://www.npr.org/2025/05/06/g-s1-64488/up-first-newsletter-trump-mark-carney-abortion-pill-mifepristone-film-tariff-met-gala
"Most Americans use federal science information on a weekly basis, new poll finds",2025-05-06 19:00:00 (KST),"Most Americans frequently use federal science information.
But few are concerned that cuts to federal science spending could affect their access to such information, a new poll finds.",https://www.npr.org/2025/05/06/nx-s1-5387367/federal-science-opinion-use-poll
Trump expands military use at the southern border. Are there legal limits?,2025-05-06 18:00:00 (KST),"The Posse Comitatus Act restricts using federal troops in civilian law enforcement.
Exceptions exist, but Trump's crackdown on immigration is shaping up to be a major test for the law.",https://www.npr.org/2025/05/06/g-s1-63778/military-border-zone-posse-comitatus-explained
Hugo Administrators Resign in Wake of ChatGPT Controversy,2025-05-06 19:00:00 (KST),"""Another year, yet another Hugo Awards-adjacent controversy?"" writes Gizmodo's Cheryl Eddy, reporting that three key organizers of the 2025 Seattle Worldcon resigned after backlash over the use of ChatGPT to vet program participants.
From the report: In a pos…",https://slashdot.org/story/25/05/06/0139251/hugo-administrators-resign-in-wake-of-chatgpt-controversy
"EY CEO says AI won't decrease its 400,000-person workforce — but it might help it double in size",2025-05-06 18:04:01 (KST),"At the Milken conference, EY CEO Janet Truncale talked about how the consulting giant tests AI tools on its own workforce before recommending them.",https://www.businessinsider.com/ey-ceo-janet-truncale-ai-jobs-consulting-giant-2025-5
The rise of the college bed party: Parents are spending big bucks to announce their kid's college decision — and small business owners are cashing in,2025-05-06 18:07:01 (KST),"College bed parties have created a pathway to turn lucrative side-hustles into six-figure businesses.
BI spoke with consumers and business owners.",https://www.businessinsider.com/college-bed-parties-rise-business-owners-side-hustles-consumers-2025-5
"A millennial couple shares how they navigated the IVF process — and the $18,000 medical bill",2025-05-06 17:01:01 (KST),"Barrett and Shiraine McLeod told BI about their experience with IVF, how they covered the cost, and tips on navigating insurance.",https://www.businessinsider.com/insurance-fertility-ivf-costs-hsa-millennial-couple-infertility-2025-3
DoorDash buys Deliveroo for £2.9B — less than half its IPO price,2025-05-06 19:25:44 (KST),"US food delivery giant DoorDash has acquired British rival Deliveroo in a £2.9bn ($3.9bn) deal, ending the UK business’ rocky tenure as a public company.
The all-cash offer, priced at £1.80 ($2.40) per share, represents a 77% premium over Deliveroo’s recent …",https://thenextweb.com/news/doordash-buys-deliveroo-2-9-billion-less-than-ipo-food-delivery-startup-tech
Beyond the humanoid hype: Why specialized robots will dominate the next decade,2025-05-06 20:46:00 (KST),"Humanoid robots inspire awe, but purpose-built robots solving hard problems will rule in the near term.",https://tech.yahoo.com/computing/articles/beyond-humanoid-hype-why-specialized-114600542.html
Federal judge says results of North Carolina court race must be certified,2025-05-06 09:48:58 (KST),A federal judge has ruled that disputed ballots in the still unresolved 2024 race for a North Carolina Supreme Court seat must remain in the final count,https://abcnews.go.com/Politics/wireStory/federal-judge-results-north-carolina-court-race-democrat-121498405
How Gen Z is using AI to build personal brands — a guide that helped me build a LinkedIn presence that’s reached over 140 million,2025-05-06 20:00:00 (KST),"I started my career in modeling, which, as anyone in the industry knows, is basically a crash course in branding.
You learn very quickly how to present yourself online, especially on platforms like Instagram.
From there, I moved into sales and the world of B2…",https://blog.hubspot.com/marketing/how-gen-z-is-using-ai-to-build-personal-brands#article
Congressional Republicans Have Two Bad Options,2025-05-06 18:00:00 (KST),How to make sense of their stumbling progress—perhaps—toward a major fiscal bill,https://www.theatlantic.com/newsletters/archive/2025/05/congress-budget-bill-trump/682711/
The Death of Feminism,2025-05-06 19:00:00 (KST),Spice Girls slogans and reality-TV aesthetics: A new book traces how feminism morphed into clickable objectification.,https://www.theatlantic.com/podcasts/archive/2025/05/the-death-of-feminism/682704/
Hyper – Outperform React on every metric,2025-05-06 16:14:00 (KST),"Today I'm releasing Hyper: a simple markup language for building user interfaces.
It enables developers (and AI models) to generate complex UIs with amazingly clean syntax.
It aims to make frontend development enjoyable.",https://nuejs.org/blog/introducing-hyper/
An Interactive Debugger for Rust Trait Errors,2025-05-06 14:09:42 (KST),"Advanced type systems can cause bewhildering error messages and Rust's trait system certainly is no exception! In this paper we present Argus, an IDE extension for interactively debugging Rust traits, and the results of our user study where 25 developers debu…",https://cel.cs.brown.edu/blog/an-interactive-debugger-for-rust-trait-errors/
Apple @ Work Podcast: Root automatically patches vulnerabilities in container image,2025-05-06 19:00:00 (KST),"Apple @ Work is exclusively brought to you by Mosyle, the only Apple Unified Platform.
Mosyle is the only solution that integrates in a single professional-grade platform all the solutions necessary to seamlessly and automatically deploy, manage & protect App…",https://9to5mac.com/2025/05/06/root-automatically-patches-vulnerabilities-in-your-container-image/
