Title,Published(Kor),Description,Link
"The U.S. and China cut tariffs. And, what's expected from Trump's Middle East trip",2025-05-12 19:40:51 (KST),"The U.S.
and China ease the trade war with a significant cut to recently imposed tariffs.
And, President Trump's trip to the Middle East is expected to involve a lot of commerce and cultural exchanges.",https://www.npr.org/2025/05/12/g-s1-65865/up-first-newsletter-china-us-tariffs-middle-east-trump-boeing-edan-alexander
Alex Lieberman’s guide to personal branding: A step-by-step process for boosting your social presence,2025-05-12 20:00:00 (KST),"Hot take: I don’t think everyone needs a personal brand.
Plenty of businesses have expanded their reach with company social accounts as their mouthpieces.
However, executives and founders can create personal brands that supercharge growth.
How do I know? I’ve…",https://blog.hubspot.com/marketing/guide-to-personal-branding
The 10 Best Indie Soulslikes,2025-05-12 20:00:00 (KST),"The best indie soulslike games created by smaller and independent developers, from 2D pixelart boss rushes to epic 3D journeys.",https://www.ign.com/articles/best-indie-soulslikes
"This JBL Mini Bluetooth Speaker Is Back at Black Friday Prices, Amazon Clears Stock with 40% Off",2025-05-12 20:40:31 (KST),"If you want to bring HQ music to your outdoor activities, the JBL Clip 5 is a perfect choice.",https://gizmodo.com/this-jbl-mini-bluetooth-speaker-is-back-at-black-friday-prices-amazon-clears-stock-with-40-off-2000600848
Who Counts as Christian?,2025-05-12 20:00:00 (KST),A new initiative will necessitate that the Trump administration makes difficult judgment calls about the faith.,https://www.theatlantic.com/ideas/archive/2025/05/anti-christian-bias-task-force/682755/
Air Traffic Control,2025-05-12 09:39:22 (KST),Comments,https://computer.rip/2025-05-11-air-traffic-control.html
"Custom SIM card in Tesla Model 3 2024, Tesla Model Y 2025 and Cybertruck",2025-05-12 10:04:59 (KST),Comments,https://olegkutkov.me/2025/05/12/custom-sim-card-in-tesla-model-3-2024-tesla-model-y-2025-and-cybertruck/
The Academic Pipeline Stall: Why Industry Must Stand for Academia,2025-05-12 11:34:32 (KST),"The Research Pipeline is Stalling The U.S.
National Science Foundation (NSF) froze all outgoing funding, including new awards and scheduled payments on active grants.
Over 1,000 NSF research projec…",https://www.sigarch.org/the-academic-pipeline-stall-why-industry-must-stand-for-academia/
"Apple might increase iPhone 17 prices, but not reveal the true reason – WSJ",2025-05-12 20:08:07 (KST),"During Apple’s recent earnings call, CEO Tim Cook revealed that absorbing the impact of tariffs was likely to cost the company about $900M in the current quarter.
However, he refused to be drawn about whether we can expect iPhone 17 prices to be increased in …",https://9to5mac.com/2025/05/12/apple-might-increase-iphone-17-prices-but-not-reveal-the-true-reason-wsj/
Apple @ Work Podcast: Celebrating 10 years of the MacAdmins Community,2025-05-12 19:00:00 (KST),"Apple @ Work is exclusively brought to you by Mosyle, the only Apple Unified Platform.
Mosyle is the only solution that integrates in a single professional-grade platform all the solutions necessary to seamlessly and automatically deploy, manage & protect App…",https://9to5mac.com/2025/05/12/apple-work-celebrating-10-years-of-the-macadmins-community/
Knitting’s Complex Shapes Explained in New Physics Model,2025-05-12 19:45:00 (KST),A new mathematical model helps to advance the centuries-old art of knitting,https://www.scientificamerican.com/article/knittings-complex-shapes-explained-in-new-physics-model/
Breeding for ‘Cuteness’ Is Making Dogs and Cats Look More Alike,2025-05-12 20:00:00 (KST),"Pugs, Persian cats, and other smushed-face cats and dogs are more similar to one another than they are to the wild animals they evolved from",https://www.scientificamerican.com/article/breeding-for-cuteness-is-making-dogs-and-cats-look-more-alike/
"Kosmos-482 Falls, Cuttlefish Wave, and the Wealthy Warm the Climate",2025-05-12 19:00:00 (KST),"A spacecraft is set to fall from the skies, 28 U.S.
cities slowly sink, and a new study pinpoints how the overindulgence of the wealthy contributes to massive warming.",https://www.scientificamerican.com/podcast/episode/kosmos-482-falls-cuttlefish-wave-and-the-wealthy-warm-the-climate/
"Hamas to release Edan Alexander, last US hostage held in Gaza",2025-05-12 20:25:24 (KST),"Hamas announced it will release Edan Alexander, the last living American hostage in Gaza as part of an effort to reach a ceasefire and get humanitarian aid...",https://www.yahoo.com/news/hamas-release-edan-alexander-last-112524178.html
"Nashville among U.S. cities sinking due to this invisible threat, study says",2025-05-12 19:04:21 (KST),"Nashville is sinking, according to a new study published in the British journal Nature Cities.
Here's what to know.",https://www.tennessean.com/story/news/2025/05/12/nashville-american-cities-sinking-subsidence/83516744007/
"A museum opens at a former factory in the Czech Republic where Oskar Schindler saved 1,200 Jews",2025-05-12 20:14:10 (KST),"A dilapidated industrial site in the Czech Republic where German businessman Oskar Schindler saved 1,200 Jews during the World War II is coming back to life....",https://www.yahoo.com/news/museum-opens-former-factory-czech-111410007.html
Microsoft's Surface Pro 12-inch is a massive upgrade over the Surface Go 4 — Here's how this performance leap breaks down,2025-05-12 20:00:00 (KST),"Microsoft's new Surface Pro 12-inch is similar to the Surface Go 4 in that they're both compact 2-in-1 PCs.
But just how much better is the new Pro device?",https://www.windowscentral.com/hardware/surface/surface-pro-12-inch-vs-surface-go-4
