Title,Published(Kor),Description,Link
The Switch 2 Has Six Joyful Nintendo Touches You Should Look Out for at Launch,2025-05-19 20:00:49 (KST),Nintendo's Switch 2 Joy-Cons 2 will literally make music in the connection menu.,https://gizmodo.com/the-switch-2-has-six-joyful-nintendo-touches-you-should-look-out-for-at-launch-2000603556
Solving the mystery of a dinosaur mass grave at the 'River of Death',2025-05-19 14:06:24 (KST),A group of researchers have come to Pipestone Creek in Canada to figure out why thousands of dinosaurs are buried here.,https://www.bbc.com/news/articles/c0k3x8lmje1o
Samsung showcases Auracast's potential for hearing accessibility,2025-05-19 13:58:51 (KST),"At the event, attendees utilized Samsung Galaxy Buds 3 Pro or GN hearing aids to listen to audio from a single source — highlighting the Auracast's ability.",https://www.androidcentral.com/accessories/earbuds/samsung-and-gn-showcase-auracasts-potential-for-enhanced-hearing-accessibility
From Risky Bet to Retail Giant: Apple Store Turns 24 Today,2025-05-19 21:23:22 (KST),"Twenty-four years ago today, Apple embarked on what many industry experts considered a risky venture that would ultimately transform not just the company's fortunes, but retail itself.
On May 19, 2001, Apple opened its first retail store at Tysons Corner Cent…",https://www.macrumors.com/2025/05/19/apple-store-turns-24-today/
OWC Unveils 11-Port Thunderbolt 5 Dock With Triple Display Support,2025-05-19 19:38:14 (KST),"OWC today announced its new Thunderbolt 5 Dock, a high-performance connectivity hub designed for creative professionals and power users who need expanded port options for their setups.
The dock features three Thunderbolt 5 ports offering bi-directional d…",https://www.macrumors.com/2025/05/19/owc-thunderbolt-5-dock-triple-display-support/
Trump threatened school funding in Maine. Here's how that money is used,2025-05-19 19:00:00 (KST),"Schools in Maine are in the middle of a political and legal battle between the Trump administration and Gov.
Janet Mills.
Key programs for the most vulnerable students are at stake.",https://www.npr.org/2025/05/19/nx-s1-5398545/trump-schools-maine-education-funding
From PowerPoint to plumbing: Gen Z is pivoting to blue-collar jobs,2025-05-19 17:13:01 (KST),"In lieu of student-loan debt and white-collar automation, Gen Z has found a safe haven in old-school, blue-collar jobs.",https://www.businessinsider.com/gen-z-pivot-college-degrees-work-blue-collar-jobs-trades-2025-5
"Maine Lottery results: See winning numbers for Pick 3, Pick 4 on May 18, 2025",2025-05-19 18:00:03 (KST),Were you a lucky winner? Check your tickets for lottery draw games in Maine here.,https://www.usatoday.com/story/money/lottery/2025/05/19/maine-lottery-results-winning-numbers/83720088007/
"One child missing and another injured after train hits family on railroad bridge, killing two adults",2025-05-19 13:20:45 (KST),"At least two adults are dead, one toddler is injured, and a young child is missing after a train struck several pedestrians on a railroad bridge in Fremont, ...",https://www.cnn.com/2025/05/19/us/fremont-ohio-train-hits-pedestrians-hnk
Why You Might Want a Relationship Agreement—Even if You’re Monogmaous,2025-05-19 20:00:00 (KST),"""Monogamy is a diverse experience; it can be molded to fit what works for each couple,"" writes Myisha Battle.",https://time.com/7285862/relationship-agreements-monogamous-essay/
Political Leaders Offer Messages of Support to Former President Biden After Cancer Diagnosis,2025-05-19 14:00:00 (KST),"Democrats and Republicans, including Trump, have offered messages of sympathy and support.",https://time.com/7286363/biden-prostate-cancer-diagnosis-reactions-statements-support-political-leaders-trump/
"Designed to Win: TAG Heuer CEO Antoine Pin on Formula One, Emotion Over Technology and the Avant-Garde Future of Timekeeping",2025-05-19 11:16:00 (KST),"TAG Heuer is back at the Formula 1 Grand Prix in a HUGE way after a twenty year absence.
With a renewed focus on motor racing and bold innovations across the board, the brand’s recent momentum is m…",http://coolhunting.com/design/designed-to-win-tag-heuer-ceo-antoine-pin-on-formula-one-emotion-over-technology-and-the-avant-garde-future-of-timekeeping/
"Pavement Inspires a Strange, Loving Bio-Pic",2025-05-19 19:00:00 (KST),"Hua Hsu writes about the new movie “Pavements,” inspired by the band, written and directed by Alex Ross Perry and starring Stephen Malkmus, Scott Kannberg, Jason Schwartzman, and Zoe Lister-Jones.",https://www.newyorker.com/magazine/2025/05/26/pavement-inspires-a-strange-loving-bio-pic
Colum McCann’s Limp Novel of Digital Life,2025-05-19 19:00:00 (KST),"Katy Waldman reviews ""Twist,"" Colum McCann's new novel about the fibre-optic cable, the internet, and the way the two have changed the world.",https://www.newyorker.com/books/page-turner/colum-mccanns-limp-novel-of-digital-life
This Is Your Priest on Drugs,2025-05-19 19:00:00 (KST),"Religious leaders took psilocybin—the compound in magic mushrooms—in a Johns Hopkins and N.Y.U.
study.
Many are now evangelists for psychedelics.
Michael Pollan, the author of “How to Change Your Mind,” reports.",https://www.newyorker.com/magazine/2025/05/26/this-is-your-priest-on-drugs
When Men Weren’t Afraid to Love Their Friends,2025-05-19 21:00:00 (KST),"Passionate male friendships used to be celebrated.
What happened?",https://www.theatlantic.com/family/archive/2025/05/men-friendship-history/682815/
Big tech lawyers for Apple and others ‘actively encouraging lawlessness’,2025-05-19 20:13:32 (KST),"A WSJ piece today suggests that big tech lawyers for Apple, Amazon, Google and other industry giants are not only failing to properly advise their clients, but are “actively encouraging” them to break the law.
The piece suggests that one reason Apple was r…",https://9to5mac.com/2025/05/19/big-tech-lawyers-for-apple-and-others-actively-encouraging-lawlessness/
"iOS 19 to add new bilingual Arabic software keyboard, virtual calligraphy pen for Apple Pencil",2025-05-19 21:20:21 (KST),"Bloomberg’s Mark Gurman continues his iOS 19 tidbits streak by revealing two upcoming new features in the latest edition of his Power On newsletter, which was published today.
Gurman says that iOS 19 will include a major localization focus on supporting cu…",https://9to5mac.com/2025/05/19/ios-19-new-bilingual-keyboard-apple-pencil/
How Dinosaurs Shaped Fruit Evolution,2025-05-19 19:45:00 (KST),"By physically engineering their environments, megafauna such as dinosaurs curbed fruit seed sizes—a role that now may be filled by humans",https://www.scientificamerican.com/article/how-dinosaurs-shaped-fruit-evolution/
Where Did Kosmos-482 Land? No One Is Sure,2025-05-19 19:00:00 (KST),"Kosmos-482 crash-lands, physicists turn lead to gold and animals show some clever behaviors.",https://www.scientificamerican.com/podcast/episode/where-did-kosmos-482-land-no-one-is-sure/
