Title,Published(Kor),Description,Link
"더불어민주당 충남도당, 안중근의사기념사업회 회원 309명 이재명 후보...",2025-05-22 21:26:00 (KST),"/ 더불어민주당 충남도당 제공 이들은 이어 ""오늘날 우리가 살아가는 이 시대 또한 새로운 결단과 실천이 필요한 중대한 전환점에 서 있다""면서 ""갈라진 민심을 통합하고, 상처 입은 민생을 돌보고, 미래 세대를 위한...",http://www.newstnt.com/news/articleView.html?idxno=492240
"중부산림청, 생물다양성의 날 맞아 특별한 '백두대간 사랑운동' 진행",2025-05-22 21:26:00 (KST),"[사진제공=중부지방산림청] 중부지방산림청(이하 중부산림청)은 오늘(22일) 세계 생물다양성의 날을 맞아 산림 생태계 보전의 중요성을 널리 알리기 위해 '백두대간 사랑운동' 행사를 진행했다고 밝혔습니다.
이번...",http://www.paxetv.com/news/articleView.html?idxno=233528
[공공돋보기] 태극기 두른 손흥민이 쓴 역사,2025-05-22 21:26:00 (KST),"공공뉴스=김수연 기자 ""항상 꿈꿔왔던 순간이 오늘 현실이 됐다.
오늘만큼은 저도 토트넘의 레전드라고 말할 수 있을 것 같다"" 토트넘 홋스퍼의 주장 손흥민 선수가 마침내 유럽 무대 첫 우승 트로피를 들어 올린 후...",http://www.00news.co.kr/news/articleView.html?idxno=94354
"""부천이 키운 김문수, 부천에서 시작합니다"" … 김문수 수도권 집중 유...",2025-05-22 21:26:00 (KST),"유세 말미에는 손학규 전 경기도지사도 무대에 올라 ""오늘 아침 김문수 후보 지지선언을 했는데, 부천에 와보니 지지선언 안 해도 될 만큼 민심은 이미 김문수에게 있다""고 말했다.
그는 ""김 후보는 반도체 왕국 평택의...",https://www.newdaily.co.kr/site/data/html/2025/05/22/2025052200486.html
외국인 범죄 예방...경찰-중국총영사관 협력 강화,2025-05-22 21:25:00 (KST),"제주경찰청은 오늘(22) 주제주중국총영사관 진건군 총영사 등이 참석한 가운데 간담회를 열고, 외국인 범죄 예방과 법률 준수를 위한 홍보를 강화하기로 했습니다.
또 마약과 전화 금융 사기 등 초국경 범죄에 대해...",https://n.news.naver.com/mnews/article/661/0000055644?sid=102
[제주날씨] 내일 아침까지 안개 주의…저녁부터 최대 '60mm' 비,2025-05-22 21:25:00 (KST),"오늘도 해안가와 산간지역에는 안개가 자욱했는데요.
안개는 내일 아침부터 차차 물러나겠지만...
23도로 오늘과 비슷하겠고요.
내일 남원의 낮 기온은 20도로 오늘보다 4도가량 낮겠습니다.
이어서 산간지역은 한낮에...",https://n.news.naver.com/mnews/article/661/0000055643?sid=103
"""할 수 있는 만큼만 하세요""…하니, 마음의 쉼표→요가로 배운 자기 친...",2025-05-22 21:24:00 (KST),"오늘도 숨 쉬었고, 흘렀고, 그걸로 충분했다."" 하니는 이렇듯 담담한 언어로 스스로의 내면에 귀 기울이는...
팬들은 ""진정성이 느껴진다"", ""힘이 되는 메시지다"", ""오늘만큼은 스스로에게 관대해지고 싶어진다"" 등 공감과...",https://www.topstarnews.net/news/articleView.html?idxno=15674831
"""제가 공식 앰버서더가 되었습니다""…황찬성, 투명한 변화→클린뷰티로...",2025-05-22 21:24:00 (KST),"'어제보다 더 나은 오늘'이라는 브랜드의 철학에 공감합니다.
정직한 성분과 진정성 있는 제품 덕분에 매일 자연스럽게 피부 루틴이 완성되고 있어요.
뉴욕에서 온 클린뷰티 브랜드, 에즈오브투데이 앞으로 앰버서더로서...",https://www.topstarnews.net/news/articleView.html?idxno=15674830
"이준, 카리브 마지막 저녁식사 '감자탕'에 ""미치겠다 진짜 맛있어""",2025-05-22 21:24:00 (KST),"이준은 ""와 오늘이 개인적으로 너무 배고프네요 진짜 맛있게 먹을 수 있어""라며 배고픔에 힘들어하는 모습을 보였다.
그런 이준의 모습에 윤남노는 ""형은 배고프면 사람이 되게 다른 사람이 되네요""라고 했고 이준은 ""나...",https://www.slist.kr/news/articleView.html?idxno=645664
2025년 5월 23일 전국 곳곳에 빗방울 ‘톡톡’[오늘의 날씨],2025-05-22 21:24:00 (KST),,https://n.news.naver.com/mnews/article/032/0003371408?sid=103
중학교 교사 숨진채 발견...민원에 시달렸나?,2025-05-22 21:24:00 (KST),"그런데 오늘 제주지역의 한 중학교에서 교사가 숨진채 발견돼 충격을 주고 있습니다.
학생 가족의 지속적인 민원에 힘겨워 했던 것으로 전해지고 있는데, 경찰이 사건과 관련한 경위 조사에 나섰습니다.
김동은...",https://n.news.naver.com/mnews/article/661/0000055640?sid=102
"이재명, ""6.3 선거는 계엄 청산의 과정""",2025-05-22 21:24:00 (KST),"더불어민주당 이재명 대통령 후보가 오늘 제주를 찾았습니다.
이번 대통령 선거는 제주 4·3 이후 세 번째 계엄을 청산하는 과정, 계엄에 대한 심판이라고 밝혔습니다.
재생에너지 사업으로의 산업 전환 과정에 제주도가...",https://n.news.naver.com/mnews/article/661/0000055638?sid=154
"트럼프 공약이었던 '메가 감세' 법안, 하원 통과…""美 재정 적자 3조 늘...",2025-05-22 21:23:00 (KST),"이날 감세 법안에 반대표를 던진 공화당 소속 토머스 매시 의원(켄터키주)는 ""우리는 오늘 밤 타이태닉호의 보일러에 석탄을 넣고 빙산을 향해 전속력으로 가는 길을 택했다""며 ""이 결정은 재앙을 초래할 것""이라고...",https://n.news.naver.com/mnews/article/025/0003442846?sid=104
"[MD포토] 박진만 감독, '구자욱 오늘의 주인공'",2025-05-22 21:23:00 (KST),"22일 오후 서울 고척돔 고척스카이돔에서 진행된 '2025 프로야구 KBO리그' 키움히어로즈와 삼성라이온즈의 경기.
삼성 박진만 감독과 구자욱이 2-0으로 승리한 뒤 환호하고 있다.",https://m.sports.naver.com/kbaseball/article/117/0003946056
"손예진 닮은 이광기 딸, ♥국대 정우영과 결혼소감 ""터질 듯한 심장소리...",2025-05-22 21:23:00 (KST),"그러면서 ""독일에서의 새로운 삶에 적응하고 결혼 준비까지 하느라 정신없이 달려왔는데, 어제오늘 하루 종일 축하 연락을 받으니 이제야 실감이 나는 것 같아요ㅎㅎ""라며 ""축복해 주신 모든 분들께 진심으로...",https://m.entertain.naver.com/article/311/0001868989
"kt 허경민, 23일 엔트리 복귀…황재균은 다시 1루로",2025-05-22 21:23:00 (KST),"이강철 kt 감독은 22일 수원케이티위즈파크에서 열리는 2025 프로야구 KIA 타이거즈와 홈 경기를 앞두고 ""허경민은 오늘 1군 선수단에 합류해 훈련했다""며 ""내일 1군 엔트리에 등록할 예정""이라고 전했다.
kt...",https://m.sports.naver.com/kbaseball/article/001/0015406072
고속도로 달리던 탱크로리에서 염산 누출...도로 통제,2025-05-22 21:22:00 (KST),"오늘(22일) 저녁 7시 30분쯤 충남 공주시 신풍면 당진대전고속도로 화흥터널 부근을 달리던 25톤 탱크로리 화물차량에서 염산이 누출됐습니다.
이 사고로 다친 사람은 없었지만, 마곡사나들목부터 유구나들목 사이 9...",https://n.news.naver.com/mnews/article/052/0002196656?sid=102
김정은 앞에서 北 5000t급 구축함 좌초…英 안보기관 '방수포' 덮혀진 위...,2025-05-22 21:22:00 (KST),"홍민 / 통일연구원 선임연구위원 ""김정은 입장에서는 내부적으로 경각심을 주는 부분, 어차피 외부적으로실패가 드러날 가능성을 (고려한 것)"" 북한은 오늘 청진항과 가까운 선덕비행장 인근에서 순항미사일 여러 발을...",https://n.news.naver.com/mnews/article/448/0000529614?sid=100
'경북 산불 149시간의 기록' 이달의 방송기자상 수상,2025-05-22 21:22:00 (KST),"방송기자연합회는 오늘 서울 한국방송회관에서 시상식을 열고, '경북 산불 149시간의 기록'을 연속보도한 TBC 사회부에게 제199회 이달의 기자상 지역기획보도 부문상을 수여했습니다.
이번 보도는 지난 3월 경북...",https://www.tbc.co.kr/news/view?pno=20250522134857AE05617&id=195896
