Title,Published(Kor),Description,Link
여야 유세 총력.. 주말 ′표심 잡기′ 나서,2025-05-24 21:22:00 (KST),"부산MBC)더불어민주당 부산 선거대책위원회는 오늘(24) 구포시장과 화명동, 광안리 등을돌며, 부산시민들에게 이재명 후보를 지지해줄 것을 호소했습니다.
국민의힘도 주말을 맞아 김기현·나경원 공동선거대책위원장이...",https://busanmbc.co.kr/01_new/new01_view.asp?idx=274991
"김문수 후보, ""박정희 정신으로 이 나라 대한민국을 위대하게 만들겠다...",2025-05-24 21:22:00 (KST),"김문수 대통령 후보는 ""대한민국이 오늘 이렇게 잘 살게된 것은 모든 것은 박정희 대통령의 공로라고 생각한다.
어릴 때 너무 배가 고팠습니다만, 저는 지금 다이어트 하고 있는 중이다.
저는 어릴 때 호롱불도 켜지 못하고...",https://www.gukjenews.com/news/articleView.html?idxno=3282936
"박근혜, 김문수 만나 ""지난 일 연연하지말고 하나로 뭉쳐서 반드시 선거...",2025-05-24 21:20:00 (KST),"박 전 대통령은 ""오늘 와줘서 고맙고 앞으로 어떻게 하면 더 선거를 잘 치를 수 있을지 시간이 많이 남지...
그는 ""박 전 대통령이 뜻밖의 (상황으로) 물러나야 했다고 생각하지 않는다""며 ""오늘 저녁 대구 달성으로 박 전...",https://www.idaegu.com/news/articleView.html?idxno=638348
"""결승 위해 뛰었더니 고작 20분"" 폭탄발언 가르나초, 진정 맨유 떠날 생...",2025-05-24 21:20:00 (KST),"오늘은 20분만 뛰었다.
모르겠다.
여름을 만끽해 보고 어떻게 될지 두고 봐야겠다""라며 이별을 암시했다.
가르나초의 동생도 ""다른 누구와도 비교할 수 없을 만큼 열심히 뛰었고 모든 경기에서 팀을 도왔다.
지난 두...",https://m.sports.naver.com/wfootball/article/413/0000198155
"김문수 만난 박근혜 ""하나로 뭉쳐 반드시 이겨달라"" … ""진정성이 중요...",2025-05-24 21:18:00 (KST),"그러자 박 전 대통령은 ""오늘 와주셔서 고맙고 앞으로 어떻게 하면 도와서 선거를 잘 치를 수 있을지, 시간이 많이 남지 않았지만 더 깊이 고민해보겠다""고 덧붙였다.
이날 차담 자리에서는 이준석 개혁신당 대통령...",https://www.newdaily.co.kr/site/data/html/2025/05/24/2025052400085.html
"경기도간호사 모임 ""간호법 약속 지킨 이재명 후보, 이젠 우리가 지킬 ...",2025-05-24 21:18:00 (KST),"오늘 경기도 간호사분들의 지지선언에 깊은 감동을 받았다""며 ""이재명 후보가 대통령에 당선되면, 간호정책이 크게 개선될 것이라 확신한다.
저 역시 그 길에 함께하겠다""고 밝혔다.
이번 지지선언을 주도한 황세주...",https://www.thereport.co.kr/news/articleView.html?idxno=64494
"'독수리5형제' 엄지원, 교통사고 후 무사한 안재욱 안고 대성통곡...안재...",2025-05-24 21:18:00 (KST),"오늘 사고 당해서 컨디션 안 좋았는데 마 대표때문에 기분 좋아졌다고 말한다.
독수리 5형제를 부탁해 [사진...
그런 의미에서 오늘부터 1일이다""고 고백했다.
마광숙은 놀라며 일어섰고, 한동석은 마광숙은 팔을 잡으며...",http://www.joynews24.com/view/1847852
"""끝내기 홈런인 줄 알고 폴짝 뛰었다""…한유섬, 몇 초 동안 만감이 교차...",2025-05-24 21:18:00 (KST),"오늘 불펜데이였기 때문에 투수들을 최대한 도와줄 수 있게 많은 득점을 내주고 싶었는데 참 마음대로...
6안타 5타점 2홈런이 나왔다.
중심 타선이 오늘 경기를 해결했다""고 칭찬을 아끼지 않았다.
사진=SSG 랜더스",https://m.sports.naver.com/kbaseball/article/311/0001869799
로또 1173회 당첨번호+당첨지역…온라인 수동 1등 '우수수',2025-05-24 21:18:00 (KST),"ⓒ동행복권 누리집 오늘(24일) 로또 1173회 당첨 번호가 발표됐다.
이날 MBC '생방송 행복드림 로또 6/45'이 서경석, 이영은의 진행으로 방송됐다.
이날 방송에는 제338대 황금손으로 코미디언 김해준·김승혜...",https://daily.hankooki.com/news/articleView.html?idxno=1220796
"박근혜, 김문수 1시간 만나 ""지난일 연연 말고 하나 돼 대선 이겨달라""",2025-05-24 21:17:00 (KST),"이에 박 전 대통령은 ""오늘 와 주셔서 고맙고 앞으로 어떻게 하면 더 선거를 잘 치를 수 있을지 시간 많이 남지 않았지만 깊이 고민해보겠다""고 답했다.
이어 박 전 대통령은 ""선거를 치르느라 고생이 많고 건강 관리를...",https://n.news.naver.com/mnews/article/008/0005198680?sid=154
"박근혜 ""하나로 뭉쳐 이겨야""…김문수 ""선거 여왕 지혜달라""",2025-05-24 21:17:00 (KST),"박 전 대통령은 “오늘 와줘서 고맙고 앞으로 어떻게 하면 더 선거를 잘 치를 수 있을지 시간이 많이 남지 않았지만 더 깊이 고민해 보겠다”고 화답했다.
특히 박 전 대통령은 당내 갈등을 두고 “경선 과정이 길면 서운한...",https://n.news.naver.com/mnews/article/011/0004489209?sid=100
"24일, 단양 구인사서 '상월원각대조사 51주기 열반대재'",2025-05-24 21:16:00 (KST),"총무원장 덕수 스님은 ""우리는 오늘 대한불교천태종의 중창조이신 상월원각대조사님의 열반 51주기를 기리는 대법회를 봉행하고 스승님의 법신을 그리워하며 큰 가르침을 배워서 실천할 것을 다짐한다""고 추모했다....",https://www.ccdailynews.com/news/articleView.html?idxno=2344966
서울 연세대 앞 버스 두 대 사고‥승객 7명 다쳐,2025-05-24 21:15:00 (KST),"오늘 저녁 8시쯤, 서울 서대문구 연세대학교 인근 버스 정류장에서 광역버스 한 대가 정차한 시내버스를 들이받았습니다.
이 사고로 시내버스에 타고 있던 승객 7명이 경상을 입고 병원으로 옮겨졌습니다.
경찰은 사고를...",https://n.news.naver.com/mnews/article/214/0001426147?sid=102
"20년만 재혼 이상민, 신동 부재에 “나처럼 결혼했나?”(아형)",2025-05-24 21:14:00 (KST),"이날 강호동이 ""신동 오늘도 결석이냐""고 묻자 서장훈은 ""신동 어디 갔냐""며 녹화 불참의 이유를 궁금해했다.
이에 이상민은 ""(나처럼) 결혼한 거야?""라고 이유를 짐작해 웃음을 자아냈다.
김영철은 ""신동 멕시코 갔다""고...",https://m.entertain.naver.com/article/609/0000990674
"이재명·김문수, 지지층 결집 총력전…李 ""내란세력 확실히 제압"" 金 ""朴...",2025-05-24 21:14:00 (KST),"정말 많은 할 말을 가지고도 은거하고 계시는 이 현실이 가슴 아프다""며 ""대한민국이 이렇게 오늘 잘 살게 된 것은 박정희 전 대통령의 공로 (때문이다).
이런 어려움을 당하면서도 저희에게 너무너무 많은 선물을 주고...",https://n.news.naver.com/mnews/article/003/0013262811?sid=100
"김문수 만난 박근혜, “섭섭한 일 있더라도 다 내려놓고 나라 위해 승리...",2025-05-24 21:14:00 (KST),"김 후보의 도움 요청에 대해서는 “오늘 와줘서 고맙고 앞으로 어떻게 도와서 선거를 잘 치를 수 있을지...
김 후보는 이후 박정희 전 대통령 생가 앞에서 진행된 구미지역 유세에서 “우리 대한민국이 오늘 잘살게 된 것은...",https://n.news.naver.com/mnews/article/028/0002747517?sid=154
"[BE.현장] '아쉬움' 밝힌 조성환 감독, ""이전 경기의 여파, 다음 경기 잘...",2025-05-24 21:14:00 (KST),"득점이 나오지 않은 점에는 ""오늘 경기력은 지난 경기 여파가 없잖아 있는 것 같다.
체력 부담이 있다 보니까 미스가 많이 나왔다.
이 경기 피로감과 이전 경기 피로감이 쌓이지 않게 이번 주 전술 전략적으로, 회복과...",https://m.sports.naver.com/kfootball/article/343/0000132314
"'독수리 5형제' 안재욱♥엄지원, 드디어 연애 시작 ""오늘부터 1일""",2025-05-24 21:13:00 (KST),"진심이에요""라며 진심을 전했고, 한동석은 ""그런 의미에서 오늘부터 1일입니다, 우리.
사람들 많은 앞에서 날 부둥켜안고 울기까지 했는데 사귀는 거 아니에요?""라며 당부했다.
마광숙은 ""알았어요""라며 대답했고...",https://m.entertain.naver.com/article/311/0001869798
컬러 질주·세계문화 만남… 주말 '축제의 장',2025-05-24 21:12:00 (KST),"오늘은 비도 흩뿌리는 흐린 날씨가 이어졌지만 부산에선 이색 걷기대회인 컬러레이스와 세계시민축제 등이...
모습을 오늘 영상도 준비했고.
이게 한국과 일본의 차이가 아니라 사람 사이의 교류인 것을 알게되고 더 쉽게...",https://news.knn.co.kr/news/article/173058
"박근혜, 김문수 만나 ""지난 일 연연 말고 하나로 뭉쳐 대선 이겨달라""",2025-05-24 21:12:00 (KST),"박 전 대통령은 이에 ""오늘 와주셔서 고맙다""며 ""앞으로 어떻게 하면 도와서 선거를 잘 치를 수 있을지, 시간이 많이 남지 않았지만 더 깊이 고민해 보겠다""고 답했다고 한다.
신 단장은 이날 예방에서 이준석 개혁신당 대선...",https://n.news.naver.com/mnews/article/003/0013262806?sid=100
