Title,Published(Kor),Description,Link
"CEOs Want to Keep Pouring Money Into AI, Despite Weak Returns: Survey",2025-12-16 19:00:38 (KST),"Most executives say their AI projects aren’t delivering returns, but nearly 70% still plan to spend more next year.",https://gizmodo.com/ceos-want-to-keep-pouring-money-into-ai-despite-weak-returns-survey-2000700007
Ford is switching gears from EVs: 'It was really the customer changing their decision',2025-12-16 15:58:35 (KST),"Ford is scaling back its large electric vehicle production and prioritizing hybrid vehicles, a move that is expected to cost nearly $20 billion.",https://www.businessinsider.com/ford-electric-vehicles-switch-hybrid-2025-12
He built JPMorgan's coast-to-coast banker network. Now exec John Richert says the middle market's moment is coming.,2025-12-16 19:19:02 (KST),"JPMorgan's mid-cap chief explains how investment banking works beyond Wall Street, and why the middle market has become a billion-dollar opportunity.",https://www.businessinsider.com/jpmorgan-john-richert-middle-market-group-high-backlog-2025-12
RTO mandates are running into a space problem,2025-12-16 18:17:01 (KST),"Companies like AT&T, Amazon, JPMorgan, and Instagram have a RTO problem: there's not enough places for workers to sit.",https://www.businessinsider.com/rto-mandates-amazon-jpmorgan-instagram-att-seats-desks-office-space-2025-12
"HP Doesn’t Care About Profit With This 72% Off 15.6″ Laptop Bundle (16GB RAM, 1TB SSD), Even a MacBook Can’t Compete",2025-12-16 21:05:16 (KST),"The bundle comes with free computer accessories, plus Windows 11 Pro pre-installed.
The post HP Doesn’t Care About Profit With This 72% Off 15.6″ Laptop Bundle (16GB RAM, 1TB SSD), Even a MacBook Can’t Compete appeared first on Kotaku.",https://kotaku.com/hp-doesnt-care-about-profit-with-this-72-off-15-6-laptop-bundle-16gb-ram-1tb-ssd-even-a-macbook-cant-compete-2000653800
"After Decades, Linux Finally Gains Stable GPIB Support",2025-12-16 21:00:22 (KST),"Recently, [Greg Kroah-Hartman] proclaimed the joyous news on the Linux Kernel Mailing List that stable General Purpose Interface Bus (GPIB) support has finally been merged into the 6.19 Linux kernel.
The …read more",https://hackaday.com/2025/12/16/after-decades-linux-finally-gains-stable-gpib-support/
What to expect from the jobs report today,2025-12-16 19:00:59 (KST),"The November jobs report is landing at an odd time – on a Tuesday in mid-December, instead of (what’s usually) the first Friday of the month – due to the...",https://www.cnn.com/2025/12/16/economy/us-jobs-report-final-november-october
"Mortgage and refinance interest rates today, December 16, 2025: Rates hold steady",2025-12-16 20:00:35 (KST),"These are today's mortgage and refinance rates.
The 30-year fixed rate remains mostly unchanged since mid-October.
Lock in your rate today.",https://finance.yahoo.com/personal-finance/mortgages/article/mortgage-refinance-rates-today-tuesday-december-16-2025-110035487.html
Mysterious Bright Flashes in the Night Sky Baffle Astronomers,2025-12-16 20:00:00 (KST),"Long, long ago a cloud of stars circled a galaxy-size black hole, safely at a distance.
Then about 200 million years ago one member of the cloud bumped...",https://www.yahoo.com/news/articles/mysterious-bright-flashes-night-sky-110000813.html
"As Brown shooting manhunt continues, FBI offers reward for info leading to conviction",2025-12-16 19:48:52 (KST),"The FBI was asking for the public's help finding a man ""with a stocky build"" in connection with Saturday's fatal mass shooting in Providence, Rhode Island.",https://abcnews.go.com/US/brown-university-shooting-manhunt-continues-fbi-offers-reward/story?id=128443272
Test Drive: 2025 Porsche Carrera T Cabriolet,2025-12-16 09:22:03 (KST),"If we were to stick to our typical schedule of trying out a new vehicle over the course of seven days, we’d spend 20 weeks just driving new 911’s.
Not that we’d complain about hav…",http://coolhunting.com/design/test-drive-2025-porsche-carrera-t-cabriolet/
A Note on Current SMS Marketing Practices,2025-12-16 09:02:08 (KST),Link to: https://daringfireball.net/linked/2025/12/15/note-on-sms-marketing,https://daringfireball.net/linked/2025/12/15/note-on-sms-marketing
[Sponsor] Finalist Daily Planner for iOS,2025-12-16 11:52:31 (KST),"My name is Slaven and Finalist is my passion project.
It's a day planner I always wanted on my phone (and iPad, and Mac).
It can help you be more intentional with your time.
Finalist's ideas are rooted in paper (I'm a huge paper nerd).
The app started out as…",https://www.finalist.works/df/
Ideas Aren't Getting Harder to Find,2025-12-16 09:34:35 (KST),"For half a decade we’ve been worrying that ideas are getting harder to find.
In fact, they might just be harder to sell.",https://asteriskmag.com/issues/12-books/ideas-arent-getting-harder-to-find
The World Happiness Report is beset with methodological problems,2025-12-16 09:06:49 (KST),A case study in elite misinformation.,https://yaschamounk.substack.com/p/the-world-happiness-report-is-a-sham
"I'm a Tech Lead, and nobody listens to me. What should I do?",2025-12-16 18:38:42 (KST),"In June 2018, I joined mytaxi (FREE NOW), a competitor of Uber in the ride-hailing space, as Backend Chapter Lead.
I was looking for an opportunity to grow in technical leadership.
Honestly, I did not even fully understand what “Chapter Lead” meant.
After som…",https://world.hey.com/joaoqalves/i-m-a-tech-lead-and-nobody-listens-to-me-what-should-i-do-e16e454d
The Bob Dylan Concert for Just One Person,2025-12-16 09:18:58 (KST),"An interview with Fredrik Wikingsson, the subject of 'Experiment Ensam'",https://www.flaggingdown.com/p/the-bob-dylan-concert-for-just-one
Apple @ Work Podcast: AI workflows and the Mac Mini,2025-12-16 20:00:00 (KST),"Apple @ Work is exclusively brought to you by Mosyle, the only Apple Unified Platform.
Mosyle is the only solution that integrates in a single professional-grade platform all the solutions necessary to seamlessly and automatically deploy, manage & protect App…",https://9to5mac.com/2025/12/16/ai-workflows-and-the-mac-mini/
"iPhone sales predicted to fall next year, with far higher manufacturing costs",2025-12-16 21:28:21 (KST),"Market intelligence company Counterpoint Research has predicted that iPhone sales will fall next year compared to this – and that Apple’s manufacturing costs will increase substantially.
Global smartphone shipments as a whole are expected to fall in 2026, …",https://9to5mac.com/2025/12/16/iphone-sales-predicted-to-fall-next-year-with-far-higher-manufacturing-costs/
