Title,Published(Kor),Description,Link
Google Meet now uses AI to show more faces in 'Dynamic layouts',2025-03-29 09:26:24 (KST),"Ever wish you could fit more people on your screen during a meeting? With Dynamic layouts in Google Meet, now you can.",https://www.androidcentral.com/apps-software/google-meet-now-uses-ai-to-show-more-faces-in-dynamic-layouts
NASA Adds SpaceX's Starship To Launch Services Program Fleet,2025-03-29 19:00:00 (KST),"Despite recent test failures, NASA has added SpaceX's Starship to its Launch Services Program contract, allowing it to compete for future science missions once it achieves a successful orbital flight.
Florida Today reports: NASA announced the addition Friday …",https://science.slashdot.org/story/25/03/29/0950235/nasa-adds-spacexs-starship-to-launch-services-program-fleet
People diagnosed with colon cancer shared with BI their early symptoms,2025-03-29 19:40:02 (KST),"In this Saturday edition of BI Today, we're talking about why colon cancer is affecting more young people.",https://www.businessinsider.com/bi-today-colon-cancer-diagnosis-early-symptoms-2023-3
Alex Rodriguez made 5 changes to stay fit as he ages — from lighter weightlifting to less red meat,2025-03-29 18:39:01 (KST),"From a star athlete to a CEO, Alex Rodriguez said he's shifted his routine to include less heavy lifting and more yoga and fasting.",https://www.businessinsider.com/alex-rodriguez-longevity-routine-fasting-morning-yoga-2025-3
Switching jobs used to mean higher pay raises. Not anymore.,2025-03-29 19:41:01 (KST),"People who swicth jobs saw their wage growth fall to 4.2%, below job stayers', as the Great Resignation's end weakens bargaining power.",https://www.businessinsider.com/switching-jobs-used-to-mean-higher-pay-raises-not-anymore-2025-3
Artillery was Russia's 'god of war' long before Ukraine,2025-03-29 16:56:01 (KST),"In the Ukraine war, it is artillery that has enabled tactically clumsy Russian infantry and armor to advance.
Stalin once called it the ""god of war.""",https://www.businessinsider.com/russia-artillery-war-ukraine-2025-3
See the history of Qantas' famous 'kangaroo route' from Australia to England that once took 12 days but will soon take just hours,2025-03-29 21:11:02 (KST),Vintage photos chronical the historic Australia-UK route as it evolved from tiny biplanes hopping 31 stops to large jetliners soon flying nonstop.,https://www.businessinsider.com/vintage-photos-see-history-qantas-kangaroo-route-project-sunrise-2025-3
"Wordle hints today for #1,379: Clues and answer for Saturday, March 29",2025-03-29 13:01:49 (KST),Does today's Wordle have you stumped? Here are some hints and the answer.,https://tech.yahoo.com/gaming/wordle/article/wordle-hints-today-for-1379-clues-and-answer-for-saturday-march-29-040149305.html
Scientists make mind-blowing discovery about llama-like animal's waste product: 'It's interesting to see',2025-03-29 19:45:25 (KST),"""There's going to be a lot of value in continuing to monitor these patches and see how they might expand.""",https://www.yahoo.com/news/scientists-mind-blowing-discovery-llama-104525755.html
A New Star Wars Chapter Begins at Disneyland’s Galaxy’s Edge,2025-03-29 09:00:28 (KST),"The Lucasfilm theme park canon will continue to expand with Luke Skywalker's presence—and more Mandalorian, with Grogu in tow.",https://gizmodo.com/a-new-star-wars-chapter-begins-at-disneylands-galaxys-edge-2000582456
Are Vehicle Infotainment Screens Headed for the Scrap Heap?,2025-03-29 20:00:23 (KST),Drivers are falling out of love with the tech-forward touch screens that have become commonplace in modern cars.,https://gizmodo.com/are-vehicle-infotainment-screens-headed-for-the-scrap-heap-2000580600
"Trump's attacks on universities get darker, with shadows reaching our shores",2025-03-29 17:29:27 (KST),The US has become a hostile and authoritarian state to foreign scientists and is choosing ideology over science.,https://christinapagel.substack.com/p/trumps-attacks-on-universities-get
Where Do the Bytes Go?,2025-03-29 20:26:38 (KST),Comments,https://flak.tedunangst.com/post/where-do-the-bytes-go
"Building a search engine from scratch, in Rust: part 1",2025-03-29 19:59:52 (KST),Or how to write on disk efficiently in the browser or any other device.,https://jdrouet.github.io/posts/202503170800-search-engine-part-1/
"""I’m So Glad She Helped Me See This"": Older People Are Recalling The ""Life Advice"" They Received When They Were Younger, And Most Of This Still Rings True Today",2025-03-29 20:16:02 (KST),"""That one sentence summed up so much of life in just three words.""View Entire Post ›",https://www.buzzfeed.com/ravenishak/words-of-wisdom-from-older-people
"Yes, I'm still using a Palm Pilot even though it's 2025: Here's why I can't give it up",2025-03-29 20:33:10 (KST),"So many products offer to help us disconnect, but sometimes you need to look to the past",https://www.androidpolice.com/i-still-use-a-palm-pilot-editorial/
Why Isn't My Internet Back Yet? The Hidden Challenges of Network Restoration,2025-03-29 21:00:00 (KST),"Even wireless internet providers have to contend with outages after a storm.
Here's how your internet provider races to get you back online.",https://www.cnet.com/home/internet/why-isnt-my-internet-back-yet-the-hidden-challenges-of-network-restoration/
10 Best Electric Bicycles To Transform Your Daily Ride Into A Sustainable Journey,2025-03-29 20:40:49 (KST),"10 Best Electric Bicycles To Transform Your Daily Ride Into A Sustainable JourneySustainability and convenience are at the forefront of transportation today, and e-bicycles have emerged as a popular choice for eco-friendly commuting.
These electric bikes redu…",https://www.yankodesign.com/2025/03/29/10-best-electric-bicycles-to-transform-your-daily-ride-into-a-sustainable-journey/
Cameras are no longer the main reason I choose a Pixel; this is,2025-03-29 21:00:25 (KST),"Cameras used to be the biggest appeal of the Pixel line-up for me, but another feature has recently taken over and is keeping me firmly on the Pixel team.",https://www.androidauthority.com/safety-main-reason-choose-pixel-3537158/
