Title,Published(Kor),Description,Link
Patient With Artificial Heart Smashes Survival Record,2025-03-15 19:00:09 (KST),"The patient, an Australian man in his 40s, lived with his fully functional heart implant long enough to be discharged from the hospital.",https://gizmodo.com/patient-with-artificial-heart-smashes-survival-record-2000574948
OPPO Find X8 Pro vs. Vivo X200 Pro: What's the best camera phone of 2025?,2025-03-15 13:01:14 (KST),"The Find X8 Pro and Vivo X200 Pro are the two best camera phones available today.
So let's take a look at which you should buy.",https://www.androidcentral.com/phones/oppo-find-x8-pro-vs-vivo-x200-pro
"News Weekly: Massive Pixel 10 leak, March update chaos, OnePlus ditching its Alert Slider, and more",2025-03-15 21:00:00 (KST),"This week we dive into a massive Pixel 10 leak that showed off all three models, Pixel users are scrambling after the latest March update, OnePlus has decided to ditch the alert slider, Android 16 Beta 3 arrives, and, the Gemini app gets new features.",https://www.androidcentral.com/apps-software/news-weekly-march-15-2025
One cheeky question led me to a new love after I thought I had given up on men,2025-03-15 19:02:01 (KST),"I had given up on finding love again after my divorce.
Connecting with a local chef changed everything.
Now we're married and run a business together.",https://www.businessinsider.com/found-love-after-giving-up-on-men-run-business-together-2025-3
Spruce up your space for spring by decluttering,2025-03-15 19:37:01 (KST),"In this Saturday edition of BI Today, we're talking about spring cleaning and misdiagnosed colon cancer.",https://www.businessinsider.com/bi-today-spruce-up-your-space-by-decluttering-2025-3
"After a threesome and a lot of tears, Brion and Shanté from Netflix's 'Temptation Island' might still be together",2025-03-15 16:33:01 (KST),"Brion cheated on his partner by having a threesome on Netflix's ""Temptation Island."" Here where his relationship with Shanté stands today.",https://www.businessinsider.com/are-brion-shante-temptation-island-still-together-what-happened-2025-3
Older Americans watching their retirement investments fluctuate under Trump: 'I hope he knows what he's doing.',2025-03-15 17:06:02 (KST),Business Insider spoke to nearly a dozen older Americans about how they view their retirement amid a wave of market and economic uncertainty.,https://www.businessinsider.com/retirement-stock-market-trump-social-security-investing-401k-economic-policy-2025-3
"They committed to public service with the hope of student-loan forgiveness. Under Trump, their plans are at risk.",2025-03-15 16:26:01 (KST),"Some student-loan borrowers have just a few payments left until they get Public Service Loan Forgiveness.
Trump might put that relief at risk.",https://www.businessinsider.com/trump-limits-public-service-loan-forgiveness-borrowers-react-debt-relief-2025-3
Nature: The many bird species at Highbanks Metro Park,2025-03-15 19:00:42 (KST),"Central Ohio has many spots for birds to rest, but Highbanks Metro Park seems to be a hub for our local fliers.",https://www.dispatch.com/story/lifestyle/nature-wildlife/2025/03/15/nature-birds-flock-to-highbanks-metro-park/82229182007/
The New Freakier Friday Trailer Gave Me All the Nostalgic Teen Angst Feels,2025-03-15 09:00:44 (KST),The sequel to Disney's 2003 hit starring Lindsay Lohan and Jamie Lee Curtis opens August 8.,https://gizmodo.com/the-new-freakier-friday-trailer-gave-me-all-the-nostalgic-teen-angst-feels-2000576321
The Dating Dilemmas Young People Can’t Escape,2025-03-15 20:45:00 (KST),"Finding love has never been easy, but this is a particularly tricky moment for romance.",https://www.theatlantic.com/newsletters/archive/2025/03/dating-young-apps-pandemic-relationships/682047/
Was Integration the Wrong Goal?,2025-03-15 20:30:00 (KST),"Why some mainstream Black intellectuals are giving up on Brown v.
Board of Education",https://www.theatlantic.com/magazine/archive/2025/04/brown-v-board-of-education-integrated-noliwe-rooks-book/681766/
Google Being Forced to Sell Chrome Is Not Good for the Web,2025-03-15 10:57:59 (KST),"You’ve got a monopoly on lemonade because you pay all the grocery stores to be the default lemonade.
So we’re going to force you sell your car.
What’s with the weird redirect? If …",https://chriscoyier.net/2025/03/14/google-being-forced-to-sell-chrome-is-not-good-for-the-web/
From QED to Neovim,2025-03-15 09:27:09 (KST),"From QED to Neovim, this blog post unveils the history and evolution of the digital text editor.
Modern systems require a method to precisely select, input, and arrage text.
It's natural that this tool should become indispensable.",https://l-o-o-s-e-d.net/qed-neovim
"18 Workers Who Said ""Not Today, Satan!"" And Left Their Brand-New Jobs The Second They Clocked How Toxic They Were",2025-03-15 11:31:02 (KST),"""I was there for not even two hours and was screamed at almost the entire time.""View Entire Post ›",https://www.buzzfeed.com/hannahdobro/people-who-stormed-out-of-their-toxic-jobs
Good Luck Ever Leaving Your Home Again After Stacking It With These 37 Cool Products,2025-03-15 11:31:03 (KST),"Time to un-RSVP to everything so you can hang out with this see-through air fryer and ""marshmallow"" blanket instead.View Entire Post ›",https://www.buzzfeed.com/emmalord9/good-luck-ever-leaving-your-home-again-after-stacking-it-an
Apple @ Work: Privileges 2.1 continues to be one of the must-have macOS apps in the enterprise,2025-03-15 20:24:00 (KST),"Apple @ Work is exclusively brought to you by Mosyle, the only Apple Unified Platform.
Mosyle is the only solution that integrates in a single professional-grade platform all the solutions necessary to seamlessly and automatically deploy, manage & protect App…",https://9to5mac.com/2025/03/15/privileges-2-1-continues-to-be-one-of-the-must-have-macos-apps-in-the-enterprise/
9to5Rewards: Last chance to win a MacBook Pro from Chargeasap [Giveaway],2025-03-15 10:04:20 (KST),"There’s still one week left to enter our giveaway to win Apple’s latest MacBook Pro courtesy of Chargeasapto help celebrate the launch of the company’s new Flash Pro Ultra, the world’s first dual OLED 275W powerbank.
Head below to learn more about the new Fla…",https://9to5mac.com/2025/03/14/9to5rewards-last-chance-to-win-a-macbook-pro-from-chargeasap-giveaway/
Italy vs. Ireland: How to Watch 2025 Six Nations Rugby Live From Anywhere,2025-03-15 21:15:04 (KST),"Defending champions head to Rome, looking to keep alive their title hopes.",https://www.cnet.com/tech/services-and-software/italy-vs-ireland-how-to-watch-2025-six-nations-rugby-live-from-anywhere/
7 Home Security Questions You Can Ask Alexa and Siri,2025-03-15 21:00:00 (KST),"Voice assistants can provide helpful info on local laws, access points in your home and plenty more.",https://www.cnet.com/home/security/home-security-questions-you-can-ask-alexa-siri-and-more/
