Title,Published(Kor),Description,Link
Forgot to Pre-Order an iPhone 16e? Apple Store Pickup Available Today at Most Locations,2025-02-28 18:32:13 (KST),"Apple's new entry-level iPhone 16e are now being delivered to customers worldwide following the pre-order period that began on Friday, February 21.
For those who didn't pre-order or chose to wait, the devices are currently readily available, and select Apple …",https://www.macrumors.com/2025/02/28/iphone-16e-available-today-pickup/
"6 Reasons Home Prices Won't Go Down, According to This Realtor",2025-02-28 21:00:02 (KST),Nothing is going to make home prices drop significantly in the near future.,https://www.cnet.com/personal-finance/6-reasons-home-prices-wont-go-down-according-to-this-realtor/
Why the U.S. wants Ukraine's minerals. And AOC speaks with NPR's Steve Inskeep,2025-02-28 20:49:55 (KST),"Trump and Zelenskyy are expected to meet today in Washington, D.C., to sign a preliminary deal.
And, AOC tells NPR why she believes the government only works for the wealthy.",https://www.npr.org/2025/02/28/g-s1-51205/up-first-newsletter-ukraine-us-mineral-deal-andrew-tate-aoc
"Meeting Trump at White House, Zelenksyy hopes for continued aid in war with Russia",2025-02-28 21:08:46 (KST),"It's the first face-to-face meeting between Zelenskyy and Trump since Trump's inauguration, and it comes about a week after Trump called Zelenskyy a dictator and repeated Kremlin talking points, including suggesting that Ukraine started the war with Russia.",https://www.npr.org/2025/02/28/nx-s1-5312880/trump-zelenskyy-minerals-ukraine-russia
"The CFPB drops its lawsuit against Capital One, marking a major reversal",2025-02-28 09:10:13 (KST),The consumer protection agency also dropped cases against four other companies including Rocket Homes.,https://www.npr.org/2025/02/27/nx-s1-5311561/cfpb-confirmation-mckernan-lawsuits-capital-one
I'm 92 and work full-time. I'm not ready to retire — I still love teaching.,2025-02-28 19:05:01 (KST),"Jerry Cascio-Hitchcock has been a full-time teacher for 60 years and works with children with learning disabilities.
She doesn't plan to retire soon.",https://www.businessinsider.com/92-work-full-time-not-ready-retire-teacher-2025-2
How Amazon used Oreos and dog toys to develop an army of robots to grab what you buy,2025-02-28 19:00:02 (KST),"Google self-driving cars emerged from the DARPA Grand Challenge.
Amazon's powerful picking robots were inspired by a similar competition a decade ago.",https://www.businessinsider.com/amazon-warehouse-robots-picking-challenge-2025-2
Released ‘Epstein Files’ Disappoint Anticipators. A Republican ‘Rickroll’ Didn’t Help,2025-02-28 14:00:00 (KST),"The heavily redacted files proved disappointing.
A GOP Judiciary Committee “rickroll” during the anticipation of the release didn’t make people feel any better.",https://time.com/7262658/epstein-files-released-reactions-disappointment-republicans-rickroll/
Palworld Dev Pocketpair Gives Employees Monster Hunter Wilds Launch Day Off After Receiving ‘Mysterious’ Notes From Staff Who Said They’d Probably Be Too Unwell to Work,2025-02-28 20:40:43 (KST),The developer of Palworld has given its staff the day off to play Monster Hunter Wilds after receiving a number of “mysterious” notices from employees who claimed they would “probably be feeling unwell” and unable to work.,https://www.ign.com/articles/palworld-dev-pocketpair-gives-employees-monster-hunter-wilds-launch-day-off-after-receiving-mysterious-notes-from-staff-who-said-theyd-probably-be-too-unwell-to-work
Unlimited 5G for $50? T-Mobile Prepaid Plans bring big value to everyone,2025-02-28 16:38:26 (KST),"T-Mobile / T-Mobile Tired of sky-high phone bills and sluggish network speeds? T-Mobile has the solution: Unlimited 5G data, talk, and text starting at just $50 per month (plus taxes and fees).
That’s right — you can now get all the 5G you need on the fastest…",https://www.digitaltrends.com/brc/unlimited-5g-for-50-t-mobile-prepaid-plans-bring-big-value-to-everyone/
"Apple is late to Siri revolution, so Microsoft brings you Copilot for Mac",2025-02-28 10:54:51 (KST),"The Copilot app for Mac comes with its own quick-launch keyboard shortcut, supports multi-modal input, and the latest AI tricks such as Think Deeper mode.",https://www.digitaltrends.com/computing/copilot-app-mac-microsoft-features-launch-apple/
"World’s thinnest phone is here, but it’s not the iPhone 17 Air or Galaxy S25 Edge",2025-02-28 18:46:55 (KST),"Tecno has announced the Spark Slim, which measures only 5.75mm across.
Despite that, it packs a massive battery, dual 50–megapixel cameras, and a 144Hz panel.",https://www.digitaltrends.com/mobile/tecno-spark-slim-thin-phone-concept-apple-samsung-rival-mwc-2025/
3 underrated Amazon Prime Video movies you should watch this weekend (February 28 – March 2),2025-02-28 09:30:45 (KST),"These three movies are the perfect way to spend a quiet weekend evening, and should be good regardless of what kind of movie you're looking for.",https://www.digitaltrends.com/movies/underrated-amazon-prime-video-movies-watch-this-weekend-february-28-march-2/
Notorious Mexican drug lord among 29 extradited to US,2025-02-28 16:31:31 (KST),Rafael Caro Quintero arrived in New York late on Thursday and was escorted by FBI agents.,https://www.bbc.com/news/articles/cx2995y25lyo
Hot take: GPT 4.5 is a nothing burger,2025-02-28 18:24:13 (KST),Pure scaling in shambles,https://garymarcus.substack.com/p/hot-take-gpt-45-is-a-nothing-burger
"Neural: OpenAI announces GPT-4.5, ChatGPT’s largest and best model for chat",2025-02-28 12:15:11 (KST),"Welcome to Neural.
AI moves fast.
We help you keep up.
OpenAI has officially unveiled GPT-4.5, the latest version of the fastest ChatGPT model.
While GPT-4.5 excels in a number of areas including accuracy and emotional intelligence, OpenAI emphasizes that GPT…",https://9to5mac.com/2025/02/27/neural-openai-announces-gpt-4-5-chatgpts-largest-and-best-model-for-chat/
Why Do Songs Get Stuck in Your Head?,2025-02-28 20:00:00 (KST),"Some songs get stuck in our head more than others, and scientists have uncovered what makes them so irresistible.",https://www.scientificamerican.com/podcast/episode/why-do-songs-get-stuck-in-your-head/
Do Aliens Know We’re Here?,2025-02-28 20:45:00 (KST),"Whether aliens could detect our modern civilization depends on what signs they’re looking for—and, crucially, their distance from us",https://www.scientificamerican.com/article/do-aliens-know-were-here/
"Bose Ultra Open wireless earbuds review: Great, but buy AirPods instead",2025-02-28 09:56:18 (KST),"For the last few months now I've been using Apple's (AirPods 4 (ANC), but alongside those, I've been testing another pair of wireless earbuds as well.
The Bose Ultra Open earbuds are expensive and weird, and I kinda love them — but you probably shouldn't buy …",https://appleinsider.com/articles/25/02/28/bose-ultra-open-wireless-earbuds-review-great-but-buy-airpods-instead
Why Is Social Media Urging People Not to Buy Anything for 24 Hours Friday?,2025-02-28 09:08:10 (KST),"A group calling itself the People's Union USA is calling for one-day economic blackout on Feb.
28.",https://www.cnet.com/tech/services-and-software/why-is-social-media-urging-people-not-to-buy-anything-for-24-hours-friday/
