Title,Published(Kor),Description,Link
마른논 써레질 이앙 재배기술 연시회..레이저로 균평 작업,2025-04-23 21:24:00 (KST),"마른논 써레질 이앙 재배기술 연시회가 오늘(23일) 영암 삼호에서 진행됐습니다.
전남농업기술원은 써레질로 논의 수평을 잡는 과정을 레이저 균평으로 대체하는 작업을 시연한 뒤 농가에 이앙 재배기술을 설명했습니다....",https://n.news.naver.com/mnews/article/660/0000083943?sid=102
2026여수세계섬박람회 'D-500'..개최 준비 속도,2025-04-23 21:24:00 (KST),"2026여수세계섬박람회 조직위원회는 오늘(23일), 개막 D-500일을 앞두고 박람회장 조성과 조직 정비, 핵심 콘텐츠 수립, 홍보 등 개최 준비에 속도를 내고 있다고 밝혔습니다.
세계 최초로 섬을 주제로 하는...",https://n.news.naver.com/mnews/article/660/0000083944?sid=102
"진격의 한화, 리그 첫 8연승 도전",2025-04-23 21:23:00 (KST),"오늘(23일) 롯데를 상대로 리그 첫 8연승에 도전하고 있습니다.
현재 상황 유병민 기자가 전해드립니다.
<기자> 7연승의 3위 한화와 최근 8승 2패의 4위 롯데, 두 팀이 개막 4주차에 5강 안에 든 건 2015년 4월 28일 한화가...",https://m.sports.naver.com/general/article/055/0001252039
"매출 20% 뚝 떨어져도…머스크 ""업무 줄일 뿐, 직책 유지""",2025-04-23 21:20:00 (KST),"<기자> 테슬라 매장은 오늘도 여전했습니다.
환경 운동가들이 CEO 일론 머스크의 정치 행보에 반대하는 문구들을 그려 넣고는, 순순히 경찰에 끌려갑니다.
사건이 난 매장입니다.
테슬라 측이 몇 시간 동안 긴급 작업을...",https://n.news.naver.com/mnews/article/055/0001252035?sid=104
"교황 장례식, 26일 엄수…절차도 간소",2025-04-23 21:20:00 (KST),"[존 맥케이 / 영국 순례자 : 오늘 교황님과 알현할 예정이었지만, 우리가 기대했던 방식은 아니었습니다.
우리는 그분을 사랑합니다.
예수님의 길을 가장 진실하게 따랐던 분이었습니다.] 교황청이 공식적으로 발표한...",https://www.obsnews.co.kr/news/articleView.html?idxno=1480871
맑고 일교차 큰 날씨..낮 최고 24도,2025-04-23 21:19:00 (KST),"낮 최고기온은 목포 17도, 광주 21도, 화순 22도, 순천 24도 등 17도에서 24도 분포로 오늘과 비슷하겠습니다.
낮과 밤의 기온차가 크겠으니 건강 관리에 각별한 유의가 필요합니다.",https://n.news.naver.com/mnews/article/660/0000083935?sid=103
"'기선제압' SK 전희철 감독, ""프로라면 이런 마인드로 뛰면 안된다"" '일...",2025-04-23 21:18:00 (KST),"플레이오프라서 싫은 소리 하고 싶지 않았지만 오늘은 어쩔 수 없다.
이런 마음 가짐으로 다음 경기를...
오늘 우리 선수들에게 실망했다.
분명 짚고 넘어가야 한다.
선수들을 믿고 있지만 오늘은 실망했다.
열심히 뛴...",https://m.sports.naver.com/basketball/article/109/0005290362
"[오늘의 세계] 벨기에, '달걀 대신 맥주' 벨기에 이색 부활절 행사",2025-04-23 21:18:00 (KST),"오늘의 세계입니다.
관광객 수십 명이 한 레스토랑 앞에 모였습니다.
이곳은 스페인 마드리드를 대표하는...
이후 1987년 지역 문화유산 협회가 되살렸다고 하네요.
오늘의 세계였습니다.
<구성 : 장은영 / 영상편집: 양규철>",https://www.obsnews.co.kr/news/articleView.html?idxno=1480862
"EU, 애플·메타 1조원 과징금…대미 관세협상 걸림돌되나(종합)",2025-04-23 21:18:00 (KST),"(USTR)도 지난달 발표한 보고서에서 EU의 DMA를 '무역장벽'의 하나로 거론했다.
이에 대해 집행위 고위 당국자는 ""관세와는 아무런 관련이 없다.
오늘 결정은 독립적 결정이며 오롯이 DMA 집행에 관한 것""이라고 항변했다.",https://n.news.naver.com/mnews/article/001/0015348024?sid=104
광주ㆍ전남 시민단체 활동가 1천 명 김문수 지지 선언,2025-04-23 21:18:00 (KST),"광주와 전남에서 활동 중인 시민단체 관계자 등은 오늘(23일) 기자회견을 열고 청년세대와 애국시민 등 천여 명의 이름으로 김 후보 지지를 선언한다고 밝혔습니다.
이들은 국회의원과 경기도지사, 고용노동부 장관을 두루...",https://n.news.naver.com/mnews/article/660/0000083933?sid=100
"이정선 광주시교육감, 5·18 교육 의무화 등 대선 공약 과제 제안",2025-04-23 21:17:00 (KST),"이 교육감은 오늘(23일) 광주시교육청에서 기자회견을 열고 광주의 정체성을 반영한 4대 교육정책과 6개 과제를 각 정당에 제안한다며, 이를 대선 공약과제에 반영해 줄 것을 촉구했습니다.
광주시교육청은 이같은...",https://n.news.naver.com/mnews/article/660/0000083931?sid=154
"중부산림청, '인구 문제 인식개선 릴레이 캠페인' 참여",2025-04-23 21:17:00 (KST),"[사진제공=중부지방산림청] 중부지방산림청(이하 중부산림청)은 보건복지부와 한국보건복지인재원이 공동 주관하는 '인구 문제 인식개선 릴레이 캠페인'에 동참했다고 오늘(23일) 밝혔습니다.
이번 캠페인은 저출산과...",http://www.paxetv.com/news/articleView.html?idxno=230279
산·학·연 전문가들 '한자리에'…반도체 산업 위기 진단과 특허 전략 논...,2025-04-23 21:17:00 (KST),[사진제공=특허청] 특허청은 오늘(23일) 오후 1시 30분 한국지식재산센터(서울 강남구)에서 K-반도체 산업을 둘러싼 상황 변화를 분석하고 지식재산을 활용한 우리 반도체 산업의 발전 방안을 모색하기 위해 '반도체 특허...,http://www.paxetv.com/news/articleView.html?idxno=230280
'이태원 핼러윈 자료 삭제 지시 혐의' 서울경찰청 전 정보부장에 징역 ...,2025-04-23 21:16:00 (KST),"검찰은 오늘 서울서부지법에서 열린 결심 공판에서 박 전 부장에게 징역 1년을 선고해달라고 재판부에 요청했습니다.
박 전 부장은 이태원참사가 발생한 후 지난 2022년 11월 2일부터 사흘간 서울경찰청 소속 경찰관들에게...",https://n.news.naver.com/mnews/article/214/0001420136?sid=102
제주에서도 추모 행렬...영원한 안식 기원,2025-04-23 21:16:00 (KST),"오늘 첫 소식 강석창 기잡니다.
(리포트) 약자의 벗을 자처하며 한평생 인류의 아픔에 낮은 자세로 헌신해 온...
강석창 기자 ""내일(오늘) 저녁 중앙성당과 화북성당 등 제주도내 4개 성당에서 평화의 여정의 마치고 선종에...",https://n.news.naver.com/mnews/article/661/0000054185?sid=102
"유상욱 “무기력했던 농심전, 초반 실수 아쉬워”",2025-04-23 21:15:00 (KST),"유 감독은 “어느 팀 상대로든 이길 수도, 질 수도 있는 상황”이라면서 “오늘 같은 경기력이 나온다면 DN전도 많이 힘들 것이다.
조금 더 열심히 해야 한다”고 말했다.",https://m.sports.naver.com/esports/article/005/0001771955
내일 밤 한미 통상협의…'트럼프식 속도전' 견제 필요,2025-04-23 21:15:00 (KST),"<기자> 안덕근 산업장관이 오늘 통상 협의 차 8개 부처 합동 대표단과 함께 미국으로 출발했습니다.
[안덕근...
트럼프는 오늘도 별다른 설명 없이 중국과의 협상이 순조롭게 진행되고 있다고 주장했습니다.
[도널드 트럼프...",https://n.news.naver.com/mnews/article/055/0001252034?sid=104
제437회 임시회 41건 심의·의결 폐회,2025-04-23 21:14:00 (KST),"제주자치도의회 제437회 임시회가 오늘 폐회 했습니다.
도의회는 지난 4일부터 오늘까지 20일간의 회기 동안 도정질문과 교육행정질문을 진행했고, 제주자치도와 교육청의 추가경정예산안을 비롯한 41건의 의안을...",https://n.news.naver.com/mnews/article/661/0000054174?sid=100
"KB국민카드, 혜택 강화형 '마이 위시 플러스 카드' 출시",2025-04-23 21:14:00 (KST),"아울러, 온라인쇼핑(G마켓, 무신사, 오늘의집 등)의 경우, KB Pay로 결제 시 5% 할인이 적용되고, SK에너지, GS칼텍스 주유소 및 커피 업종에서도 5% 할인 혜택이 제공된다.
전월 실적 40만원 이상 시 월 최대 5000원...",https://www.apnews.kr/news/articleView.html?idxno=3034197
"증선위, 홈플러스·MBK 부정거래 혐의 검찰 통보",2025-04-23 21:13:00 (KST),"금융위원회 증권선물위원회는 이들이 신용등급 하락과 회생 신청 계획을 사전에 인지하고도 숨긴 채 단기채권 등을 발행한 혐의가 있다고 보고, 지난 21일 증권선물위원장 긴급조치를 통해 검찰에 통보했다고 오늘(23일)...",https://n.news.naver.com/mnews/article/422/0000734021?sid=101
