Title,Published(Kor),Description,Link
Is Amazon Clearing Out Dyson? This Hair Dryer Has Just Dropped to a New All-Time Low,2025-06-08 20:10:22 (KST),"This hair dryer is one of Dyson’s most famous products, and it’s rarely on sale like this.",https://gizmodo.com/is-amazon-clearing-out-dyson-this-hair-dryer-has-just-dropped-to-a-new-all-time-low-2000612936
How to Watch Sinner vs Alcaraz on a Free Channel: Live Stream French Open Final,2025-06-08 20:16:29 (KST),"The French Open final is this Sunday.
Find out how to watch Sinner vs Alcaraz live on a completely free channel, no matter where you are.",https://gizmodo.com/how-to-watch-sinner-vs-alcaraz-on-a-free-channel-live-stream-french-open-final-2000612961
"Dreame X50 Ultra Review: This Robovac Sucks and Mops Like a Champ, Except in One Location",2025-06-08 20:00:17 (KST),"Quiet, powerful, and easy to set up, this vacuum performs incredibly well and looks good doing it.",https://gizmodo.com/dreame-x50-ultra-review-2000608106
Colombian Presidential hopeful shot at Bogotá rally,2025-06-08 20:09:44 (KST),"A Colombian Presidential hopeful in critical condition after being shot during a campaign rally in Bogotá on Saturday.
The assassination attempt is having a chilling effect in Colombia where security has been backsliding recently.",https://www.npr.org/2025/06/08/nx-s1-5427095/colombia-assasination-attempt-uribe
Boulder Jewish Festival moves forward with heightened security after attack,2025-06-08 17:47:54 (KST),"The festival, which kicks off Sunday morning, is set to take place at the same site where a group was attacked with Molotov cocktails during a vigil for Israeli hostages in Gaza last week.",https://www.npr.org/2025/06/08/nx-s1-5427083/boulder-jewish-festival-security
India (and its kids) are out to conquer the world of chess,2025-06-08 20:34:28 (KST),"Chess is seeing a global resurgence, sparked by The Queen's Gambit and the pandemic impact on leisure time.
India is an emerging power player, with 85 grandmasters and intense chess schools for youth.",https://www.npr.org/sections/goats-and-soda/2025/06/08/g-s1-64510/chess-champion-grandmaster-children-india
NPR readers share stories of love and adversity in honor of Loving Day,2025-06-08 19:30:00 (KST),"June 12th is Loving Day, a holiday that commemorates the Loving v.
Virginia case, which allowed interracial marriage in all parts of the U.S.
NPR readers share how the case changed their lives.",https://www.npr.org/2025/06/08/g-s1-70928/couples-court-case-interracial-loving-day
Recovery Failure: Why we struggle to rebuild for the next storm,2025-06-08 18:00:00 (KST),"NPR and the PBS series Frontline investigate the forces keeping communities from building resiliently, and the special interests that profit even when communities don't.",https://www.npr.org/2025/06/08/nx-s1-5321444/helenes-deadly-warning-storm-recovery-failures-ny-nj-houston
"Freeze your cherries, eat a cup of beans daily and try this hack to fall asleep fast — plus 9 more health tips to help you have a great week",2025-06-08 18:00:42 (KST),"""Small Steps"" for a better (and healthier) week.",https://www.yahoo.com/lifestyle/freeze-your-cherries-eat-a-cup-of-beans-daily-and-try-this-hack-to-fall-asleep-fast--plus-9-more-health-tips-to-help-you-have-a-great-week-090042654.html
6 high-tech Father’s Day gifts that show you really care,2025-06-08 19:00:21 (KST),"Skip the usual Father's Day gifts with personalized ideas for tech enthusiasts, home brewers, pool owners, seniors, outdoor lovers and privacy-conscious dads.",https://www.foxnews.com/tech/6-high-tech-fathers-day-gifts-show-you-really-care
Paris Can Be Intimidating—But It Has Great Butter,2025-06-08 21:00:00 (KST),A conversation with Caity Weaver about following Mark Twain there,https://www.theatlantic.com/newsletters/archive/2025/06/paris-twain-caity-weaver/683077/
Why not use DNS over HTTPS (DoH)?,2025-06-08 17:36:56 (KST),Comments,https://www.bsdhowto.ch/doh.html
"I don't use SMS 2FA for banking and sensitive apps, here's what I use instead",2025-06-08 18:50:10 (KST),"I don't trust SMS codes for banking, and neither should you",https://www.androidpolice.com/why-i-dont-use-sms-2fa-banking/
The Sunday Papers,2025-06-08 19:00:00 (KST),"Sundays are for playing around with the Nintendo Switch 2, of course.
Let's round up some writing from across the week first.
Jon Hicks, the former fifth Beatle of RPS and current co-host of Alice Bell's post-RPS podcast Total Playtime, has launched a newsle…",https://www.rockpapershotgun.com/the-sunday-papers-764
Ono’s rejection is classic example of GOP power grab | Opinion,2025-06-08 18:02:17 (KST),"We at the local level are losing legal rights to a Tallahassee group, a dominant segment of the Republican Party, whose aim is to grab power.",https://www.tallahassee.com/story/opinion/2025/06/08/onos-rejection-is-classic-example-of-gop-power-grab-opinion/84059096007/
Cannabis use among seniors surges 46% in two years—Study reveals,2025-06-08 12:16:04 (KST),"Cannabis use among older Americans has climbed dramatically, with 7% of adults 65 and older now reporting recent use.
This rise isn't just in numbers but also in diversity older users today are more likely to be women, college-educated, and higher-income.
Res…",https://www.sciencedaily.com/releases/2025/06/250607231604.htm
"Drone tech uncovers 1,000-year-old native american farms in michigan",2025-06-08 12:18:44 (KST),"In the dense forests of Michigan s Upper Peninsula, archaeologists have uncovered a massive ancient agricultural system that rewrites what we thought we knew about Native American farming.
Dating back as far as the 10th century, the raised ridged fields built…",https://www.sciencedaily.com/releases/2025/06/250607231844.htm
Fortnite OG Pass Season 4: All Skins And Rewards,2025-06-08 09:01:00 (KST),"The strangely lengthy Fortnite OG Season 3 has finally come to an end--it was three weeks longer than the first two!--and now it's finally time for the one we've all been waiting for.
Season 4 was a landmark for Fortnite, and these days it's widely considered…",https://www.gamespot.com/gallery/fortnite-og-pass-season-4-all-skins-and-rewards/2900-6653/
Ben Crump Says Donald Trump's Spending Bill is Terrible Amid Elon Musk Feud,2025-06-08 09:20:37 (KST),"Ben Crump's picked his side in the Elon Musk and Donald Trump beef ...
but, he's not backing a personality, he says he's backing the better idea -- and, he doesn't want the ""One Big Beautiful Bill"" to pass through the Senate.
We caught up with the…",https://www.tmz.com/2025/06/07/ben-crump-weighs-in-donald-trump-elon-musk-feud/
Burgess wins first World Cup silver in six years,2025-06-08 16:21:33 (KST),Britain's Adam Burgess claims his first World Cup silver medal since 2019 with an impressive showing in La Seu d'Urgell.,https://www.bbc.com/sport/canoeing/articles/c4gr3pnd5e3o
