Title,Published(Kor),Description,Link
"Amazon Is Running a Clearance Sale on Seagate SSDs, Now the Final Models Are at Record-Low Prices",2025-06-12 20:25:57 (KST),Seagate is our top pick for secure external HDD storage.,https://gizmodo.com/amazon-is-running-a-clearance-sale-on-seagate-ssds-now-the-final-models-are-at-record-low-prices-2000614778
Status (and the grass tax),2025-06-12 18:03:00 (KST),"Status shows up whenever humans do, and it is the invisible underpinning of our culture.
The front lawn was only invented around the time of Columbus.
The idea was to demonstrate that you had time and money to waste.
You could take useful land and make it non…",https://seths.blog/2025/06/status-and-the-grass-tax/
New economic data has reignited Trump's fight with the Fed over cutting interest rates,2025-06-12 21:10:18 (KST),"Inflation isn't rising as expected, and Americans are feeling less anxious about it.
But the fight to cut interest rates is heating up.",https://www.businessinsider.com/new-economic-data-trump-vs-powell-2025-6
Howard Schultz says he is a big fan of Brian Niccol's 'brilliant' Starbucks revival strategy,2025-06-12 14:48:03 (KST),"Schultz said he did a ""cartwheel in my living room"" when he heard Niccol's turnaround plan for the coffee chain.",https://www.businessinsider.com/howard-schultz-fan-brian-niccols-plan-starbucks-2025-6
Americans flunk retirement literacy quiz. Here's why it matters.,2025-06-12 18:00:00 (KST),"New report says most Americans don't know basic retirement concepts like Social Security benefits, Medicare coverage, employment-based retirement savings...",https://finance.yahoo.com/news/americans-flunk-retirement-literacy-quiz-heres-why-it-matters-090000055.html
TIME and 360BusinessMedia Announce TIME France,2025-06-12 15:00:00 (KST),"Today, TIME and 360BusinessMedia announced TIME France, a licensed French edition of TIME’s iconic publication.
The first issue is scheduled for release at the end of 2025, with a dedicated website launching Fall 2025.
TIME France will feature: A dedicated Fr…",https://time.com/7293178/time-and-360businessmedia-announce-time-france/
Air India plane 'involved in incident' en route to United Kingdom,2025-06-12 18:06:54 (KST),"Flight AI171 was operating from Ahmedabad-London Gatwick, Air India said.",https://abcnews.go.com/International/air-india-plane-involved-incident-en-route-united/story?id=122762055
"Amazon Is Going All Out, This Top-Performance TP-Link WiFi 7 Router Is Selling for Peanuts Before Prime Day",2025-06-12 21:10:11 (KST),This router supports WiFi 7 and will keep your home online for the next ten years.,https://gizmodo.com/amazon-is-going-all-out-this-top-performance-tp-link-wifi-7-router-is-selling-for-peanuts-before-prime-day-2000614785
SchemeFlow (YC S24) Is Hiring a Founding Engineer (London) to Speed Up Construction,2025-06-12 18:08:43 (KST),"Overview We’re looking for an excellent Full-Stack Engineer to join the team.
Someone with unstoppable grit, a relentless bias to action, and a “make it happen” mentality.
You’ll be joining the trenches in a Y-Combinator backed AI company in London.
You’ll be…",https://www.ycombinator.com/companies/schemeflow/jobs/SbxEFHv-founding-engineer-full-stack
How Microsoft Office Moved from Source Depot to Git,2025-06-12 09:15:23 (KST),"Part 7 of my software journey, getting to know developer experience.",https://danielsada.tech/blog/carreer-part-7-how-office-moved-to-git-and-i-loved-devex/
My Mac Contacted 63 Different Apple Owned Domains in One Hour – While Not Is Use,2025-06-12 20:21:16 (KST),"During a one hour period today, my computer contacted 63 different Apple domains while i was not logged on and using it.
I have been trying to minimize to the extent possible the reach of big tech into my life.
A full 25% of the DNS queries from one of my co…",https://appaddict.app/post/my-mac-contacted-63-different-apple-owned-domains-in-one-hour-while-not-is-use
Injured Skin Cells Fire like Neurons to ‘Scream’ for Help,2025-06-12 19:45:00 (KST),Our skin’s epithelial cells send electrical signals like neurons to cry out for help,https://www.scientificamerican.com/article/injured-skin-cells-fire-like-neurons-to-scream-for-help/
Blockbuster New Vera Rubin Observatory Will Change Astronomy Forever,2025-06-12 20:00:00 (KST),The game-changing Vera Rubin Observatory will collect more astronomical data in its first year than all other telescopes combined,https://www.scientificamerican.com/article/blockbuster-new-vera-rubin-observatory-will-change-astronomy-forever/
"Wings & Wheels brings aircraft, classic cars, historic boats & food trucks to Sheboygan airport on Father's Day",2025-06-12 18:30:49 (KST),"The 32nd Wings & Wheels event will be at Sheboygan County Memorial Airport from 7 am.
to 4 p.m.
June 15.",https://www.sheboyganpress.com/story/entertainment/events/2025/06/12/wings-wheels-eaa-event-in-sheboygan-when-where-this-fathers-day-2025/84153940007/
A19: Building a Bold Startup Branding and Visual Identity,2025-06-12 13:28:12 (KST),"A19: Building a Bold Startup Branding and Visual Identity abduzeedo 06/11 — 2025 Explore the striking branding and visual identity of A19 Startup House.
Discover how Tradition, Science, and Energy shaped this unique project.
Hey, creative folks! We'…",https://abduzeedo.com/node/88842
Switch 2発売に合わせ一部ゲームがアップデート。おすそわけ通信にも対応,2025-06-12 12:00:00 (KST),Image:RaymondWong/GizmodoUSSwitch2が出たからって初代Switchを捨てるのはまだ早い！Switch2発売に合わせて、初代Switchのゲームもいろいろアップデートされました。Switch2との互換性を保つパッチも出てますし、Switch2と対応ソフトがあれば新旧つないで友だちとゲームが楽しめる便利な「おすそわけ通信（GameShare）」も新登場。噂の有機EL版S,https://www.gizmodo.jp/2025/06/your-og-switch-isnt-quite-dead-yet-even-in-the-switch-2-era.html
Scientists just took a big step toward the quantum internet,2025-06-12 16:14:13 (KST),"A team of Danish and German scientists has launched a major project to create new technology that could form the foundation of the future quantum internet.
They re using a rare element called erbium along with silicon chips like the ones in our phones to prod…",https://www.sciencedaily.com/releases/2025/06/250612031413.htm
Digital Realty CTO on why storage is the datacenter challenge no one's talking about,2025-06-12 21:22:12 (KST),"And why supporting quantum computing is easier than supporting a 1MW rack Interview When the great and the good of the datacenter world got together in Cannes last week for Datacloud Global Congress, storage was barely mentioned, with shortages of GPUs, power…",https://www.theregister.com/2025/06/12/digital_realty_cto_interview/
"Stormzy Announces New Film Studio, '#Merky Films', and His First Lead Acting Role",2025-06-12 13:20:36 (KST),"Today, British rapper Stormzy announced #Merky Films, the latest extension to a growing creative empire he has amassed under his #Merky imprint.
The award-winning artist is also set to star in its very first release, Big Man, a short-film that will see the gr…",https://hypebeast.com/2025/6/stormzy-announces-new-film-studio-merky-films-and-his-first-lead-acting-role-big-man
