Title,Published(Kor),Description,Link
"GeekBook X14 Pro Review: Geekom's First Laptop Is Impressively Thin and Light, but Battery Life Disappoints",2026-02-15 21:01:04 (KST),And I detest the touch pad.,https://www.cnet.com/tech/computing/geekom-geekbook-x14-pro-review-impressively-thin-light-battery-life-disappoints/
Want a mortgage for under 3% in 2026? Meet the 'assumable mortgage',2026-02-15 21:00:00 (KST),"Low mortgage rates from the COVID era might still be attainable for homebuyers, if they find the right house and have the cash.",https://www.npr.org/2026/02/15/nx-s1-5704697/assumable-mortgage-rates-housing-market
"For U.S. pairs skater Danny O'Shea, these Olympics are 30 years in the making",2026-02-15 21:00:00 (KST),"Danny O'Shea turned 35 at his first Olympics, after three decades of skating and two reversed retirements.",https://www.npr.org/2026/02/15/nx-s1-5713620/olympics-danny-oshea-ellie-kam-pairs-figure-skating
I'm going to Disneyland with my kids for the first time. I'm terrified.,2026-02-15 20:41:01 (KST),"In this Sunday edition of Business Insider Today, we're talking about how going to Disneyland has gotten so expensive.",https://www.businessinsider.com/bi-today-sunday-newsletter-first-disneyland-trip-anxiety-expensive-2026-2
I'm 76 and drive for Uber after losing my savings to my wife's cancer bills. I'm not sure how long I can keep driving.,2026-02-15 18:49:01 (KST),"Jeff Mason, a former construction manager, and his wife faced financial ruin due to medical bills in the 1990s.
Now, he drives for Uber at 76.",https://www.businessinsider.com/driving-for-uber-retirement-caregiving-cancer-medical-bills-2026-2
"When retirement is 19 credit cards and $40,000 in debt away",2026-02-15 17:11:01 (KST),"Susan Cannon, 73, owes nearly $40,000 across 19 credit cards.
High interest rates are preventing her from retiring.",https://www.businessinsider.com/credit-card-debt-trap-high-interest-rates-retirement-2026-2
Secret weapons of the Luftwaffe during World War 2,2026-02-15 16:01:58 (KST),Secret weapons of the Luftwaffe during World War 2,https://tech.yahoo.com/science/articles/secret-weapons-luftwaffe-during-world-070158571.html
Clean up your social media feed and cut the noise,2026-02-15 21:06:24 (KST),"Clean up chaotic social media feeds across Facebook, Instagram, TikTok, YouTube, X, Threads and LinkedIn using content preferences, feed filters and algorithm retraining techniques.",https://www.foxnews.com/tech/clean-up-your-social-media-feed-cut-noise
"Amazon, Google Unwittingly Reveal the Severity of the U.S. Surveillance State",2026-02-15 21:42:17 (KST),"Just a decade after a global backlash was triggered by Snowden reporting on mass domestic surveillance, the state-corporate dragnet is stronger and more invasive than ever.",https://greenwald.substack.com/p/amazons-ring-and-googles-nest-unwittingly
Ex-Tech –> Homeless in SF,2026-02-15 15:48:13 (KST),"From Super Bowl brand activations to sleeping on a Redwood City bridge: a raw memoir of homelessness in San Francisco, dignity, and survival.",https://zamoshi.substack.com/p/ninety-four-degrees
5 Portable Outdoor Furniture Pieces That Transform: The First Is an Umbrella-Chair,2026-02-15 21:40:17 (KST),"5 Portable Outdoor Furniture Pieces That Transform: The First Is an Umbrella-ChairMany people dream of bringing the comfort of indoors outside.
Whether it’s a spontaneous picnic, a weekend camping trip, or simply enjoying a small balcony,...",https://www.yankodesign.com/2026/02/15/5-portable-outdoor-furniture-pieces-that-transform-the-first-is-an-umbrella-chair/
'Overwhelmed' Kim takes first win after 12 years away,2026-02-15 18:03:02 (KST),"American Anthony Kim says it is ""overwhelming"" after winning his first tournament since ending a 12-year absence from golf during which he battled drug and alcohol addiction.",https://www.bbc.com/sport/golf/articles/ce3gl4gdln3o
The Hidden Story of Young Martian Volcanoes,2026-02-15 18:48:13 (KST),"New research has revealed that Mars’ most recent volcanoes weren’t formed by simple, one off eruptions as scientists previously thought.
Instead, these volcanic systems evolved over millions of years, fed by complex underground magma chambers that changed and…",https://www.universetoday.com/articles/the-hidden-story-of-young-martian-volcanoes
Epstein files rock UK — but the real rot runs much deeper,2026-02-15 20:45:28 (KST),The contrast with Trump's America is both obvious and shocking — but it’s not the whole story,https://www.salon.com/2026/02/15/epstein-files-rock-uk-but-the-real-rot-runs-much-deeper/
Swarms of AI bots are threatening democracy,2026-02-15 20:00:56 (KST),The level of coordination among inauthentic online agents is unprecedented.,https://www.salon.com/2026/02/15/swarms-of-ai-bots-are-threatening-democracy-partner/
‘Tastes like chemical’: Namita Thapar slams beverage brand 3 Sisters; Viraj Bahl-Varun Alagh question ‘cluttered’ vision,2026-02-15 18:49:14 (KST),"On the latest episode of Shark Tank India 5, Varun Alagh, Viraj Bahl, Vineeta Singh, Namita Thapar, and Kunal Bahl gave brand building advice to 3 Sisters founders.",https://indianexpress.com/article/entertainment/television/shark-tank-india-5-namita-thapar-slams-3-sisters-viraj-bahl-varun-alagh-question-cluttered-vision-10533204/
Stay close in the season of yellow,2026-02-15 16:18:38 (KST),"In this season of gold and gamble, I keep hearing Faiz.",https://indianexpress.com/article/express-sunday-eye/basant-india-faiz-spring-yellow-poetry-cultural-reflection-10533209/
How To Identify What Really Matters & Reverse Engineer Your Life,2026-02-15 19:02:00 (KST),"Time is a limited resource, so how can we make ours align with what matters most?",https://www.mindbodygreen.com/articles/building-wealthy-life-means-family-presence-and-taking-back-your-time
Food Used to Be Democrats’ Territory. What Happened?,2026-02-15 20:00:00 (KST),"Last month, with great fanfare, Robert F.
Kennedy Jr.
unveiled the new dietary guidelines for Americans.
The advice was muddled—eat more meat but not more saturated fat!—and likely shaped by the very industry influences that Kennedy has vowed to curb.
Never m…",https://newrepublic.com/article/206571/food-reform-maha-democrats-obama
"Ottawa sees 'huge opportunity' as trade delegation heads to Mexico, says cabinet minister",2026-02-15 18:00:00 (KST),"A Canadian trade mission to Mexico this week could produce new deals by early spring, and marks the country's ""most significant"" such mission ever to Mexico, according to Canada-U.S.
Trade Minister Dominic LeBlanc.",https://www.cbc.ca/news/politics/trade-canada-mexico-9.7089835
