Title,Published(Kor),Description,Link
Only a fraction of House seats are competitive. Redistricting is driving that lower,2026-02-22 19:00:00 (KST),"Primary voters in a small number of districts play an outsized role in deciding who wins Congress.
The Trump-initiated mid-decade redistricting is driving that number of competitive seats even lower.",https://www.npr.org/2026/02/22/nx-s1-5707254/power-trump-congress-house-representatives-voters-control
PHOTOS: Your car has a lot to say about who you are,2026-02-22 21:15:04 (KST),"Photographer Martin Roemer visited 22 countries — from the U.S.
to Senegal to India — to show how our identities are connected to our mode of transportation.",https://www.npr.org/2026/02/22/g-s1-108825/photos-cars-vehicles
BI's reporters from our award-winning data centers package share what they're watching this year,2026-02-22 20:41:01 (KST),"In this Sunday edition of Business Insider Today, three reporters from our data centers investigation preview the themes they're watching this year.",https://www.businessinsider.com/bi-today-sunday-newsletter-data-centers-look-ahead-2026-2
I did Y Combinator in 2016 and 2025. The first time felt more 'family-style.',2026-02-22 20:00:01 (KST),"Quang Hoang did Y Combinator twice: In 2016 for Birdly and in 2025 for Vybe.
He said that his first experience was more ""family-style.""",https://www.businessinsider.com/quang-hoang-y-combinator-evolution-2026-2
"The economy grew strongly last year, but hiring stagnated. It's making the gap between the rich and everyone else worse.",2026-02-22 19:12:01 (KST),"The US economy grew 2.2% in 2025 while job creation stalled, exacerbating inequality in a ""K-shaped economy"" scenario.",https://www.businessinsider.com/economy-job-market-divide-k-shape-economy-2026-2
"'Eat your heart out, Marsha,' Newsom reply to GOP at Nashville event",2026-02-22 20:04:53 (KST),"Gov.
Gavin Newsom, who many hope will be a Democratic presidential nominee in 2028, ties issues in blue California to red states like Tennessee.",https://www.tennessean.com/story/news/politics/2026/02/22/gov-gavin-newsom-finds-enthusiastic-crowd-in-nashville-after-gop-jabs/88797484007/
The Surprising Skill MAGA Christians Say Is 'Sinful',2026-02-22 21:00:17 (KST),"As Christian nationalism rises, some influential voices are reframing this ability as weakness, manipulation or even a threat to faith.",https://www.huffpost.com/entry/the-surprising-skill-maga-christians-say-is-sinful-goog_n_69976218e4b0f4c9ebc660f6
"Llevamos años obsesionados con el cuidado de la piel asiático: el problema es que, hasta ahora, las marcas coreanas ignoraban al 90% del planeta",2026-02-22 20:30:51 (KST),"Una marca de cosméticos surcoreana se vio obligada a pedir disculpas recientemente tras promocionar uno de sus coloretes describiendo el tono como las ""adorables mejillas de un bebé mongol"".
La polémica estalló cuando la creadora de contenido Khaliun denunció…",https://www.xataka.com/magnet/llevamos-anos-obsesionados-cuidado-piel-asiatico-problema-que-ahora-marcas-coreanas-ignoraban-al-90-planeta
Most Americans disapprove of Trump; don't trust Dems in Congress more: Poll,2026-02-22 14:04:01 (KST),"A record high say he ""lacks good enough physical health"" to be president.",https://abcnews.com/Politics/americans-disapprove-trump-issues-americans-dont-trust-dems/story?id=130346647
The Orality Theory of Everything,2026-02-22 21:00:00 (KST),The decline of reading and the rise of social media are again transforming what it feels like to be a thinking person.,https://www.theatlantic.com/ideas/2026/02/social-media-literacy-crisis/686076/
The Internet Is Becoming a Dark Forest – and AI Is the Hunter,2026-02-22 10:15:38 (KST),"In the AI era, visibility equals vulnerability.
A shift from Zero Trust to Zero Visibility is underway.",https://opennhp.org/blog/the-internet-is-becoming-a-dark-forest.html
This Roof Catches Water from Air: 5 Ancient Designs That Solve Modern Problems,2026-02-22 21:40:27 (KST),"This Roof Catches Water from Air: 5 Ancient Designs That Solve Modern ProblemsOur homes are more than dwellings as they are living stories.
The most comforting ones merge the wisdom of the past with the ease of...",https://www.yankodesign.com/2026/02/22/this-roof-catches-water-from-air-5-ancient-designs-that-solve-modern-problems/
The forgotten sci-fi show that quietly predicted our world 14 years ago,2026-02-22 09:00:16 (KST),"A corporate-controlled surveillance state? Technology so useful it makes us complacent? Crazy talk, I tell you.",https://www.makeuseof.com/the-forgotten-sci-fi-show-that-quietly-predicted-our-world-14-years-ago/
Is Samsung’s ecosystem worth it in 2026? Here’s my advice after going all-in,2026-02-22 20:00:28 (KST),"Samsung makes a device in every product category you can think of, but is it worth investing in that ecosystem?",https://www.androidauthority.com/samsung-ecosystem-3639496/
This is the only Chrome trick you should know,2026-02-22 19:30:25 (KST),"Chrome is full of secret tricks and options, but one hidden flag brings an essential feature that makes reading articles a lot nicer.",https://www.androidauthority.com/this-is-only-chrome-trick-you-should-know-3642717/
Bad Bunny Pays Tribute to ‘Great Legend’ Willie Colón During Brazil Concert,2026-02-22 12:12:01 (KST),"""From me and Los Sobrinos, we wish Willie Colón rests in peace,"" Bad Bunny said, referencing his own live band.",http://www.rollingstone.com/music/music-news/bad-bunny-willie-colon-tribute-1235520735/
Disney Epic Mickey: Rebrushed (Nintendo Switch) $21 + Free Shipping,2026-02-22 19:10:56 (KST),"VIPOUTLET via Walmart has Disney Epic Mickey: Rebrushed (Nintendo Switch) for $21.
Shipping is free.
Thanks to Deal Hunter BBQchicken for finding this deal.",https://slickdeals.net/f/19229158-disney-epic-mickey-rebrushed-nintendo-switch-21-free-shipping
