Title,Published(Kor),Description,Link
UK and allies ready to back Ukraine before and after peace deal,2025-09-04 10:12:31 (KST),The UK and other allies hope to obtain clear US backing for their efforts to shore up Ukraine's defences.,https://www.bbc.com/news/articles/c5y85x58nj4o
"Samsung launches Galaxy S25 FE: The best of flagship features in a lighter, sleeker design",2025-09-04 18:30:00 (KST),"The Galaxy S25 FE arrives as a new, sleek, battery-rich device packed with all the latest Galaxy AI capabilities.",https://www.androidcentral.com/phones/samsung-galaxy/samsung-launches-galaxy-s25-fe
I went hands-on with the Samsung Galaxy S25 FE and Galaxy Tab S11 series — here's what's new,2025-09-04 18:30:00 (KST),"Samsung announced a midrange smartphone and two new tablets at IFA 2025, and they're all powered by One UI 8 and remarkably thin.
Here's what you need to know.",https://www.androidcentral.com/phones/samsung-galaxy/samsung-galaxy-s25-fe-galaxy-tab-s11-ultra-hands-on
Apple CEO Tim Cook Invited Back to White House for Tech Event,2025-09-04 21:14:25 (KST),"Apple CEO Tim Cook has been invited to an event for tech leaders at the White House today in the newly renovated Rose Garden, according to The Hill.
Cook is among more than two dozen technology executives invited to the White House by President Donald Tr…",https://www.macrumors.com/2025/09/04/tim-cook-invited-back-to-white-house/
"RFK Jr. faces Senate about CDC chaos. And, Harvard funding freeze ruled illegal",2025-09-04 20:08:35 (KST),"Robert F.
Kennedy Jr.
will testify in the Senate today after last week's shakeup at the CDC.
And, a federal judge says the Trump administration illegally froze billions of Harvard's funds.",https://www.npr.org/2025/09/04/g-s1-86935/up-first-newsletter-robert-f-kennedy-jr-cdc-federal-reserve-harvard-university
NFL commissioner says Taylor Swift would be 'welcome at any time' on the Super Bowl halftime stage,2025-09-04 16:47:35 (KST),"""It's a maybe,"" NFL Commissioner Roger Goodell said of the chances of Taylor Swift performing at next year's Super Bowl halftime show.",https://www.businessinsider.com/nfl-commissioner-taylor-swift-welcome-any-time-super-bowl-2025-9
"Instagram (finally) has an iPad app, and it's like the Cadillac of doomscrolling",2025-09-04 18:01:01 (KST),"Instagram finally made an iPad app.
At long last, the luxurious experience for brain-rotting yourself with Reels.",https://www.businessinsider.com/instagram-ipad-app-doomscrolling-reels-2025-9
How Google's antitrust win could end up hurting the company,2025-09-04 18:00:01 (KST),"The search monopoly looks weaker, not stronger, after this week's antitrust remedies.
Here's why.",https://www.businessinsider.com/google-antitrust-win-could-end-up-hurting-2025-9
How this Gen Z couple with $30K in student debt afforded a $435K home in Georgia,2025-09-04 17:08:02 (KST),"A Gen Z couple bought a $435K home in Georgia with help from a VA loan, family support, and a basement tenant.",https://www.businessinsider.com/gen-z-couple-buys-home-georgia-despite-student-debt-2025-9
America's colleges are having an identity crisis,2025-09-04 17:11:02 (KST),"Today's college freshmen face sky-high tuition and debt, shaky career paths, and mixed messaging on AI.
Universities are scrambling to respond.",https://www.businessinsider.com/america-colleges-identity-crisis-students-class-2029-ai-paradox-2025-9
Microsoft BASIC For 6502 Is Now Open Source,2025-09-04 20:00:37 (KST),"An overriding memory for those who used 8-bit machines back in the day was of using BASIC to program them.
Without a disk-based operating system as we would know it today, these systems invariably …",https://hackaday.com/2025/09/04/microsoft-basic-for-6502-is-now-open-source/
Flash flood warning issued for Tucson area,2025-09-04 10:52:35 (KST),"The National Weather Service has issued a flash flood warning for Pima County on Sept.
3.",https://www.azcentral.com/story/news/local/arizona-weather/2025/09/03/flash-flood-warning-issued-for-tucson-area/85965858007/
Mamdani calls reports of Trump meddling in NYC mayor's race an 'affront to democracy',2025-09-04 09:33:38 (KST),"New York City mayoral candidate Zohran Mamdani called reports that the White House is considering jobs for Eric Adams and Curtis Sliwa an ""affront to our democracy.""",https://abcnews.go.com/Politics/mamdani-calls-reports-white-house-meddling-nyc-mayors/story?id=125232546
Samsung’s Galaxy S25 FE ‘Fan Edition’ Is a Cut-Down S25+ For $350 Less,2025-09-04 18:30:42 (KST),"The Galaxy S25 FE also costs $150 less than the regular S25, which has a smaller display.",https://gizmodo.com/samsungs-galaxy-s25-fe-fan-edition-is-a-cut-down-s25-for-350-less-2000653129
Samsung’s Galaxy Tab S11 Tablets Come in Two Sizes: Big and Absolutely Huge,2025-09-04 18:30:12 (KST),Those are the two sizes you get for the Galaxy Tab S11 and Tab S11 Ultra.,https://gizmodo.com/samsungs-galaxy-tab-s11-tablets-come-in-two-sizes-big-and-absolutely-huge-2000653090
"After a Complicated Legal Past, AI Set Her Free",2025-09-04 18:51:57 (KST),Rasa Legal uses generative AI and other automation software to accelerate the expungement process.,https://gizmodo.com/ai-expunge-past-records-criminal-2000650531
The Military Wasn’t Built to Fight Crime,2025-09-04 09:25:00 (KST),A missile strike in the Caribbean and National Guard deployments are pushing the armed forces beyond their traditional mission.,https://www.theatlantic.com/national-security/archive/2025/09/the-military-wasnt-built-to-fight-crime/684101/
Record payout for victims of 'illegal and immoral' Australian welfare scheme,2025-09-04 13:16:14 (KST),"Hundreds of thousands of Australians were forced to repay debts, many of which did not even exist.",https://www.bbc.com/news/articles/clyx3jvk4zeo
Le Chat. Custom MCP Connectors. Memories,2025-09-04 20:04:36 (KST),Le Chat now integrates with 20+ enterprise platforms—powered by MCP—and remembers what matters with Memories.,https://mistral.ai/news/le-chat-mcp-connectors-memories
Polars Cloud and Distributed Polars now available,2025-09-04 12:01:49 (KST),DataFrames for the new era,https://pola.rs/posts/polars-cloud-launch/
