Title,Published(Kor),Description,Link
"OnePlus makes its shift from Hasselblad official, debuts DetailMax Engine",2025-09-06 18:22:00 (KST),"OnePlus CEO officially confirmed that the company will depart from Hasselblad in favor of a new, in-house imaging engine.",https://www.androidcentral.com/phones/oneplus/oneplus-shift-from-hasselblad-official-debuts-detailmax-engine
"Opinion: Susan Stamberg, trailblazer and NPR Founding Mother, retires",2025-09-06 21:00:00 (KST),"NPR Founding Mother Susan Stamberg is retiring.
She became the first woman to anchor a nightly national news program in 1972, and helped loosen up the serious, stodgy sound of radio hosts.",https://www.npr.org/2025/09/06/nx-s1-5522120/opinion-susan-stamberg-trailblazer-and-npr-founding-mother-retires
"Amid debate about U.S. history, Harlem Hellfighters receive Congressional Gold Medal",2025-09-06 19:01:00 (KST),"The Harlem Hellfighters, who became legends for their service during World War I, were honored this week with a Congressional Gold Medal.",https://www.npr.org/2025/09/06/g-s1-87313/amid-debate-about-u-s-history-harlem-hellfighters-receive-congressional-gold-medal
Alcaraz beats Djokovic at the U.S. Open and will meet Sinner for Grand Slam final,2025-09-06 14:16:32 (KST),"Sinner is trying to become the first repeat men's champion in New York since Roger Federer won the tournament five years in a row.
Alcaraz hasn't dropped a set as he pursues his second U.S.
Open title.",https://www.npr.org/2025/09/06/g-s1-87443/alcaraz-beats-djokovic-u-s-open
School is back in session. Here's how you can stay focused.,2025-09-06 19:41:01 (KST),"In this Saturday edition of Business Insider Today, we're talking about deep breathing exercises for the transition into fall.",https://www.businessinsider.com/bi-today-saturday-newsletter-back-to-school-focus-2025-9
Trump Shifts Blame for Poor August 2025 Jobs Report,2025-09-06 20:45:01 (KST),"President Donald Trump is downplaying the latest disappointing jobs report and shifting blame for the weak numbers to the Federal Reserve.
It comes as...",https://www.yahoo.com/news/videos/trump-shifts-blame-poor-august-114501179.html
What to know about a large-scale immigration raid at a Georgia manufacturing plant,2025-09-06 13:01:16 (KST),"Hundreds of federal agents descended on a sprawling site where Hyundai manufactures electric vehicles in Georgia and detained 475 people, most of them South ...",https://www.yahoo.com/news/articles/know-large-scale-immigration-raid-040116570.html
"Dream's Howard does it again, sinks record 9 3's",2025-09-06 13:05:06 (KST),Rhyne Howard hit a record-tying nine 3-pointers Friday night to help the Dream clinch home court in the first round of the playoffs.,https://www.espn.com/wnba/story/_/id/46171454/dream-rhyne-howard-ties-wnba-mark-again-9-3-pointers
"By Contacts We Are Saved: The Forgotten Visionary Jane Ellen Harrison on Change, the Meaning of Faith, and the Courage of Heresy",2025-09-06 11:55:47 (KST),"Alpha and Omega, originally published in 1915, is the third title in Marginalian Editions.
Below is my foreword to the new edition, as it appears in on its pages.
“Have faith,” someone I loved said to me, holding my face in her hands — the face of a lifelong …",https://www.themarginalian.org/2025/09/05/jane-ellen-harrison-alpha-omega/
"Top 10 Headphones That Could Take On Apple, Sony, & Bose In The Premium Market",2025-09-06 20:40:18 (KST),"Top 10 Headphones That Could Take On Apple, Sony, & Bose In The Premium MarketSomething interesting is happening in the headphone world.
The big three—Apple, Sony, and Bose—still dominate store shelves, but scrappy newcomers are designing circles around them.…",https://www.yankodesign.com/2025/09/06/top-10-headphones-that-could-take-on-apple-sony-bose-in-the-premium-market/
I started using this calendar-task manager combo and my days run smoother,2025-09-06 20:00:16 (KST),The combo I didn’t know I needed.,https://www.makeuseof.com/morgen-calendar-task-combo/
No more waiting for lines: New Windows keyboard shortcuts output em and en dashes with ease,2025-09-06 20:28:15 (KST),"Insider builds have them now.
Everyone else will have to employ other methods Hands on Writers rely on the humble em dash (—) and en dash (–) to add flavor and function to their sentences.
But typing these characters, which are slightly longer than a hyphen, …",https://www.theregister.com/2025/09/06/windows_keyboard_shortcuts_dashes/
These 1990s Cars Are Skyrocketing In Value,2025-09-06 21:05:00 (KST),"You might expect an older Ferrari to appreciate in value, but Honda? Toyota? Chevy? It's not just sports cars from the '90s that are suddenly red hot.",https://www.jalopnik.com/1956613/1990s-cars-increasing-in-value/
10 Weekend Reads,2025-09-06 19:30:29 (KST),"The weekend is here! Pour yourself a mug of Colombia Tolima Los Brasiles Peaberry Organic coffee, grab a seat outside, and get ready for our longer-form weekend reads: • MotorTrend Lived With A Tesla Model Y For 2 Years And Hated Every Second Of It: After ope…",https://ritholtz.com/2025/09/10-weekend-reads-56/
KDE Releases First Alpha of its New Linux Distribution,2025-09-06 20:30:00 (KST),"KDE has launched its own immutable Linux distribution in alpha.
It acts as a 'reference implementation', offering atomic updates, Flatpak apps and more.
You're reading KDE Releases First Alpha of its New Linux Distribution, a blog post from OMG! Ubuntu.
Do no…",https://www.omgubuntu.co.uk/2025/09/kde-linux-immutable-distro-alpha-released
Celebrate Chloe Calandra's 25th Birthday With Her Smokin' Shots,2025-09-06 10:02:19 (KST),"Chloe Calandra is celebrating a quarter century on Earth ...
and we're celebrating her smoking hot looks.
The influencer is turning 25 years old today, so it's the perfect opportunity for folks to get acquainted with the sexy birthday girl.
Check…",https://www.tmz.com/2025/09/05/celebrate-chloe-calandra-25th-birthday-with-her-smokin-shots/
Iowa vs. Iowa State Livestream: How to Watch Today’s Rivalry Game Online,2025-09-06 21:01:00 (KST),"Here's where to watch the Iowa vs.
Iowa State game online without cable, and how to get the Cyclones vs.
Hawkeyes livestream on Fox with a free trial.",http://www.rollingstone.com/product-recommendations/streaming/watch-iowa-iowa-state-college-football-game-online-free-2025-1235420414/
"Allegiant is plotting major revamp for loyalty program, building on breakneck growth",2025-09-06 21:00:19 (KST),"Allegiant Air is currently planning a major revamp to its loyalty program, TPG learned in an exclusive interview.",https://thepointsguy.com/news/allegiant-air-planning-loyalty-program-revamp/
Male-only succession rules overshadow Japan prince’s coming-of-age,2025-09-06 16:15:12 (KST),"Prince Hisahito is first male royal to reach adulthood in 40 years.
He could also be last in world's oldest monarchy.",https://www.aljazeera.com/gallery/2025/9/6/male-only-succession-rules-overshadow-japan-princes-coming-of-age
Medicine is being invented in Gaza,2025-09-06 19:29:35 (KST),"As medical students in Gaza, we are taught how to save lives with nothing and how to make impossible decisions.",https://www.aljazeera.com/opinions/2025/9/6/medicine-is-being-invented-in-gaza
