Title,Published(Kor),Description,Link
"One Vigilante, 22 Cell Towers, and a World of Conspiracies",2025-09-16 19:00:00 (KST),"Inside the mind of the most prolific anti-5G arsonist in the world—and the incoherent, very online political violence of our era.",https://www.wired.com/story/22-cell-towers-one-vigilante-world-of-conspiracies/
Microsoft’s Xbox PC app adds Steam games and access to other stores,2025-09-16 18:03:20 (KST),"Microsoft is rolling out a new aggregated gaming library inside its Xbox PC app today on Windows.
The updated app will now list games from Steam, Battle.net, and other PC storefronts — making it a launcher for games you have installed on your PC.
Microsoft ha…",https://www.theverge.com/news/778627/microsoft-xbox-pc-app-stream-integration-stores-update
Nothing plans to launch ‘first AI-native devices next year’,2025-09-16 19:02:53 (KST),London-based consumer tech startup Nothing has raised $200 million and vowed to usher in a new generation of “AI-native” devices running on operating systems that “are significantly different from the ones today.” In a press release that reads part ode to tec…,https://www.theverge.com/news/778636/nothing-ai-native-devices
Amazon’s next Prime Day sale is happening on October 7th,2025-09-16 13:28:23 (KST),"Amazon has announced its fall Prime Big Deal Days event.
It starts at 12:01AM PT / 3:01AM ET on Tuesday, October 7th, and runs through Wednesday, October 8th.
Of course, we’ll bring you all the best deals on Verge-approved gadgets once they become available.
…",https://www.theverge.com/news/774151/amazon-october-prime-day-fall-dates-2025
The Apple Watch SE 3 is the one to buy,2025-09-16 09:48:08 (KST),"When I walked into Apple Park last week, there was one thing that I did not have on my bingo card: the $249 Apple Watch SE 3 stealing the show from the Apple Watch Series 11 and the Apple Watch Ultra 3.
But here we are.
It's 2025, and the entry-level Apple Wa…",https://www.theverge.com/smartwatch-review/778037/apple-watch-se-3-review-battery-specs-watchos-26-smartwatch-wearable
Samsung Galaxy S25 users finally get One UI 8 as it expands to more devices,2025-09-16 19:21:00 (KST),"Samsung officially launches One UI 8 for the Galaxy S25 today, following extensive beta testing.
This update promises enhanced AI features, personalized user experiences, and strengthened security.",https://www.androidcentral.com/apps-software/android-os/one-ui-8-expands-finally-for-galaxy-s25-and-foldables-ai-features-and-enhanced-security
Meta 'Ray-Ban Display' glasses with gesture input spotted early in alleged promo video,2025-09-16 18:45:00 (KST),"The company's next smart glasses, which rumors say will have a single ocular HUD, suddenly surface in a leaked video.",https://www.androidcentral.com/gaming/virtual-reality/meta-ray-ban-display-glasses-gesture-input-spotted-early-in-alleged-promo-video
'A New Story': Apple Store in Tokyo Returning to Original 2003 Location,2025-09-16 12:03:03 (KST),"More than three years after Apple Ginza moved to a temporary location, the store is set to return to its original home in Tokyo's famous shopping district.
Apple's original Ginza store Apple today announced its temporary store in Ginza 8-chōme will be per…",https://www.macrumors.com/2025/09/15/apple-ginza-moving-soon/
"JD Vance vows to carry on Kirk's legacy. And, the Fed meets to decide interest rates.",2025-09-16 19:03:28 (KST),"Vice President Vance hosted Charlie Kirk's podcast yesterday and vowed to carry on his friend's political legacy.
And, the Federal Reserve meets to decide interest rates.",https://www.npr.org/2025/09/16/g-s1-88997/up-first-newsletter-jd-vance-charlie-kirk-kash-patel-testimony-federal-reserve-interest-rates
"I left Bain to launch a startup solving a problem I faced every day. Consulting skills helped, but here's what I had to pick up on my own.",2025-09-16 09:00:02 (KST),"Daphne Tay left Bain to fix a daily work pain.
Consulting skills helped, but she had to learn sales and the startup playbook from scratch.",https://www.businessinsider.com/left-bain-launch-ai-startup-consulting-lessons-bluente-2025-9
Defense tech's hottest new weapon: company swag,2025-09-16 18:00:03 (KST),"Anduril, Palantir and others are using merch to engage fans and investors.",https://www.businessinsider.com/defense-tech-companies-courts-fans-with-merch-swag-vibes-2025-9
How Lyft’s CEO Got the Company Moving Again,2025-09-16 21:10:00 (KST),"What it takes to rebuild confidence, culture, and competitive edge.",https://hbr.org/podcast/2025/09/how-lyfts-ceo-got-the-company-moving-again
Photos show how an Indonesian motorbike mechanic became a macaw trainer,2025-09-16 12:07:58 (KST),"With two brightly feathered macaws perched on his hands, their long tails brushing against him, Albi Albar Ramli balanced on his motorbike on a Saturday...",https://www.yahoo.com/lifestyle/articles/photos-show-indonesian-motorbike-mechanic-030758212.html
Who’s Winning the War on Higher Education?,2025-09-16 18:20:00 (KST),"With Trump threatening federal funding and students filming classrooms, it’s pressure from above and below.",https://slate.com/podcasts/what-next/2025/09/how-trump-is-taking-over-higher-education
Roto and category league rankings for 2025-26,2025-09-16 20:36:25 (KST),"Updated fantasy basketball rankings for roto and category leagues, including where Stephen Curry lands in the top 150.",https://www.espn.com/fantasy/basketball/story/_/id/46273762/fantasy-basketball-roto-category-league-rankings-2025-26-nba-season
Just Duke ‘Em! The Frank Sinatra Guide to Tipping,2025-09-16 09:46:04 (KST),"Frank Sinatra had a word for tipping: duking.
And no one duked like Sinatra.
Tom Dreesen, his longtime opening act, said Frank would never make a show of it.
Instead, folded bills were passed in an ordinary-seeming handshake.
In fact, ol’ Blue Eyes rarely did…",https://www.artofmanliness.com/uncategorized/frank-sinatra-tipping/
Just Duke ‘Em! The Frank Sinatra Guide to Tipping,2025-09-16 09:46:04 (KST),"Frank Sinatra had a word for tipping: duking.
And no one duked like Sinatra.
Tom Dreesen, his longtime opening act, said Frank would never make a show of it.
Instead, folded bills were passed in an ordinary-seeming handshake.
In fact, ol’ Blue Eyes rarely did…",https://www.artofmanliness.com/character/etiquette/frank-sinatra-tipping/
Understanding Zionism,2025-09-16 21:00:00 (KST),The movement for Jewish settlement of Palestine resembles other nationalisms of its era.,https://www.theatlantic.com/international/archive/2025/09/zionism-israel-palestine-origin/684210/
‘Society Neglects the Nuclear Threat at Its Peril’,2025-09-16 20:00:00 (KST),Readers respond to our August 2025 issue and more.,https://www.theatlantic.com/magazine/archive/2025/10/the-commons/683958/
Awe Is Essential,2025-09-16 19:00:00 (KST),"When we see ourselves in the context of wonder, it makes us humbler.",https://www.theatlantic.com/ideas/archive/2025/09/awe-wonder-political-emotion-darkness-overcome/684209/
