Title,Published(Kor),Description,Link
"Shark Attacks on Humans Aren’t Always What They Seem, Scientists Say",2025-04-25 13:00:41 (KST),"Sharks rarely bite humans in the first place.
And in a new study Friday, researchers have found that some of these bites are wholly defensive.",https://gizmodo.com/shark-attacks-on-humans-arent-always-what-they-seem-scientists-say-2000594028
Pope Francis's funeral Mass details published in full,2025-04-25 18:44:01 (KST),The Vatican has released the order of service ahead of the funeral of Pope Francis on Saturday.,https://www.bbc.com/news/articles/c8rg4l4nzlno
Ukraine may have to give up land for peace - Kyiv Mayor Klitschko,2025-04-25 14:02:44 (KST),"Vitaliy Klitschko tells the BBC that although unfair, it could be a temporary solution to end the fighting.",https://www.bbc.com/news/articles/cp348ygjgy3o
OPPO Find X8 Ultra vs. Samsung Galaxy S25 Ultra: It's not even a contest,2025-04-25 17:24:07 (KST),"With the Find X8 Ultra, OPPO has one of the best overall packages of 2025.
Thanks to outstanding cameras and excellent tuning, the phone destroys the Galaxy S25 Ultra in key areas.",https://www.androidcentral.com/phones/oppo-phones/oppo-find-x8-ultra-vs-samsung-galaxy-s25-ultra
Successful women opened up their closets. Here's what they can't live without.,2025-04-25 18:16:01 (KST),"Some successful women like to wear basics from Skims and Theory, while others prefer luxury items, including Gucci loafers and Sezane coats.",https://www.businessinsider.com/clothes-successful-women-wear-popular-brands-2025-4
GTA V and VTubers top Twitch’s list of 2024 streaming trends,2025-04-25 09:52:52 (KST),"Twitch has revealed more information about its streaming trends of 2024, and GTA V is its most popular game, while VTubers are on the rise.",https://venturebeat.com/games/gta-v-and-vtubers-top-twitchs-list-of-2024-streaming-trends/
Elmira police officers involved in early morning shooting on Water Street. Traffic closed,2025-04-25 21:14:39 (KST),"An officer-involved shooting on East Water Street is under investigation, Elmira police said.",https://www.stargazette.com/story/news/local/2025/04/25/officer-involved-shooting-friday-morning-in-elmira-on-e-water-street/83269061007/
Jim Schlossnagle is at the center of the Texas-Texas A&M storm,2025-04-25 20:52:58 (KST),"As if the Texas-Texas A&M rivalry needed more, Jim Schlossnagle's decision to switch rivals adds all the extra drama.",https://www.espn.com/college-sports/story/_/id/44802867/college-baseball-texas-longhorns-texas-aggies-jim-schlossnagle-exit-rivalry
Introducing Marginalian Editions: Extraordinary Forgotten Books Brought Back to Life,2025-04-25 09:52:05 (KST),"I have become a person on the pages and in the margins of books.
In nearly two decades of reckoning with my reading in writing, it has been my ongoing lamentation to see works of enduring beauty and substance perish out of print — because the ideas they condu…",https://www.themarginalian.org/2025/04/24/introducing-marginalian-editions/
How the public's shift on immigration paved the way for Trump's crackdown,2025-04-25 21:07:55 (KST),"Since returning to the White House, President Donald Trump has launched an unprecedented campaign of immigration enforcement that has pushed the limits of executive power and clashed with federal judges trying to restrain him",https://abcnews.go.com/US/wireStory/publics-shift-immigration-paved-trumps-crackdown-121153900
Observability 2.0 and the Database for It,2025-04-25 11:39:00 (KST),"Observability 2.0 centers around “wide events,” breaking down the silos between metrics, logs, and traces.
This article outlines the core ideas and technical challenges of this new paradigm, and introduces how GreptimeDB, a native open-source database for wid…",https://greptime.com/blogs/2025-04-25-greptimedb-observability2-new-database
Intercontinental Exchange: Mortgage Delinquency Rate Increased in March,2025-04-25 21:11:00 (KST),From ICE: ICE First Look at Mortgage Performance: Delinquencies Improved Seasonally in March but Continue to Trend Modestly Higher Interco...,https://www.calculatedriskblog.com/2025/04/intercontinental-exchange-mortgage.html
Wild NYC Author Ryan Mandelbaum Takes a Wildlife-Filled Walk in Prospect Park,2025-04-25 19:00:00 (KST),Take a walk through Prospect Park with Wild NYC writer Ryan Mandelbaum and learn to connect with nature no matter how urban your environment is.,https://www.scientificamerican.com/podcast/episode/wild-nyc-author-ryan-mandelbaum-takes-a-wildlife-filled-walk-in-prospect/
Is There Any Sound in Space?,2025-04-25 19:45:00 (KST),"It seems contrary to common knowledge, but sound can travel through some parts of space quite well",https://www.scientificamerican.com/article/is-there-any-sound-in-space/
Most fatal lightning strikes kill people doing this routine activity,2025-04-25 19:02:18 (KST),"Already this spring, two in the U.S.
have been struck and killed by lightning, both while fishing from a boat.",https://www.usatoday.com/story/news/weather/2025/04/25/lightning-death-fishing-open-water/83250545007/
Inside Apple Journal - the most personal diary you'll ever have,2025-04-25 21:04:47 (KST),"Imagine turning everyday experiences — a photo, a song, a quiet moment — into something worth remembering.
With Apple's Journal app, you can do just that, but only on your iPhone.How to get the most out of JournalJournal isn't just about capturing your though…",https://appleinsider.com/inside/ios/tips/inside-apple-journal---the-most-personal-diary-youll-ever-have
Cassette Tape Speaker Brings Together Retro Aesthetics with Modern Functionality,2025-04-25 10:45:15 (KST),"Cassette Tape Speaker Brings Together Retro Aesthetics with Modern FunctionalityIn a world dominated by invisible playlists and algorithmic soundtracks, there’s something charming—almost rebellious—about holding music in your hand again.
Not through vinyl, no…",https://www.yankodesign.com/2025/04/24/cassette-speaker-brings-together-retro-aesthetics-with-modern-functionality/
"The 8 Most Important PPC KPIs You Should Be Tracking via @sejournal, @brookeosmundson",2025-04-25 21:00:20 (KST),"Discover the essential PPC KPIs, beyond CTR and CPC, to measure profit, incrementality, and real business impact from your paid media.
The post The 8 Most Important PPC KPIs You Should Be Tracking appeared first on Search Engine Journal.",https://www.searchenginejournal.com/ppc-guide/most-important-ppc-kpis-should-be-tracking/
"In Case You Missed It, This Lovecraft Meets Battlestar Galactica Game Is Out Right Now",2025-04-25 20:44:00 (KST),"It has been a wild week for video games, and between the headline-grabbing news of shadow-dropped games and turbulent console preorders, it's only natural that some stuff has flown under the radar.
Starless Abyss is one such example here, as this blend of rog…",https://www.gamespot.com/articles/in-case-you-missed-it-this-lovecraft-meets-battlestar-galactica-game-is-out-right-now/1100-6531120/
This would have been the perfect time for Motorola to make a new Moto 360 Wear OS watch,2025-04-25 18:23:40 (KST),This was the perfect time for Motorola to revive its ecosystem with a powerful new Moto 360 Wear OS smartwatch.,https://www.androidauthority.com/motorola-moto-360-wear-os-watch-3548031/
