Title,Published(Kor),Description,Link
The head of Africa CDC thought news of a U.S. aid freeze must be 'a joke.' Now what?,2025-03-31 20:41:20 (KST),"Dr.
Jean Kaseya is now figuring out how to cope with the new foreign aid landscape.",https://www.npr.org/sections/goats-and-soda/2025/03/31/g-s1-56094/africa-centers-disease-control-aid-freeze-jean-kaseya
Beloved historic landmarks navigate an uncertain future after the LA fires,2025-03-31 18:00:00 (KST),"In Pasadena, The Gamble House was in a fire evacuation zone and its custodians are trying to safeguard its future.
In Altadena, only concrete walls are left from the former home of novelist Zane Grey.",https://www.npr.org/2025/03/31/nx-s1-5336326/la-fires-historic-landmarks-preservation-gamble-house-zane-grey-estate
Copilot Can't Beat a 2013 'TouchDevelop' Code Generation Demo for Windows Phone,2025-03-31 09:34:00 (KST),"What happens when you ask Copilot to ""write a program that can be run on an iPhone 16 to select 15 random photos from the phone, tint them to random colors, and display the photos on the phone""? That's what TouchDevelop did for the long-discontinued Windows…",https://developers.slashdot.org/story/25/03/30/2333226/copilot-cant-beat-a-2013-touchdevelop-code-generation-demo-for-windows-phone
College students are running out of job prospects — and the situation may only get worse,2025-03-31 21:12:38 (KST),"College students are facing a career apocalypse.
To make matters worse, the outlook is likely to get even more dismal in the months ahead.",https://www.businessinsider.com/gen-z-career-apocalypse-job-seeker-federal-government-layoffs-doge-2025-3
Tiny Bubbles in the Memory,2025-03-31 17:00:15 (KST),"We are always fascinated by bubble memory.
In the late 1970s, this was the “Next Big Thing” that, as you may have guessed, was, in fact, not the next big thing at all.
But there were a …",https://hackaday.com/2025/03/31/tiny-bubbles-in-the-memory/
Hyo Joo Kim rallies to beat Vu in LPGA playoff in Arizona,2025-03-31 11:35:09 (KST),"Hyo Joo Kim rallied from a four-shot deficit Sunday with an 8-under 64 to force a playoff, defeating Lilia Vu on the first extra hole with a 6-foot birdie putt in the Ford Championship.",https://www.espn.com/golf/story/_/id/44472779/hyo-joo-kim-rallies-beat-lilia-vu-lpga-playoff-arizona
"Kevin McDonald, Superstar!",2025-03-31 19:00:00 (KST),"In his new rock opera, the Canadian comedian and Kids in the Hall veteran conjures a boozy night from the nineties, with an assist from Dave Hill on electric guitar, Sarah Larson writes.",https://www.newyorker.com/magazine/2025/04/07/kevin-mcdonald-superstar
It’s Always the Other Side That’s Been Brainwashed,2025-03-31 19:00:00 (KST),"Nikhil Krishnan reviews “The Instability of Truth: Brainwashing, Mind Control, and Hyper-Persuasion,” by Rebecca Lemov.",https://www.newyorker.com/magazine/2025/04/07/its-always-the-other-side-thats-been-brainwashed
"This 17-Inch HP Laptop Is 60% Off on Amazon, Now at an All-Time Low With Over $1,000 Off",2025-03-31 20:10:30 (KST),"This is an exclusive deal for Prime members, and it's unprecedented.",https://gizmodo.com/this-17-inch-hp-laptop-is-60-off-on-amazon-now-at-an-all-time-low-with-over-1000-off-2000582678
"With a Price This Low, It’s No Surprise That the Echo Show 5 Is Flying Off The Shelves on Amazon",2025-03-31 21:10:26 (KST),"The Echo Show 5 combines the power of Alexa with a compact 5.5-inch screen, and it is on sale at Amazon.",https://gizmodo.com/with-a-price-this-low-its-no-surprise-that-the-echo-show-5-is-flying-off-the-shelves-on-amazon-2000582705
Spring just got smarter: hte dreame Z1 Pro makes pool cleaning a breeze,2025-03-31 21:00:51 (KST),"Dreame / Dreame Spring is here, and you know what that means – more pool days and, unfortunately, more pool maintenance.
But before you dive into scrubbing walls and untangling cords, consider a smarter approach.
Dreame’s Z1 Pro, the world’s first cordless ro…",https://www.digitaltrends.com/brc/spring-just-got-smarter-the-dreame-z1-pro-makes-pool-cleaning-a-breeze/
Redesigned MacBook Pro on track to launch next year with three noteworthy upgrades,2025-03-31 09:45:36 (KST),"Today, Bloomberg’s Mark Gurman reiterated that Apple will be releasing a MacBook Pro “overhaul” in 2026.
There are three key...",https://9to5mac.com/2025/03/30/redesigned-macbook-pro-2026-upgrades/
"Time Spent in Nature is Good for Your Brain, but an Excess Can Negate These Benefits",2025-03-31 20:30:00 (KST),"A “Goldilocks” measure of green space might help stave off dementia, but an excess could lead to cognitive decline",https://www.scientificamerican.com/article/time-spent-in-nature-is-good-for-your-brain-but-an-excess-can-negate-these/
Are Near-Death Experiences the Brain's Attempt to Survive Lethal Threats?,2025-03-31 13:00:00 (KST),Researchers put forward a comprehensive model outlining the conditions that may give rise to the vivid mental phenomena that some people experience as they near death,https://www.scientificamerican.com/article/are-near-death-experiences-the-brains-attempt-to-survive-lethal-threats/
"The Sounds of Sharks, Meaning behind Mars Molecule and Federal Cuts to Science and Health Agencies",2025-03-31 19:00:00 (KST),"Cuts to federal health and science agencies continue.
Plus, we discuss the sounds of sharks, the meaning of Martian molecules and one big dino claw.",https://www.scientificamerican.com/podcast/episode/the-sounds-of-sharks-meaning-behind-mars-molecule-and-federal-cuts-to/
"Bill Gates would restart Microsoft as an AI-centric lab after 50 years — ""Raising billions of dollars from a few sketch ideas""",2025-03-31 18:06:10 (KST),"Microsoft co-founder Bill Gates says he'd start the company again as an AI-centric firm to rival OpenAI, Google, and more.",https://www.windowscentral.com/microsoft/bill-gates-would-restart-microsoft-as-an-ai-centric-lab-after-50-years
Final Fantasy IX fans think this new website hints at the long rumored remake,2025-03-31 21:25:14 (KST),Square Enix has just launched a new website dedicated to the 25th anniversary of Final Fantasy IX and fans are speculating it could be a hint at a remake in development.,https://www.windowscentral.com/gaming/final-fantasy-ix-fans-think-this-new-website-hints-at-the-long-rumored-remake
TeamRICOCHET unveils plan to use machine learning in its effort to ramp up Call of Duty anti-cheat efforts,2025-03-31 18:01:53 (KST),"Call of Duty's TeamRICOCHET has fought an uphill battle stopping cheaters since Black Ops 6's first season.
With Season 3 on the horizon, new tools are planned to stop disruptive players.",https://www.windowscentral.com/gaming/call-of-duty-season-3-anti-cheat-machine-learning
Ransomware crews add 'EDR killers' to their arsenal – and some aren't even malware,2025-03-31 19:01:29 (KST),"Crims are disabling security tools early in attacks, Talos says interview Antivirus and endpoint security tools are falling short as ransomware crews increasingly deploy ""EDR killers"" to disable defenses early in the attack – a tactic Cisco Talos observed in …",https://www.theregister.com/2025/03/31/ransomware_crews_edr_killers/
Never Lose Your Photos Again: Backing Up on Location with an SSD,2025-03-31 20:30:43 (KST),"Today is World Backup Day, the day where we’re compelled to remind you to back up your data! But we’re not just going to tell...
The post Never Lose Your Photos Again: Backing Up on Location with an SSD appeared first on DIY Photography.",https://www.diyphotography.net/never-lose-your-photos-again-backing-up-on-location-with-an-ssd/
