Title,Published(Kor),Description,Link
Webb Telescope Reveals Astronomers Got It All Wrong About This Dying Planet,2025-04-13 19:00:22 (KST),New findings flip a previous theory of a planet's end on its head.,https://gizmodo.com/webb-telescope-reveals-astronomers-got-it-all-wrong-about-this-dying-planet-2000587646
"Third Price Drop in a Week, The Garmin Vivoactive 5 Is Back to Its Black Friday Record Low Price",2025-04-13 09:33:15 (KST),"If you're looking for long battery life, detailed health information and robust activity tracking features, the Vivoactive 5 will be your best friend.",https://gizmodo.com/third-price-drop-in-a-week-the-garmin-vivoactive-5-is-back-to-its-black-friday-record-low-price-2000588674
Search teams deployed after house explosion,2025-04-13 15:52:37 (KST),Emergency crews say they are trying to account for residents after a house in Worksop was destroyed.,https://www.bbc.com/news/articles/cjewldqd1glo
New real-estate rules mean searching for homes could be changed forever,2025-04-13 19:44:01 (KST),"In this Sunday edition of BI Today, we're talking about how new rules are shaking up the home-search process.",https://www.businessinsider.com/bi-today-new-real-estate-rules-change-home-searching-2025-4
"Meet Nvidia co-founder Curtis Priem, who helped found and build the AI powerhouse",2025-04-13 17:06:02 (KST),"Nvidia's co-founders include Jensen Huang, Chris Malachowsky, and Curtis Priem.
Here's what to know about Priem, who left Nvidia over two decades ago.",https://www.businessinsider.com/curtis-priem
Why Booz Allen CEO Horacio Rozanski Welcomes DOGE Scrutiny,2025-04-13 20:00:00 (KST),TIME spoke to Horacio Rozanski about government inefficiency and some of his ideas to fix it.,https://time.com/7277233/booz-allen-ceo-horacio-rozanski-interview/
The Age of Intensive Grandparenting,2025-04-13 21:00:00 (KST),Older Americans might be more involved in child care than ever before.,https://www.theatlantic.com/family/archive/2025/04/grandparents-child-care-work-retirement/682395/
A Reddit Bot Drove Me Insane,2025-04-13 21:03:05 (KST),"I'm doomscrolling Reddit.
Every post is either political ragebait, recycled ""funny"" cat videos, ""Am I the asshole for divorcing my husband after he killed...",https://posthuman.blog/this-reddit-post-fried-my-brain/
The Sunday Papers,2025-04-13 19:00:00 (KST),"Sundays are for ousting your editor from his throne while he's on holiday.
Here's a roundup of some good writing from the internet last week.
This list of Games Writing Words I Hate by Riley MacLeod at Aftermath sets out some words games journalists would do …",https://www.rockpapershotgun.com/the-sunday-papers-759
The best OnePlus 13 camera feature is one you aren’t using,2025-04-13 20:00:26 (KST),"The OnePlus 13 has an excellent camera system.
Here's how a hidden feature makes it even better.",https://www.androidauthority.com/best-oneplus-13-camera-feature-xpan-mode-3539948/
Block Mirror: Dystopian Site-Blocking Triggers Circumvention Innovation,2025-04-13 18:27:34 (KST),"Site blocking and similar censorship measures are vulnerable to circumvention, helping to popularize VPNs and other encrypted solutions all over the world.
That includes Spain, where LaLiga is ramping up its pirate site blocking efforts and at the same time (…",https://torrentfreak.com/block-mirror-dystopian-site-blocking-triggers-circumvention-innovation-250413/
‘SNL’: Business News Host Jon Hamm Gives Tariff Tips to Live ‘Check to Check’,2025-04-13 13:45:20 (KST),"Jon Hamm and budget channel co-host Ego Nwodim discuss alternatives to pricey doctor's visits, such as ""just go lay down""",http://www.rollingstone.com/tv-movies/tv-movie-news/snl-business-news-host-jon-hamm-gives-trump-tariff-tips-paycheck-1235316295/
Select SoCal Residents Only: Chick-fil-A App: Original Chicken Sandwich Free (claim by 11:59pm PT on 4/12),2025-04-13 14:07:29 (KST),"LAFC won a home game today, so everyone in LA/OC gets a free sandwich in the Chick-Fil-A One app.
Turn on your GPS services, open the app, and claim your freebie tonight.
You have until 11:59pm tonig",https://slickdeals.net/f/18247786-select-socal-residents-only-chick-fil-a-app-original-chicken-sandwich-free-claim-by-11-59pm-pt-on-4-12?utm_source=rss&utm_content=fp&utm_medium=RSS2
India deploys troops after deadly protests over Muslim endowment bill,2025-04-13 20:42:16 (KST),"West Bengal leader Mamata Banerjee appeals for calm, saying Waqf Amendment Act will not be ‘applicable’ in state.",https://www.aljazeera.com/news/2025/4/13/3-dead-over-150-arrested-in-india-protests-over-muslim-properties-bill
The Zimbabwean singer who found fame in China – and obscurity at home,2025-04-13 14:48:48 (KST),"Jo Stak used to sing in Mandarin and get stopped by fans on the streets of Shanghai.
That changed when he came home.",https://www.aljazeera.com/features/2025/4/13/the-zimbabwean-singer-who-found-fame-in-china-and-obscurity-at-home
Golf: Rory McIlroy leads the Masters; closes in on career Grand Slam,2025-04-13 16:10:00 (KST),McIlroy sets up a final round showdown with DeChambea as the Northern Irishman seeks an elusive first Green Jacket.,https://www.aljazeera.com/sports/2025/4/13/golf-rory-mcilroy-leads-the-masters-closes-in-on-career-grand-slam
The Tesla Takedown Shows How We Can Make Oligarchs Feel the Pain,2025-04-13 19:00:00 (KST),"The “Tesla Takedown” protests reveal a major vulnerability of the Trump regime.
The post The Tesla Takedown Shows How We Can Make Oligarchs Feel the Pain appeared first on The Intercept.",https://theintercept.com/2025/04/13/elon-musk-tesla-takedown-protests/
"Exploit Attempts for Recent Langflow AI Vulnerability (CVE-2025-3248), (Sat, Apr 12th)",2025-04-13 09:21:28 (KST),"Two weeks ago, version 1.3.0 of Langflow was released.
The release notes list many fixes but do not mention that one of the ""Bug Fixes"" addresses a major vulnerability.
Instead, the release notes state, ""auth current user on code validation."" [1]",https://isc.sans.edu/diary/31850
The Volkswagen logo is suddenly causing huge confusion and friendship-ending arguments,2025-04-13 21:00:40 (KST),The design is causing huge debate.,https://www.creativebloq.com/design/logos-icons/the-volkswagen-logo-is-suddenly-causing-huge-confusion-and-arguments
