Title,Published(Kor),Description,Link
"Don't Miss Out on APYs Up to 4.50%. Today's CD Rates, April 15, 2025",2025-04-15 18:30:00 (KST),Rates this high won't last forever.,https://www.cnet.com/personal-finance/banking/dont-miss-out-on-apys-up-to-4-50-todays-cd-rates-april-15-2025/
The future of IRS Direct File looks grim,2025-04-15 21:05:32 (KST),A senior Treasury official told BI Direct File was a failed and disappointing program used by only a small fraction of the nation's taxpayers.,https://www.businessinsider.com/irs-direct-file-trouble-tax-day-mistake-angst-2025-4
"Once again, Harvey Weinstein goes on trial for sex crimes in New York today",2025-04-15 18:00:00 (KST),"Weinstein's New York conviction was overturned last year.
The new trial will retry the case alongside a brand new charge.",https://www.npr.org/2025/04/15/nx-s1-5363198/harvey-weinstein-trial-new-york-2025
Melinda French Gates says she no longer cares if people don't like her: 'Maybe that comes with being 60',2025-04-15 13:45:11 (KST),"""I deserve to be where I am in life.
Like, I've worked really hard to get here, and I know myself,"" French Gates said on ""The Jamie Kern Lima Show.""",https://www.businessinsider.com/melinda-french-gates-self-confidence-aging-growing-older-microsoft-billionaire-2025-4
"I grew my investment portfolio to over $1 million in 10 years. Even during a recession, these 3 tactics worked for me.",2025-04-15 18:07:02 (KST),Financial educator Bola Sokunbi built an over $1 million investment portfolio using three simple tactics — even during the 2007 recession.,https://www.businessinsider.com/how-to-build-million-dollar-investment-portfolio-during-tough-economy-2025-4
"Climate Change Is Putting Everyone’s Livelihood at Stake, Says Sabrina Elba",2025-04-15 21:00:00 (KST),"Sabrina Elba, a Goodwill ambassador for the U.N.
speaks to TIME about the importance of supporting farmers in the Global South.",https://time.com/7277808/sabrina-elba-climate-change-global-south/
Paying Your Taxes Used to Be Patriotic,2025-04-15 19:00:00 (KST),"The 1950s, the wealthy were willing to pay higher taxes for the benefit of all.
Here's how America's fiscal patriotism unraveled.",https://time.com/7274242/taxes-fiscal-patriotism/
How the Subway Takes Guy Became His Own Nepo Baby,2025-04-15 16:40:00 (KST),“I’ve never been one to buy depreciating assets.”,https://slate.com/podcasts/death-sex-money/2025/04/subway-takes-kareem-rahma-finance-comedy-music
The Plight of the Taxman,2025-04-15 19:00:00 (KST),"E.
Tammy Kim on how I.R.S.
employees are toiling through tax season while their agency is being by dismantled Donald Trump’s Administration.",https://www.newyorker.com/news/deep-state-diaries/the-plight-of-the-taxman
Do You Actually Know What Classical Music Is? Does Anyone?,2025-04-15 20:00:00 (KST),"The term is applied to radically different compositions across more than 1,000 years of history.
We need a better definition.",https://www.theatlantic.com/magazine/archive/2025/05/aucoin-what-is-classical-music/682119/
Can We Stop Kids From Watching Porn?,2025-04-15 19:00:00 (KST),"States are trying to keep kids off adult websites with new age-verification laws.
It’s a textbook case of how tech regulation can backfire.",https://www.theatlantic.com/podcasts/archive/2025/04/can-we-stop-kids-from-watching-porn/682455/
JEP 506: Scoped Values final for Java 25,2025-04-15 20:17:02 (KST),Comments,https://openjdk.org/jeps/506
The Industrialization of IT,2025-04-15 13:24:26 (KST),"Yeah, we’re going to lose our jobs.",https://benn.substack.com/p/the-industrialization-of-it
The Post-Developer Era,2025-04-15 13:10:14 (KST),"When OpenAI released GPT-4 back in March 2023, they kickstarted the AI revolution.
The consensus online was that front-end development jobs would be totally eliminated within a year or two.Well, it’s been more than two years since then, and I thought it was w…",https://www.joshwcomeau.com/blog/the-post-developer-era/
Apple @ Work Podcast: LLMs on Apple Silicon,2025-04-15 19:00:00 (KST),"Apple @ Work is exclusively brought to you by Mosyle, the only Apple Unified Platform.
Mosyle is the only solution that integrates in a single professional-grade platform all the solutions necessary to seamlessly and automatically deploy, manage & protect App…",https://9to5mac.com/2025/04/15/llms-on-apple-silicon/
Leaker vaguely comments on under-screen camera in iPhone Fold [U],2025-04-15 20:02:32 (KST),"We’ve been hearing about a foldable iPhone for a great many years, but things do finally seem to be solidifying, with an iPhone Fold now expected to launch next year.
The latest report indicates that it will have another long-awaited feature: Face ID embedded…",https://9to5mac.com/2025/04/15/iphone-fold-will-have-face-id-embedded-in-the-display-leaker/
Is Public Transit Really Safer than Driving?,2025-04-15 21:00:00 (KST),The rates of fatal crashes and crime are both lower on public transportation than on roadways,https://www.scientificamerican.com/article/is-public-transit-really-safer-than-driving/
Fusion Energy Needs Continued U.S. Leadership to Secure Our Energy Future,2025-04-15 20:30:00 (KST),"The U.S.
leads the world in fusion energy research.
It can’t squander that lead like it did with microchips",https://www.scientificamerican.com/article/fusion-energy-needs-continued-u-s-leadership-to-secure-our-energy-future/
"Fifteen years after a volcano shut European airspace, could it happen again?",2025-04-15 16:55:08 (KST),Could volcanic ash close down airspace across the UK and Europe bringing widespread the disruption we experienced in 2010.,https://www.bbc.com/weather/articles/ce822xzk60no
Watch as elephants form a protective circle in San Diego after 5.2-magnitude earthquake,2025-04-15 09:22:19 (KST),Heart-melting video shows African elephants at the San Diego Zoo instinctively forming a protective circle after the earthquake hit Southern California.,https://www.usatoday.com/story/news/nation/2025/04/14/elephants-protective-circle-san-diego-earthquake/83088633007/
