Title,Published(Kor),Description,Link
OPPO Find X8 Ultra review: Better than the best,2025-04-14 20:06:30 (KST),"With outstanding internals and the best camera package available today, OPPO's Find X8 Ultra sets a new standard for Android flagships.",https://www.androidcentral.com/phones/oppo-phones/oppo-find-x8-ultra-review
"Today's NYT Connections: Sports Edition Hints and Answers for April 14, #203",2025-04-14 12:12:07 (KST),"Here's today's Connections: Sports Edition answer and hints for groups.
These clues will help you solve The New York Times' popular puzzle game, Connections: Sports Edition, every day.",https://www.cnet.com/tech/gaming/todays-nyt-connections-sports-edition-hints-and-answers-for-april-14-203/
Haunted by hopelessness: 12 Zambians share their stories as HIV drugs run out,2025-04-14 20:57:06 (KST),"Mothers and children, husbands and wives, doctors, truck drivers and religious leaders are all grappling with the fallout from the sudden U.S.
cuts in aid.",https://www.npr.org/sections/goats-and-soda/2025/04/14/g-s1-59863/hiv-aids-drugs-usaid-zambia
Meta goes to trial over its acquisition of Instagram and WhatsApp,2025-04-14 18:20:02 (KST),The FTC's case against Meta is the result of a yearslong probe into whether the social media behemoth violated US competition laws.,https://www.businessinsider.com/meta-antitrust-trial-instagram-whatsapp-social-media-zuckerberg-trump-2025-4
Nvidia's healthcare boss talks changes coming to doctors' offices — and which companies may get a boost and lower costs,2025-04-14 18:00:02 (KST),"Nvidia's healthcare strategy leverages AI to revolutionize medical imaging and diagnostics, according to healthcare GM Kimberly Powell.",https://www.businessinsider.com/nvidia-healthcare-companies-boost-ai-medical-data-2025-4
Poolhouse raises $34M for gamified pool from the creators of Topgolf,2025-04-14 18:00:00 (KST),"Poolhouse, an effort from the Topgolf founders to build entertainment clubs around the game of pool, has raised $34 million.",https://venturebeat.com/games/poolhouse-raises-34m-for-gamified-pool-from-the-creators-of-topgolf/
Golfer Rory McIlroy Wins 2025 Masters to Complete Career Grand Slam,2025-04-14 11:00:00 (KST),"With his playoff victory at Augusta, McIlroy joins Tiger Woods, Jack Nicklaus, Gary Player, Ben Hogan, and Gene Sarazen as the only winners of golf’s four professional majors.",https://time.com/7277435/rory-mcilroy-wins-2025-masters-playoff-career-grand-slam-golf/
Seattle's pick at No. 2? Five questions heading into the draft,2025-04-14 21:05:06 (KST),Who might challenge Paige Bueckers for Rookie of the Year? Which team is positioned to win the WNBA draft?,https://www.espn.com/wnba/story/_/id/44651168/wnba-draft-2025-paige-bueckers-dallas-wings-seattle-storm-malonga-rookie-year-morrow-van-lith
WNBA mock draft: Who comes after No. 1 Paige Bueckers?,2025-04-14 21:05:06 (KST),"The Dallas Wings are on the clock.
From Paige Bueckers to pick No.
38, our WNBA mock draft projects all three rounds.",https://www.espn.com/wnba/story/_/id/44664451/wnba-mock-draft-2025-paige-bueckers-dallas-wings-malonga-iriafen-citron-morrow
MLB Watchability Index: Ranking which teams are must-see this season,2025-04-14 20:08:31 (KST),"Star power, mammoth home runs and ...
cotton candy fries? Here are baseball's most exciting squads for 2025.",https://www.espn.com/mlb/story/_/id/44629277/mlb-2025-rankings-most-fun-teams-watch-dodgers-red-sox-phillies-cubs-padres
Using AI to Get Your Business Branding Right — My Favorite Tips and Tools,2025-04-14 20:00:00 (KST),"I grew up a Nintendo kid (and yes, that includes the original NES console and Duck Hunt Zapper).
For those who remember the Nintendo GameCube, you know a memorable brand experience.
How could anyone forget this nine-second clip of branding brilliance?",https://blog.hubspot.com/marketing/using-ai-to-get-your-business-branding-right-my-favorite-tips-and-tools#article
David Byrne Takes the Stairs,2025-04-14 19:00:00 (KST),"The Talking Heads front man brought his acrylic markers to the Pace gallery recently to make some art—dancing ovals, a glamorous blob—on the stairwell walls, Sarah Larson writes.",https://www.newyorker.com/magazine/2025/04/21/david-byrne-takes-the-stairs
How to Survive the A.I. Revolution,2025-04-14 19:00:00 (KST),"John Cassidy considers the history of the Luddite movement, the effects of innovation on employment, and the future economic disruptions that artificial intelligence might bring.",https://www.newyorker.com/magazine/2025/04/21/how-to-survive-the-ai-revolution
Starved in Jail,2025-04-14 19:00:00 (KST),"Why are incarcerated people dying from lack of food or water, even as private companies are paid millions for their care? Sarah Stillman reports.",https://www.newyorker.com/magazine/2025/04/21/starved-in-jail
"Amazon Offers a Huge Discount on the Dyson V8, Now Just a Few Dollars Off Its Black Friday Record Low",2025-04-14 19:40:16 (KST),"For a long time, Dyson did not permit any discounts on its products.",https://gizmodo.com/amazon-offers-a-huge-discount-on-the-dyson-v8-now-just-a-few-dollars-off-its-black-friday-record-low-2000588892
Is Amazon Clearing Out Google Phones? Pixel 9 Pro Drops to a Record Low,2025-04-14 21:10:02 (KST),The Pixel 9 Pro stands as the biggest competitor to both the iPhone 16 Pro and the Galaxy S25 Ultra.,https://gizmodo.com/is-amazon-clearing-out-google-phones-pixel-9-pro-drops-to-a-record-low-2000588910
The Whimsical Investor,2025-04-14 16:43:12 (KST),"fi-le.net, the Fiefdom of Files",https://fi-le.net/stonks/
"Tariffs, Saving, and Investment",2025-04-14 14:44:07 (KST),"I haven’t written much about tariffs, because so many other economists are doing such a great job.",https://www.grumpy-economist.com/p/tariffs-saving-and-investment
"Apple’s exemption from ‘reciprocal’ tariff won’t last too long, per Trump administration",2025-04-14 09:20:30 (KST),"In case the continuously evolving tariff news hasn’t been confusing enough, there’s now another twist to the story.
According to the Trump administration, the exemption from the 125% reciprocal tariff is only temporary, and a tariff will apply to smartphones,…",https://9to5mac.com/2025/04/13/apple-exemption-trump-reciprocal-china-tariff-temporary/
7 Google acquisitions that changed the tech industry forever,2025-04-14 09:57:10 (KST),It's not always about the biggest number: 7 times Google bought major properties and shaped the course of technology,https://www.androidpolice.com/most-impactful-google-alphabet-acquisitions/
