Title,Published(Kor),Description,Link
We flew to Newark to find out if the airport is recovering from its recent struggles,2025-07-03 18:00:00 (KST),"Record numbers of Americans are expected to fly around the July Fourth holiday, posing a big test for America's fragile air travel system — and for Newark Liberty International Airport in particular.",https://www.npr.org/2025/07/03/nx-s1-5442562/newark-airport-delays-recovering
I've been a mom for nearly 20 years and am raising 6 kids. I still don't feel like I have the hang of this.,2025-07-03 18:33:02 (KST),"I'm raising six kids and some days I still feel like I'm failing.
Now I'm starting to see that this just means I care.",https://www.businessinsider.com/mom-admits-parenting-still-struggle-2025-7
"Leaked docs reveal Meta is training its chatbots to message you first, remember your chats, and keep you talking",2025-07-03 14:22:03 (KST),"Leaked guidelines show how Meta's custom AI chatbots are trained to get more proactive, following up with users to increase retention.",https://www.businessinsider.com/meta-ai-studio-chatbot-training-proactive-leaked-documents-alignerr-2025-7
"A family spent $69,000 turning their garage into an apartment so their son could live rent-free while launching his startup",2025-07-03 20:28:01 (KST),Christina and Jeff Starmer turned their garage into a cozy studio apartment so their son could have his own space and save money on housing.,https://www.businessinsider.com/family-turned-garage-into-rent-free-apartment-for-son-2025-7
How to trick your nervous system into calming down when you’re stressed at work,2025-07-03 18:00:00 (KST),"With the right breathing techniques, you can stimulate your vagus nerve into calming your body down.
Understanding how your body works can be the key to reducing stress.
For example, you’re probably aware of your fight-or-flight response—the body’s way of pr…",https://www.fastcompany.com/91362509/how-to-trick-your-nervous-system-into-calming-down-when-youre-stressed-at-work
CoMaps: New OSM based navigation app,2025-07-03 20:27:12 (KST),Comments,https://www.comaps.app/news/2025-07-03/Announcing-Navigate-with-Privacy-Discover-more-of-your-journey/
Kyber (YC W23) Is Hiring Enterprise BDRs,2025-07-03 21:00:28 (KST),"At Kyber, we're building the next-generation document platform for enterprises.
Today, our AI-native solution transforms regulatory document workflows, enabling insurance claims organizations to consolidate 80% of their templates, spend 65% less time drafting…",https://www.ycombinator.com/companies/kyber/jobs/F1XERLm-enterprise-business-development-representative
What to build instead of AI agents,2025-07-03 09:02:43 (KST),"Discover why AI agents often fail and learn 5 proven LLM workflow patterns to build smarter, reliable systems without unnecessary complexity.",https://decodingml.substack.com/p/stop-building-ai-agents
Apple Watch and AirPods continue to dominate the global market – for now,2025-07-03 20:47:14 (KST),"A pair of market intelligence reports show that the Apple Watch and AirPods continue to dominate the global market in their respective categories.
However, Apple’s long-held lead in the smartwatch market is now being challenged by Huawei, according to the …",https://9to5mac.com/2025/07/03/apple-watch-and-airpods-continue-to-dominate-the-global-market-for-now/
"Review: XREAL One’s are incredibly versatile, and they really come to life with the iPad Pro",2025-07-03 09:28:25 (KST),"I’ve been reviewing one of XREAL’s more recent releases of AR glasses: the .
These are certainly the most versatile pair of AR glasses I’ve tried out so far, and they actually really come to life somewhere you wouldn’t expect: the M4 iPad Pro running iPadOS 2…",https://9to5mac.com/2025/07/02/xreal-one-ar-glasses-review-versatile-with-m4-ipad-pro/
Record-Breaking Results Bring Fusion Power Closer to Reality,2025-07-03 21:00:00 (KST),"Breakthroughs from two rival experiments, Germany’s Wendelstein 7-X and the Joint European Torus, suggest the elusive dream of controlled nuclear fusion may be within reach",https://www.scientificamerican.com/article/record-breaking-results-bring-fusion-power-closer-to-reality/
Why anger cools after 50: Surprising findings from a new menopause study,2025-07-03 20:42:18 (KST),"Anger isn’t just a fleeting emotion—it plays a deeper role in women’s mental and physical health during midlife.
A groundbreaking study tracking over 500 women aged 35 to 55 reveals that anger traits like outbursts and hostility tend to diminish with age and …",https://www.sciencedaily.com/releases/2025/07/250702214151.htm
Scientists just simulated the “impossible” — fault-tolerant quantum code cracked at last,2025-07-03 10:41:57 (KST),"A multinational team has cracked a long-standing barrier to reliable quantum computing by inventing an algorithm that lets ordinary computers faithfully mimic a fault-tolerant quantum circuit built on the notoriously tricky GKP bosonic code, promising a cruci…",https://www.sciencedaily.com/releases/2025/07/250702214157.htm
Samsung Unpacked teaser hints at possible tri-fold reveal,2025-07-03 14:00:23 (KST),"Samsung’s latest Unpacked teaser may be hinting at its long-rumored tri-fold device alongside the Galaxy Z Fold 7 and Z Flip 7.
The post Samsung Unpacked teaser hints at possible tri-fold reveal appeared first on Phandroid.",https://phandroid.com/2025/07/03/samsung-unpacked-teaser-hints-at-possible-tri-fold-reveal/
Perplexity lance un abonnement à 200 dollars par mois : à qui cette version ultra-chère est-elle destinée ?,2025-07-03 17:54:11 (KST),"Perplexity vient de lancer un abonnement à 200 dollars par mois.
Cet abonnement n’est naturellement pas conçu pour l’utilisateur lambda, mais cible certains professionnels qui ont des besoins intensifs en intelligence artificielle.
Celui-ci inclut un accès il…",https://www.presse-citron.net/perplexity-abonnement-a-200-dollars-par-mois/
CodeSOD: The Last Last Name,2025-07-03 15:30:00 (KST),"Sometimes, you see some code which is perfectly harmless, but illustrates an incredibly dangerous person behind them.
The code isn't good, but it isn't bad in any meaningful way, but they were written by a cocaine addled pomeranian behind the controls of a bu…",https://thedailywtf.com/articles/the-last-last-name
New interstellar comet 3I/ATLAS is hurtling through the solar system — and you can watch it live online today,2025-07-03 19:34:48 (KST),3I/ATLAS is the third-ever interstellar object discovered.,https://www.space.com/astronomy/comets/new-interstellar-comet-3i-atlas-is-hurtling-through-the-solar-system-and-you-can-watch-it-live-online-today
Watch Russia's Progress 92 cargo ship launch toward the ISS today,2025-07-03 21:00:00 (KST),"A Russian Progress cargo spacecraft will launch toward the International Space Station this afternoon (July 3), and you can watch the action live.",https://www.space.com/space-exploration/launches-spacecraft/russian-cargo-ship-progress-92-launch-iss
