Title,Published(Kor),Description,Link
How Social Media Is Fueling Gen Z’s Sex Recession,2025-07-16 20:00:00 (KST),"For her new book, journalist Carter Sherman interviewed over 100 young people about why they’re not having sex.
She says they’re “very horny” but also more isolated, self-conscious, and fearful.",https://www.wired.com/story/carter-sherman-the-second-coming-interview/
Vivo does it again — the X Fold 5 is the best foldable I used in 2025,2025-07-16 14:13:20 (KST),"With the X Fold 5, Vivo is showing that it can deliver a foldable that's among the best around.
And the best part is that it doesn't cost anywhere as much as Samsung's Galaxy Z Fold 7.",https://www.androidcentral.com/phones/vivo/vivo-x-fold-5-review
"The Galaxy Watch 8 Pissed Me Off, but I'd Still Recommend It",2025-07-16 21:00:14 (KST),"Samsung's Running Coach questioned my running skills.
But Gemini may have just restored my faith in voice assistants.",https://www.cnet.com/tech/mobile/the-galaxy-watch-8-pissed-me-off-but-id-still-recommend-it/
Do you want federal money for an EV or home solar? Time is running out — fast,2025-07-16 18:00:00 (KST),"Federal tax credits for rooftop solar, heat pumps and other energy-efficient technologies are going away at the end of the year.
Here's what consumers should know.",https://www.npr.org/2025/07/16/nx-s1-5462190/trump-tax-credit-solar-ev-heat-pump
"10 years ago, a flood devastated this Texas town. The road to recovery has been long",2025-07-16 18:00:00 (KST),"Wimberley, Texas, was the site of a devastating flash flood on Memorial Day weekend in 2015.
Now, 10 years later, the town has rebuilt with such floods in mind — but still feels the emotional effects.",https://www.npr.org/2025/07/16/nx-s1-5467719/wimberley-texas-flood-2015
A CEO explains how he cut his battery chain's reliance on China and plans to offset the latest tariffs,2025-07-16 18:55:01 (KST),Batteries Plus CEO Scott Williams said the chain has reduced its reliance on Chinese suppliers for car batteries in order to minimize tariff costs.,https://www.businessinsider.com/batteries-plus-ceo-how-i-avoided-trump-china-tariffs-2025-7
Wall Street's status symbol of the summer: the elite golf shirt,2025-07-16 17:03:02 (KST),"The new summer status symbol on Wall Street isn't a house in the Hamptons — it's a golf shirt.
And there's a fine line between top dog and overplayed.",https://www.businessinsider.com/wall-street-status-symbol-men-golf-courseshirt-club-masters-2025-7
Exclusive: German startup takes on ‘solar-only’ rivals with energy-as-a-service model,2025-07-16 14:00:00 (KST),"German startup Enerkii has launched an energy-as-a-service model that aims to cut power bills in half for industrial customers — and decarbonise them in the process.
The model uses an in-house operating system (OS) to calculate the optimal solar energy config…",https://thenextweb.com/news/exclusive-german-startup-takes-on-solar-only-rivals-with-energy-as-a-service-model
This cargo ship is turning its CO2 emissions into green cement,2025-07-16 18:00:02 (KST),"A giant cargo ship is trapping carbon from its exhaust and turning it into cement for use in onshore construction.
The technology, developed by UK startup Seabound, is billed as the world’s first commercial carbon capture system for boats.
It’s installed on t…",https://thenextweb.com/news/cargo-ship-turning-co2-into-cement
"Wordle hints today for #1,488: Clues and answer for Wednesday, July 16",2025-07-16 13:01:10 (KST),Does today's Wordle have you stumped? Here are some hints and the answer.,https://tech.yahoo.com/gaming/wordle/article/wordle-hints-today-for-1488-clues-and-answer-for-wednesday-july-16-040110975.html
Trump’s disapproval rating hits record for second term,2025-07-16 11:19:21 (KST),"President Trump’s disapproval rating is at its highest level since the start of his second term, according to the latest Economist/YouGov poll.
The survey...",https://thehill.com/homenews/campaign/5403189-trumps-disapproval-rating-hits-record-for-second-term/
Florida python challenge: Why state recommends not eating invasive snakes,2025-07-16 19:05:38 (KST),"Can you eat pythons? Florida snake hunter prefers his ground up like hamburger, however state recommends NOT eating the slithering monster.",https://www.palmbeachpost.com/story/news/local/2025/07/16/burmese-pythons-florida-snakes-can-be-eaten-but-mercury-levels-high/85223265007/
Elon Musk's Starlink Faces A New Alphabet Rival: This Google-Backed Startup Wants Federal Billions To Beam Internet Through Air,2025-07-16 10:01:22 (KST),"A startup created by Google parent company Alphabet (NASDAQ:GOOG, GOOGL)) is stepping into the broadband spotlight as it goes after a share of the federal...",https://finance.yahoo.com/news/elon-musks-starlink-faces-alphabet-010122430.html
"IndyGo's riders with disabilities, low incomes protest 57% fare hike as final vote nears",2025-07-16 19:02:11 (KST),"Amid dwindling fare revenue, IndyGo is trying to increase bus fares by 57% with an August vote.
That's a problem for the typical rider, who earns less than $...",https://www.indystar.com/story/news/local/transportation/2025/07/16/indygo-to-vote-in-august-on-57-fare-hike-for-bus-riders/84464174007/
Tropical storm to soak Gulf Coast as renewed flood threat hits Northeast and Midwest,2025-07-16 20:36:41 (KST),"A tropical threat on the Gulf Coast has a 40% chance for development into a tropical depression in the next 48 hours, according to the National Hurricane Center.",https://abcnews.go.com/US/tropical-rainstorm-drench-gulf-coast-renewed-flood-threat/story?id=123794142
Trump is signaling a change on Ukraine. What does it mean for Putin?: ANALYSIS,2025-07-16 18:12:25 (KST),The key question now is how seriously will Putin take Trump's new approach?,https://abcnews.go.com/International/trump-ukraine-weapons-putin-reaction-analysis/story?id=123759522
Nintendo Has Found Its Live-Action Link and Zelda,2025-07-16 20:26:47 (KST),The company first announced the stars of Wes Ball's 'Legend of Zelda' movie through the Nintendo Today app.,https://gizmodo.com/legend-of-zelda-movie-casting-link-zelda-sony-nintendo-2000629929
Six Years of Gemini,2025-07-16 11:37:37 (KST),Comments,https://geminiprotocol.net/news/2025_06_20.gmi
I'm Switching to Python and Actually Liking It,2025-07-16 16:44:32 (KST),"I’ve started writing more Python code lately (because of… AI, you know).
In this post, I share the tools, libraries, configs, and other integrations I use for building production-grade Python applications following a frontend-backend architecture.",https://www.cesarsotovalero.net/blog/i-am-switching-to-python-and-actually-liking-it.html
China Powers AI Boom with Undersea Data Centers,2025-07-16 19:30:00 (KST),China is pulling ahead of the rest of the world in sinking data centers that power AI into the ocean as an alternate way to keep them cool,https://www.scientificamerican.com/article/china-powers-ai-boom-with-undersea-data-centers/
