Title,Published(Kor),Description,Link
"칭다오 3회차 운항, 수출 2개, 수입 1개 컨테이너 분량",2025-11-05 21:27:00 (KST),"중국 칭다오항에서 출항한 SMC 르자오호는 오늘 오전 컨테이너 1개를 싣고 제주항 10부두에 도착했습니다.
오늘 오후 제주에서는 2개의 컨테이너가 실려 중국으로 향했습니다.
제주도는 칭다오 항로 연간 운영비용 약...",https://n.news.naver.com/mnews/article/661/0000064818?sid=104
"제주, 분산에너지 특화지역 지정",2025-11-05 21:25:00 (KST),"기후에너지환경부는 오늘 국가에너지위원회를 열고 제주를 포함해 전남과 부산, 경기도를 분산에너지 특화지역으로 지정했다고 밝혔습니다.
제주는 풍부한 재생에너지 자원을 보유하고 있어, 분산에너지 시스템 실험...",https://n.news.naver.com/mnews/article/661/0000064808?sid=102
"2공항 반대 단체, ""도민 결정권 보장해야""",2025-11-05 21:24:00 (KST),"제주 제2공항 강행저지 비상도민회의는 오늘 오전 제주도청에서 기자회견을 갖고 신공항 예정지가 발표된지 10년 동안 역대 도정들이 도민 의견을 수렴하지 않았다고 주장했습니다.
이들은 지난 10년간 항공수요가 늘지...",https://n.news.naver.com/mnews/article/661/0000064803?sid=102
블루홀 사고 위험...출입통제구역 관리 강화,2025-11-05 21:24:00 (KST),"-화면제공 서귀포해양경찰서 서귀포해양경찰서는 동절기 기상악화 시 사고 위험이 높은 블루홀과 황우지해안 등, 2곳의 출입통제구역에서 오늘(5일)부터 3주간 순찰을 강화하고 안전시설을 점검하는 집중 관리를...",https://n.news.naver.com/mnews/article/661/0000064801?sid=102
"'정관장 연승 행진 제동' 삼성 김효범 감독 ""선수들 자랑스럽다""",2025-11-05 21:24:00 (KST),"선수들이 오늘과 같은 에너지를 발휘한다면 좋은 경기를 계속 할 수 있을 것 같다""며 미소를 지었다.
이날...
정관장이 오늘은 에너지가 조금 떨어진 것 같다.
평소에는 워낙 에너지가 높은 팀이다.
항상 좋을 수는 없다""는...",https://m.sports.naver.com/basketball/article/398/0000093189
[오늘의포토] 2년전 불 났던 운암산에 나무 심어요,2025-11-05 21:24:00 (KST),"5일 광주시 북구 운암산 일원에서 열린 산불 피해 복구를 위한 주민참여 나무심기 행사에서 주민들이 단풍, 동백, 목백합, 왕벚나무 등 총 300여주를 심고 있다.
운암산은 지난 2023년 3월 인근 쓰레기 소각...",http://www.kwangju.co.kr/article.php?aid=1762345200791547096
오늘의 경기,2025-11-05 21:24:00 (KST),△프로축구= 아시아연맹 챔피언스리그2 조별리그 4차전 포항-탬피니스 로버스(19시·포항스틸야드) △프로농구= 현대모비스-소노(19시·울산동천체육관) △프로배구= 한국전력-OK저축은행(수원체육관) 페퍼저축은행...,https://www.idaegu.co.kr/news/articleView.html?idxno=528684
[대구논단] 몸은 기록했다가 늙으면 청구서를 보낸다,2025-11-05 21:24:00 (KST),"오늘부터 조금만 덜 먹고, 조금만 더 걷고, 조금만 더 웃으면, 몸은 새로운 기록을 써 내려간다.
그 기록이...
몸은 오늘도 말없이 기록하고 있다.
그리고 언젠가 우리에게 물을 것이다.
'이제, 당신은 그 빚을 갚을 준비가...",https://www.idaegu.co.kr/news/articleView.html?idxno=528695
"'5연승 마감' 정관장 유도훈 감독 ""상대 볼 없는 움직임과 스피드 못 따...",2025-11-05 21:23:00 (KST),"오늘 경기를 토대로 더 나은 팀이 될 수 있도록 준비를 잘하겠다""며 경기를 총평했다.
삼성과의 1라운드...
이전 경기와 마찬가지로 오늘도 퍼센트가 좋지 않았다.
볼 없는 움직임을 통해 찬스가 났을 때 들어가냐 안...",https://m.sports.naver.com/basketball/article/398/0000093188
"""최상목, 한덕수에게 '왜 반대 않냐'…'이상민은 예스맨'""",2025-11-05 21:23:00 (KST),"오늘(5일) 법원에서 진행된 한덕수 전 총리 재판에서는 한 전 총리가 계엄을 반대했는지가 쟁점이었습니다....
오늘 증인으로 출석할 예정이던 이상민 전 장관은 본인 재판 준비 등을 사유로 불출석했는데, 재판부는 정당한...",https://n.news.naver.com/mnews/article/055/0001305746?sid=102
"김윤지 ""아침 식사는 미국식""…딸 엘라 '먹방'에 행복",2025-11-05 21:21:00 (KST),"음식을 하나씩 먹을 때마다 손뼉 치라고 유도하는 모습이 웃음을 자아냈다.
김윤지가 뿌듯해했다.
엘라를 향해 ""오늘 진짜 다 먹었네.
이럴 때 제일 뿌듯해, 내가 만들어준 거 싹 다 먹었을 때.
엄마 너무 행복해~""라고 말했다.",https://m.entertain.naver.com/article/421/0008587756
수학여행 온 고등학생 숙소 8층에서 추락해 사망,2025-11-05 21:21:00 (KST),"서귀포경찰서 등에 따르면 오늘(5일) 새벽 0시쯤 서귀포시 서귀동의 한 숙박업소 8층에서 10대 A군이 떨어져 숨졌습니다.
경찰은 8층에 있던 A군이 창문을 통해 7층으로 넘어가려다 사고를 당한 것으로 보고 정확한 사고...",https://n.news.naver.com/mnews/article/661/0000064790?sid=102
"""정청래 사과하라"" 기자회견…뒷말 많은 부산시당 경선",2025-11-05 21:21:00 (KST),"배제된 당사자가 오늘(5일) 당 지도부의 사과를 요구하며 기자회견을 열었는데, 민주당 지도부는 엄밀한 원칙에 따라 경선을 진행했다고 반박했습니다.
김상민 기자입니다.
<기자> 지난해 총선을 앞두고 이재명 당시 민주당...",https://n.news.naver.com/mnews/article/055/0001305745?sid=100
"철판오징어 논란 ""사실과 달라""...결국 경찰 수사",2025-11-05 21:20:00 (KST),"서귀포매일올레시장상가조합은 오늘(5일) 사실과 다른 철판오징어 관련 게시물로 업주와 시장 등이 피해를 입었다며 경찰에 정보통신망법 위반 등의 혐의로 고소장을 접수했습니다.
최근 온라인 커뮤니티에는 철판오징어...",https://n.news.naver.com/mnews/article/661/0000064785?sid=102
[르포] 활어차 도로에 해수 '펑펑'…행정은 '뒷짐만~',2025-11-05 21:20:00 (KST),"완도읍 주민 B씨는 ""활어차가 해수를 버리는 건 어제오늘 일이 아니다""며 ""단속 현수막만 내걸었을 뿐 실제 단속은 전혀 보지 못했다""고 말했다.
지역 차량 정비업소 직원은 ""염분이 아스팔트 결합력을 약화해 도로 수명을...",https://n.news.naver.com/mnews/article/277/0005675164?sid=102
"문수실버복지관, 자원봉사자 격려 프로그램 '지지·격려 P/G' 진행",2025-11-05 21:20:00 (KST),"정학수 관장은 ""경로식당은 자원봉사자들의 따뜻한 손길로 운영된다""며 ""오늘의 시간이 봉사자들에게 에너지가 되어 앞으로도 건강하게 활동을 이어가길 바란다""고 말했다.
디지털뉴스부",https://www.ksilbo.co.kr/news/articleView.html?idxno=1040948
[따져보니] 환율 왜 오르나…우리 경제 영향은?,2025-11-05 21:19:00 (KST),"[기자] 6월 말까지만 해도 1350원대였던 환율은 9월 말 1400원을 돌파하더니 오늘은 장중 한때 1450원까지 치솟았습니다.
단시간에 환율이 내려갈 요인은 없다는 게 지배적인 분위기입니다.
결국 미국의 선택에 달렸는데, 크게...",https://n.news.naver.com/mnews/article/448/0000568657?sid=004
"일본인 모녀 덮친 '만취운전자' 구속…법원 ""도망 염려""",2025-11-05 21:19:00 (KST),"오늘(5일) 서울중앙지법 정재욱 영장전담 부장판사는 도로교통법상 음주운전 등의 혐의를 받는 30대 서모 씨에 대해 ""도망 염려가 있다""며 구속영장을 발부했습니다.
서 씨는 지난 2일 오후 10시쯤 만취 상태로 차를 몰다...",https://n.news.naver.com/mnews/article/057/0001917215?sid=102
"이정진, 박해리 데이트 중 폭탄 발언 ""결혼 안 하면 나중에...""",2025-11-05 21:18:00 (KST),"5일(오늘) 밤 9시 30분 방송되는 채널A '요즘 남자 라이프-신랑수업'(이하 '신랑수업') 187회에서 공개된다.
이날...
과연 이정진의 충격적인 타로점 결과와 박해리와의 궁합이 어떻게 나왔을지는 오늘(5일) 밤 9시 30분 채널A...",https://www.gukjenews.com/news/articleView.html?idxno=3420076
"문형배 전 대행 ""호의가 바탕이 되는 좋은 사회 만들어가야""",2025-11-05 21:18:00 (KST),"문형배 전 헌법재판소장 권한대행이 오늘 대구대학교를 찾아 호의가 호의를 부른다는 주제로 사회 구성원 간의 신뢰와 협력의 중요성에 대한 강연을 진행했습니다.
강연에서 문 전 대행은 우리부터 누군가에게 호의를 베풀...",https://www.tbc.co.kr/news/view?pno=20251105163211AE02091&id=200543
