Title,Published(Kor),Description,Link
"CES Live Blog, Day 1: The Coolest Tech We’ve Seen So Far",2026-01-05 20:00:00 (KST),"Read our live updates from CES 2026 in Las Vegas to see the latest consumer gadgetry in all of its chatbot-enabled, sensor-packed, AI-infused glory.",https://www.wired.com/live/ces-2026-live-blog/
Can Donald Trump be compared to Julius Caesar?,2026-01-05 15:00:00 (KST),"Historian Tom Holland answers your questions about President Trump, cricket and Spiderman",https://www.bbc.co.uk/sounds/play/p0mpbrwl
Clicks builds a BlackBerry-esque phone to fight smartphone distraction,2026-01-05 20:04:00 (KST),"The Clicks Communicator is a modern, keyboard-first phone designed for focused communication, while the Power Keyboard is a 3-in-1 wireless charger, stand, and multi-device keyboard.",https://www.androidcentral.com/phones/clicks-builds-a-blackberry-esque-phone-to-fight-smartphone-distraction
"Welcome to the new, sorta socialist era of American capitalism",2026-01-05 18:11:01 (KST),Trump is having the government buy stakes directly in companies — and it's going to change the way we all do business and reshape the economy.,https://www.businessinsider.com/new-era-america-capitalism-socialist-trump-economy-2026-1
"Who is in charge of Venezuela? And, what to expect from Maduro's court appearance",2026-01-05 21:26:59 (KST),"The U.S.
forces' capture of Venezuelan President Nicolás Maduro and his wife in Caracas has left many people with questions.
Here's what we know so far, including who is running the country.",https://www.npr.org/2026/01/05/g-s1-104520/up-first-newsletter-venezuela-nicolas-maduro-delcy-rodriguez-president-trump
Are you a software engineer? Tell us what you think about vibe coding,2026-01-05 19:55:01 (KST),"Vibe coding has upended software engineering, strapping developers with a suite of new AI tools.
We want to hear from those navigating the moment.",https://www.businessinsider.com/software-engineeer-developer-vibe-coding-survey-2026-1
Fake records and forged signatures: Marines say recruiting pressure fueled a culture of fraud,2026-01-05 19:00:01 (KST),"Current and former Marine recruiters describe immense pressure to find enlistees.
Amid the desperation, a culture of fraud bloomed in the Rust Belt.",https://www.businessinsider.com/marine-recruiting-culture-fraud-forgery-firings-2026-1
New Strong Sell Stocks for January 5th,2026-01-05 20:55:00 (KST),"CHMG, ADM and CLCO have been added to the Zacks Rank #5 (Strong Sell) List on January 5th, 2026.",https://finance.yahoo.com/news/strong-sell-stocks-january-5th-115500997.html
Mt. Bachelor blanketed with 6 inches of snow overnight,2026-01-05 09:00:58 (KST),"Mt.
Bachelor Ski Resort received several inches of snow overnight on Sunday and is expected to continue into Monday.",https://www.yahoo.com/news/articles/mt-bachelor-blanketed-6-inches-000058334.html
Here's How Much A McDonald's Big Mac Cost The Decade You Were Born,2026-01-05 10:00:00 (KST),"Things sure have changed since the Big Mac first debuted in the 1960s.
Here's how much the iconic McDonald's sandwich's price has gone up over the decades.",https://www.thetakeout.com/2062984/how-much-mcdonalds-big-mac-cost-decades-born/
Homebuyer stunned after seller leaves them with a surprise monthly Tesla bill: 'I didn't get any warning',2026-01-05 17:30:00 (KST),"""I'm entirely confused why I'm receiving this.""",https://shopping.yahoo.com/home-garden/home-improvement/articles/homebuyer-stunned-seller-leaves-them-083000499.html
Driving instructors teach students to dodge danger on Zimbabwe roads,2026-01-05 13:19:10 (KST),"When Tafara Muvhevhi, a Zimbabwean driving instructor, began work 16 years ago, his job was simple: teach the highway code and prepare learners to ace their ...",https://www.yahoo.com/news/articles/driving-instructors-teach-students-dodge-041910497.html
27 Things You Should Give Up This Year,2026-01-05 20:28:34 (KST),"It’s a new year, which means people everywhere are making resolutions about what they’re going to add to their lives.
More exercise.
New routines.
A fresh system that will finally get everything they’ve got going on dialed in.
There’s nothing wrong with tryin…",https://www.artofmanliness.com/character/behavior/27-things-to-give-up-this-year/
Letters from Our Readers,2026-01-05 20:00:00 (KST),Readers respond to Rebecca Mead’s Profile of Stephen Fry and Rivka Galchen’s piece about geothermal energy.,https://www.newyorker.com/magazine/2026/01/12/letters-from-the-january-12-2026-issue
AGI Is Here,2026-01-05 11:55:34 (KST),I propose to begin this year with an acknowledgment that is strategic but/and also sincere.,https://www.robinsloan.com/winter-garden/agi-is-here/
Why Does Life Keep Evolving These Geometric Patterns?,2026-01-05 20:45:00 (KST),A global catalog shows how creatures across the tree of life balance rigidity with flexibility in remarkably consistent ways,https://www.scientificamerican.com/article/why-does-life-keep-evolving-these-geometric-patterns/
How to Keep Your New Year’s Resolutions—Behavioral Science Tips That Work,2026-01-05 20:00:00 (KST),Behavioral economist Katy Milkman explains why most New Year’s resolutions fail and shares how science-backed strategies can build habits that last.,https://www.scientificamerican.com/podcast/episode/how-to-keep-your-new-years-resolutions-behavioral-science-tips-that-work/
First Look at HONOR’s Robot Phone at CES 2026: How is this real?!,2026-01-05 20:02:31 (KST),"First Look at HONOR’s Robot Phone at CES 2026: How is this real?!Tucked away in a suite at the Encore Hotel lay perhaps the most interesting phone of all.
No, not Samsung’s trifold, not even TCL’s NXTPaper...",https://www.yankodesign.com/2026/01/05/first-look-at-honors-robot-phone-at-ces-2026-how-is-this-real/
Egypt’s Karnak Temple may have risen from water like a creation myth,2026-01-05 09:45:57 (KST),"New research shows Karnak Temple was built on a rare island of high ground formed as Nile river channels shifted thousands of years ago.
Before that, the area was too flooded for settlement, making the temple’s eventual rise even more remarkable.
The landscap…",https://www.sciencedaily.com/releases/2025/12/251228074502.htm
I see Mozambique’s baboons as windows into hominid evolution,2026-01-05 09:00:00 (KST),"In Gorongosa National Park in Mozambique, Rassina Farassi studies how humans came to walk on two legs.",https://www.nature.com/articles/d41586-025-04153-7
