Title,Published(Kor),Description,Link
EU faces worst wildfire season on record,2025-08-28 12:13:48 (KST),Wildfires have scorched southern Europe and new research suggests climate change played a major role.,https://www.bbc.com/news/articles/cd6n8qqlj8go
"70 years after Emmett Till's murder, Mississippi museum acquires gun used to kill him",2025-08-28 18:00:00 (KST),"It's been 70 years since Emmett Till, a Black teenager visiting relatives in Mississippi, was killed by white men because he whistled at a white woman.
Now the gun used in his death is in a museum.",https://www.npr.org/2025/08/28/nx-s1-5519776/emmett-till-murder-mississippi-museum-gun
Super Bowl MVP Drew Brees has relied on this 'old-school' method to get ahead in football and in business,2025-08-28 18:52:01 (KST),"Longtime quarterback Drew Brees has relied on this strategy for success in football and business.
It furthers his goal of consistent growth.",https://www.businessinsider.com/drew-brees-old-school-tactic-football-business-2025-8
The Health Secretary scored big wins for his MAHA campaign on Wednesday.,2025-08-28 09:25:12 (KST),"Robert F.
Kennedy Jr.
can’t seem to walk past children without noticing something wrong with them.
The Health Secretary said he has been noticing something...",https://www.thedailybeast.com/rfk-jr-shares-deeply-weird-way-he-knows-kids-are-unhealthy/
Got a minute? NHC tracking new tropical wave. Are there any Florida threats for Labor Day?,2025-08-28 20:55:05 (KST),"Here's a quick, easy-to-read look on the latest about Fernand and what's happening in the tropics.",https://www.news-press.com/story/weather/hurricane/2025/08/28/any-hurricanes-out-there-update-tropics-in-a-minute-tropical-wave-off-africa-hurricane-kit-supplies/85851492007/
"I’ve Never Been an AC Person. But This Summer, Something Changed.",2025-08-28 18:40:00 (KST),"It takes a degree of cognitive dissonance to blast the AC.
Such is the American way.",https://slate.com/life/2025/08/air-conditioner-ac-unit-summer-heat-hot-temperature-climate-change-politics-debate.html
The Existential Terror of Monogamy,2025-08-28 21:00:00 (KST),Splitsville understands why modern romance makes an open marriage so appealing.,https://www.theatlantic.com/culture/archive/2025/08/splitsville-movie-romance-non-monogamy/684031/
Rendering an ASCII game in real-time with AI (100ms latency),2025-08-28 21:10:14 (KST),Discover the process of transforming an ASCII game into real-time AI-rendered graphics with fal.ai,https://blog.jeffschomay.com/rendering-a-game-in-real-time-with-ai
The National Design Studio Is a Scam,2025-08-28 10:03:23 (KST),"President Trump’s appointment of AirBnB co-founder Joe Gebbia as “Chief Design Officer” of the United States is a sickening travesty.
It not only",https://www.chrbutler.com/the-national-design-studio-is-a-scam
The Math Behind GANs,2025-08-28 20:42:35 (KST),"Generative Adversarial Networks refer to a family of generative models that seek to discover the underlying distribution behind a certain data generating process.
This distribution is discovered through an adversarial competition between a generator and a dis…",https://jaketae.github.io/study/gan-math/
CDC officials’ resignation emails,2025-08-28 10:47:03 (KST),The end of an era.,https://insidemedicine.substack.com/p/breaking-news-read-three-top-cdc
Testing Unleashed: Ist wirklich jeder für Qualität verantwortlich?,2025-08-28 18:43:00 (KST),Richard Seidl und Gitte Ottosen sprechen in dieser englischsprachigen Podcast-Folge über Software Test Skills in agilen Teams.,https://www.heise.de/blog/Testing-Unleashed-Ist-wirklich-jeder-fuer-Qualitaet-verantwortlich-10623810.html?wt_mc=rss.red.ho.ho.atom.beitrag.beitrag
Stats suggest Apple’s slow rollout of AI agent capabilities may be wise,2025-08-28 20:24:26 (KST),"One of the many delayed Apple Intelligence features is known as App Intents, and we’re starting to see evidence that taking an extremely cautious approach to the rollout may be no bad thing.
Before the comments catch fire, I should stress that I’m most ass…",https://9to5mac.com/2025/08/28/stats-suggest-apples-slow-rollout-of-ai-agent-capabilities-may-be-wise/
"20 Years After Hurricane Katrina, How Safe Is New Orleans From Another Catastrophic Flood?",2025-08-28 20:00:00 (KST),"Scientists and engineers have been implementing steps to better protect New Orleans, but recent government actions are undermining the work, raising alarm",https://www.scientificamerican.com/article/20-years-after-hurricane-katrina-how-safe-is-new-orleans-from-another/
"Bottom Trawling Could Unleash Carbon Dioxide, Worsening Global Warming",2025-08-28 19:45:00 (KST),"Bottom trawling is a fishing practice that is notoriously destructive to seafloor ecosystems.
Now there’s growing evidence that it might unleash planet-warming carbon",https://www.scientificamerican.com/article/bottom-trawling-could-unleash-carbon-dioxide-worsening-global-warming/
Type 1 Diabetes Patient’s Insulin Production Restored with New Cell Transplant Therapy,2025-08-28 20:00:00 (KST),"Scientists treated a person’s type 1 diabetes with genetically modified insulin-producing cells that evaded immune system attacks.
This is the first therapy for the condition that does not require immunosuppressant drugs",https://www.scientificamerican.com/article/type-1-diabetes-patients-insulin-production-restored-with-new-cell/
"Church leader arrested in Tampa FBI raid appears in federal court, staying behind bars for now",2025-08-28 20:57:17 (KST),"One of two church leaders charged in a sweeping federal human trafficking and money laundering case appeared before a judge in Tampa on Thursday, but she’ll ...",https://www.fox13news.com/news/church-leader-arrested-tampa-fbi-raid-appear-federal-court-thursday
AnyDust Clog-Free Wood Dust Collector Lets You Breathe Easy and Build More,2025-08-28 10:45:16 (KST),"AnyDust Clog-Free Wood Dust Collector Lets You Breathe Easy and Build MoreEvery maker knows the frustration of dust collection systems that promise the world but deliver disappointment.
You invest in what seems like a powerful dust...",https://www.yankodesign.com/2025/08/27/anydust-clog-free-wood-dust-collector-lets-you-breathe-easy-and-build-more/
5 must-watch shows and movies on Amazon Prime Video this weekend,2025-08-28 19:30:16 (KST),"Discover five underrated movies and shows on Prime Video.
From crime dramas to period pieces, these hidden gems are perfect for a weekend binge.",https://www.makeuseof.com/dont-skip-these-hidden-gems-amazon-prime-video-this-weekend-august-29-31/
