Title,Published(Kor),Description,Link
Wyze’s newest pan and tilt cam can track your pets in 4K,2025-08-26 20:27:45 (KST),"Smart home tech provider Wyze is launching its first 4K security camera.
The Wyze Cam Pan v4 is available today for $60, featuring color night vision, pan and tilt capabilities, and on-device AI-powered object tracking that captures people, pets, and vehicles…",https://www.theverge.com/news/765794/wyze-cam-pan-v4-security-camera-price-availability
Zooming in on weird cameras,2025-08-26 20:21:54 (KST),"Unconventional cameras are having a bit of a moment.
From the Sigma BF to the Fujifilm Half to young photographers reaching for old digital point-and-shoots, the camera industry has looked a little different over the past few years.
Are these moments just fla…",https://www.theverge.com/uncategorized/765482/fujifilm-x-half-sigma-bf-petapixel-chris-jordan-iphone-mini
Nvidia Unveils High-Tech ‘Brain’ for Humanoid Robots and Self-Driving Cars,2025-08-26 09:29:17 (KST),"The new module is built to handle larger amounts of information, faster and more efficiently.",https://gizmodo.com/nvidia-unveils-high-tech-brain-for-humanoid-robots-and-self-driving-cars-2000647946
"20 years after Hurricane Katrina, the Lower Ninth Ward in New Orleans still lags behind",2025-08-26 18:00:00 (KST),"No neighborhood was hit worse in Katrina than New Orleans' Lower Ninth Ward and it's been one of the slowest areas to rebound.
There's still an effort to attract new residents and businesses there.",https://www.npr.org/2025/08/26/nx-s1-5469875/hurricane-katrina-lower-ninth-ward-20-years
'The most illegal search': Judges push back against D.C. criminal charges,2025-08-26 18:00:00 (KST),"Inside the federal courthouse in Washington, D.C., on Monday, tensions over the potential for federal overreach broke into open court.",https://www.npr.org/2025/08/26/g-s1-85119/crime-washington-dc-judges-arrests
Locals praise innovative 'Garbage Cafes' allowing customers to pay in trash: 'It makes all the difference in our lives',2025-08-26 09:40:00 (KST),"""Now, I can get food for my family in exchange for the plastic I collect.""",https://www.yahoo.com/news/articles/locals-praise-innovative-garbage-cafes-004000098.html
South Korea's president says staff feared a ‘Zelenskyy moment’ at White House meeting,2025-08-26 11:45:49 (KST),But President Lee Jae Myung told an audience at a Washington think tank that his first meeting with Trump was 'beyond my expectations.',https://www.politico.com/news/2025/08/25/south-korea-white-house-meeting-00524394
"After skipping Gold Cup, Musah has big plans for USMNT in a World Cup year",2025-08-26 21:20:12 (KST),United States international Yunus Musah speaks to ESPN's James Olley about his future at AC Milan and his high hopes for next year's World Cup hosts.,https://www.espn.com/soccer/story/_/id/46077553/yunus-musah-big-plans-usmnt-milan-world-cup-year
"Bo Nix, Calvin Ridley among Eric Moody's top draft targets",2025-08-26 20:23:22 (KST),"Eric Moody lists the players he's most excited about drafting this season, including some late-round targets.",https://www.espn.com/fantasy/football/story/_/id/46068455/fantasy-football-draft-day-targets-sleepers-picks
'I can't go out like that': How Travis Kelce has prepared for what could be his final season,2025-08-26 20:23:22 (KST),"Following his worst year as a pro in 2024, Kelce has revamped his body and mind for one more shot at Super Bowl glory.",https://www.espn.com/nfl/story/_/id/46018818/kansas-city-chiefs-travis-kelce-2025-final-season-super-bowl
Uncertainty over certification affects possible 9/11-related illnesses coverage,2025-08-26 18:04:11 (KST),"Advocates claim HHS has paused consideration of new claims.
HHS denies this.",https://abcnews.go.com/Health/uncertainty-certification-affects-911-related-illnesses-coverage/story?id=124948620
Anajak Thai Embraces the Future,2025-08-26 19:49:00 (KST),"The road from art director to chef leads Justin Pichetrungsi right back onto a creative path In the new Anajak Thai kitchen, the first major renovation since the restaurant originally opened, Justin …",http://coolhunting.com/food-drink/anajak-thai-embraces-the-future/
Ninja Gaiden 4 Developers Assure Newcomers That the Tools Are Available to Train Themselves to Get Better at the Game,2025-08-26 17:00:00 (KST),IGN interviews Team Ninja and PlatinumGames at gamescom 2025 to talk all things Ninja Gaiden 4.,https://www.ign.com/articles/ninja-gaiden-4-developers-assure-newcomers-that-the-tools-are-available-to-train-themselves-to-get-better-at-the-game
Nick Fuentes Is Having a Moment,2025-08-26 20:30:00 (KST),"No matter how far the 27-year-old influencer pushes his bigotry, his influence continues to rise.",https://www.theatlantic.com/technology/archive/2025/08/nick-fuentes-white-supremacist-popularity/684005/
Manhunt under way after two police officers shot dead in rural Australian town,2025-08-26 17:54:58 (KST),"Police say a ""heavily armed"" male suspect managed to escape into the bush after the shooting in Victoria state.",https://www.bbc.com/news/articles/ckge4555vpxo
"Rv, a new kind of Ruby management tool",2025-08-26 17:15:49 (KST),"For the last ten years or so of working on Bundler, I’ve had a wish rattling around: I want a better dependency manager.
It doesn’t just manage your gems, it manages your ruby versions, too.
It doesn’t just manage your ruby versions, it installs pre-compiled …",https://andre.arko.net/2025/08/25/rv-a-new-kind-of-ruby-management-tool/
Apple @ Work Podcast: Device security vs identity management in the enterprise,2025-08-26 19:00:00 (KST),"Apple @ Work is exclusively brought to you by Mosyle, the only Apple Unified Platform.
Mosyle is the only solution that integrates in a single professional-grade platform all the solutions necessary to seamlessly and automatically deploy, manage & protect App…",https://9to5mac.com/2025/08/26/apple-work-podcast-device-security-vs-identity-management-in-the-enterprise/
Easily switch from Spotify to Apple Music in the US; Spotify DMs,2025-08-26 20:37:50 (KST),"Earlier this year, we saw an Apple Music tool intended to make it easier to switch from Spotify, and that tool is now available in more countries, including the US.
But wait! Are you sure you really want to do that when Spotify has just rolled out its very…",https://9to5mac.com/2025/08/26/easily-switch-from-spotify-to-apple-music-in-the-us-spotify-dms/
Microplastics Could Be Creating Dangerous Antibiotic-Resistant Bacteria,2025-08-26 20:00:00 (KST),Microplastics are seemingly everywhere—and now growing research suggests they could be generating drug-resistant bacteria,https://www.scientificamerican.com/article/microplastics-could-be-creating-dangerous-antibiotic-resistant-bacteria/
How Many Planets Orbit Our Nearest Neighboring Star?,2025-08-26 21:00:00 (KST),Fresh results from near-infrared instruments foretell a bright future for finding life elsewhere in the Milky Way,https://www.scientificamerican.com/article/how-many-planets-orbit-our-nearest-neighboring-star/
