Title,Published(Kor),Description,Link
Washington's hydropower has created a data center boom. Some are concerned about its future.,2025-08-17 18:00:59 (KST),"In small town Washington — where hydropower is plentiful — data centers are creating jobs and funding amenities.
But water and energy aren't unlimited — and some worry about long-term sustainability.",https://www.npr.org/2025/08/17/nx-s1-5501579/washington-hydropower-data-center-boom-sustainability-climate-change
'Quiet cracking' is the latest buzzword to hit the workplace,2025-08-17 19:38:02 (KST),"In this Sunday edition of Business Insider Today, we're talking about the latest threat to worker wellbeing.",https://www.businessinsider.com/bi-today-sunday-newsletter-quiet-cracking-workplace-2025-8
A Second Chance for the Single Wheel Monorail?,2025-08-17 14:00:15 (KST),"Lately, this peculiar little single wheel monorail came to our attention.
Built by [extraglide1976], all from Meccano.
His build started with modest tests: one gyro obviously flopped.
Two gyros geared …read more",https://hackaday.com/2025/08/16/a-second-chance-for-the-single-wheel-monorail/
Trump approval rating takes another hit in latest poll,2025-08-17 19:00:00 (KST),Donald Trump's approval rating slipped again in the latest Pew Research Center.,https://www.nj.com/politics/2025/08/trump-approval-rating-takes-another-hit-in-latest-poll.html
‘My Kid Will Never Ever Be Smarter Than an AI’: OpenAI’s Sam Altman Warns Most Kids Won’t Know a World Without AI,2025-08-17 21:00:02 (KST),"OpenAI CEO Sam Altman, a central figure in the world of artificial intelligence, recently reflected on the transformative potential of AI advancements, and...",https://www.barchart.com/story/news/34210448/my-kid-will-never-ever-be-smarter-than-an-ai-openais-sam-altman-warns-most-kids-wont-know-a-world-without-ai
Israel's growing frustration over the war in Gaza explodes in nationwide protests,2025-08-17 17:05:03 (KST),Israeli police blasted crowds with water cannons and made dozens of arrests on Sunday as thousands of protesters demanding a deal to free hostages in Gaza...,https://www.yahoo.com/news/articles/protestors-strike-israel-demanding-ceasefire-080503070.html
Humanoid robot turns heads at NYC sneaker store,2025-08-17 19:00:11 (KST),A Chinese-made Unitree R1 robot walked Manhattan streets and shopped for shoes as part of KraneShares' $28 million AI robotics fund promotion campaign.,https://www.foxnews.com/tech/humanoid-robot-turns-heads-nyc-sneaker-store
Passive Microwave Repeaters,2025-08-17 09:25:27 (KST),Comments,https://computer.rip/2025-08-16-passive-microwave-repeaters.html
"Follow the '1-set rule,' eat popcorn, brush your teeth before breakfast — plus 5 more health tips to help you have a great week",2025-08-17 18:00:28 (KST),Try these health tips to have your best week yet.,https://www.yahoo.com/lifestyle/article/follow-the-1-set-rule-eat-popcorn-brush-your-teeth-before-breakfast--plus-5-more-health-tips-to-help-you-have-a-great-week-090028186.html
"A millennial couple grew their side hustle into a business bringing in $4.5 million a year—here’s how the cofounder would start it again, with nothing",2025-08-17 20:07:00 (KST),"The millennial founders of The Nitro Bar turned a $1,500 investment into a multimillion-dollar company—thanks to college students and viral TikTok videos.",https://finance.yahoo.com/news/millennial-couple-grew-side-hustle-110700000.html
What Happens to Your Cholesterol When You Walk Every Day,2025-08-17 12:40:58 (KST),Step toward better cholesterol and a healthier heart.,https://www.eatingwell.com/walking-and-cholesterol-health-11792294
YEEDI M14 PLUS Review: When Cosmic Design Meets Flagship Mopping Technology,2025-08-17 10:45:37 (KST),"YEEDI M14 PLUS Review: When Cosmic Design Meets Flagship Mopping TechnologyRobot vacuums have become the invisible workhorses of modern homes, but most still follow the same tired design playbook: black plastic discs that hide under...",https://www.yankodesign.com/2025/08/16/yeedi-m14-plus-review-when-cosmic-design-meets-flagship-mopping-technology/
This simple magnetic trick could change quantum computing forever,2025-08-17 12:50:10 (KST),"Researchers have unveiled a new quantum material that could make quantum computers much more stable by using magnetism to protect delicate qubits from environmental disturbances.
Unlike traditional approaches that rely on rare spin-orbit interactions, this me…",https://www.sciencedaily.com/releases/2025/08/250816113508.htm
5 reasons I swapped Google Keep for this open-source app,2025-08-17 21:00:38 (KST),"I've used Google Keep and OneNote extensively, but this open-source software is just faster, cleaner, and better at serious note-taking.",https://www.androidauthority.com/google-keep-alternative-3587202/
Sky’s Piracy=Malware Campaign Aims For ‘Holy Grail’ of Behavioral Change,2025-08-17 21:28:29 (KST),"Since September 2023, a national campaign run by Sky and entertainment partners has attempted to convince illegal stream consumers to dump them in favor of platforms operating on the right side of the law.
To encourage that important step, the BeStreamWise ca…",https://torrentfreak.com/skys-piracymalware-campaign-aims-for-holy-grail-of-behavioral-change-250817/
Jennifer Lopez And Owen Wilson Starred Together In A Cult Classic Horror Movie,2025-08-17 19:45:00 (KST),"It's always the right time to look back fondly at Anaconda, the ridiculously fun cult classic that has Jennifer Lopez fighting a giant snake.",https://www.slashfilm.com/1937755/jennifer-lopez-owen-wilson-horror-movie-anaconda/
Brandon Sanderson's Stormlight Archive Books Ranked,2025-08-17 19:10:00 (KST),"Brandon Sanderson is an absolute legend and fantasy juggernaut.
So, let's try and rank his greatest ""Stormlight Archive"" books-not an easy task, we know!",https://www.slashfilm.com/1937204/brandon-sanderson-stormlight-archive-books-ranked/
How Tom Selleck Feels About Missing Out On The Indiana Jones Franchise,2025-08-17 09:45:00 (KST),Tom Selleck infamously missed out on playing Indiana Jones in Raiders of the Lost Ark; here's what he had to say about that several decades after the fact.,https://www.slashfilm.com/1931712/tom-selleck-feelings-missing-out-indiana-jones/
"24 of the Funniest and Freshest Feline Tweets to Fill Your Week With Pawsitivity (August 17, 2025)",2025-08-17 19:09:22 (KST),"What a fine and dandy meowrning it is, feline fam.
It's the purrfect meowrning to do absolutely… nothing! We're taking a page from our cats' playbook and planning on doing diddly-squat today.
Zip.
Zero.
Nada.
We have an 8-hour date scheduled with our couch, s…",https://cheezburger.com/42001157/24-of-the-funniest-and-freshest-feline-tweets-to-fill-your-week-with-pawsitivity-august-17-2025
Lionel Messi scores as Inter Miami wins late against LA Galaxy,2025-08-17 12:33:29 (KST),The Argentinian superstar returns from injury to score a goal and add an assist as Inter downs Galaxy at Chase Stadium.,https://www.aljazeera.com/sports/2025/8/17/lionel-messi-scores-as-inter-miami-wins-late-against-la-galaxy
