Title,Published(Kor),Description,Link
Microsoft hosts emergency press conference after protesters ‘storm a building’,2025-08-27 09:22:52 (KST),"Microsoft president Brad Smith hosted an impromptu press conference on Tuesday afternoon, just hours after protesters gained access to a building at the company’s headquarters and held a sit-in demonstration inside his office.
Seated on the edge of his desk, …",https://www.theverge.com/microsoft/766429/microsoft-emergency-press-conference-palestine-protest
'I immediately freaked out' - Taylor Swift's engagement sends fans into frenzy,2025-08-27 10:13:36 (KST),From her flowers to the dress - and her overall love life - Swifties pore over every single detail about the superstar.,https://www.bbc.com/news/articles/c4gzdpk3xwjo
Gemini CLI is breaking out of the terminal and joining Zed's code editor,2025-08-27 21:04:00 (KST),"Gemini CLI started out as an open-source, text-based AI agent for the terminal, and it's now elevating the experience by partnering with Zed.",https://www.androidcentral.com/apps-software/ai/gemini-cli-zed-code-editor-partnership
A 'college for all' push thrived in New Orleans after Katrina. It wasn't for everyone,2025-08-27 18:00:00 (KST),"After Hurricane Katrina, many New Orleans charter schools united in a mission to send more students to college.
Today, some of those students, now adults, wish they'd been given more options.",https://www.npr.org/2025/08/27/nx-s1-5515759/college-schools-education-new-orleans-katrina
Hurricane Katrina forced changes at FEMA. Trump is rolling them back,2025-08-27 18:00:00 (KST),"The government's colossal failure to respond after Hurricane Katrina led to major reforms at the nation's top disaster agency.
Now, the Trump administration has reversed some of those changes.",https://www.npr.org/2025/08/27/nx-s1-5476531/fema-hurricane-katrina-trump
"While working as a lawyer, I started posting about my family online. When it took off, I quit, and my site makes over $1 million each year.",2025-08-27 17:51:01 (KST),"Blair Lonergan was an Ivy League-educated lawyer.
She became a cooking influencer, quit her job, and now her site makes over $1 million annually.",https://www.businessinsider.com/quit-job-lawyer-cooking-influencer-seasoned-mom-2025-8
"I was laid off from a 6-figure salary job and now deliver DoorDash meals for $3 tips. It's taught me that I'm strong, resilient, and willing to do what it takes.",2025-08-27 19:13:01 (KST),"Kelly Kanaras was a communications executive with a six-figure salary until she was laid off a month ago.
She took up gig work to stretch her savings.",https://www.businessinsider.com/laid-off-from-6-figure-salary-job-work-doordash-rover-2025-8
I quit my job at Google after 2 years. I prepared well for my exit but wish I'd done 3 things differently.,2025-08-27 18:05:02 (KST),"Erica Rivera worked as a technical recruiter at Google before she quit to become a career coach.
There are three things she regrets not doing.",https://www.businessinsider.com/what-wish-did-before-quit-job-google-what-did-right-2025-8
"Inside Hawaii's rent-free, incredibly strict 'Forbidden Island'",2025-08-27 17:07:01 (KST),"Hawaiians live on this paradise island rent-free.
So long as they don't drink, do drugs, or break any other of the old-world owners' old-school rules.",https://www.businessinsider.com/inside-hawaii-rent-free-forbidden-island-strict-rules-niihau-robinson-2025-8
Nvidia earnings preview and the Trump chip tariff twist,2025-08-27 19:00:25 (KST),"You can catch Trader Talk on Apple Podcasts, Spotify, YouTube, or wherever you get your podcasts.
Tariffs, AI, and Nvidia’s next report collide.
On Trader...",https://finance.yahoo.com/video/nvidia-earnings-preview-trump-chip-100025160.html
Welcome to 'Milwaukee Community College': How the Brewers built a $115 million juggernaut,2025-08-27 20:05:08 (KST),"As small-market Milwaukee rolls along with MLB's best record, everyone wants to know the Brew Crew's secret formula.",https://www.espn.com/mlb/story/_/id/46070566/mlb-2025-milwaukee-brewers-national-league-best-team-100-wins-low-payroll-powerhouse
How to Survive Your Song Going Viral on TikTok,2025-08-27 19:00:00 (KST),"Kyle Chayka on the band Cafuné’s hit song “Tek It,” first recorded in 2019, and their life after having a song go viral on social media.",https://www.newyorker.com/culture/infinite-scroll/how-to-survive-your-song-going-viral-on-tiktok
"Amid Battlefield 6's Commitment to 'Gritty Realism,' Activision Makes Shock Call of Duty Change for Black Ops 7: 'We Hear the Feedback'",2025-08-27 17:35:20 (KST),"It sounds like all change for Call of Duty with the release of Black Ops 7, amid pressure from Battlefield 6 and its commitment to “gritty realism.”",https://www.ign.com/articles/amid-battlefield-6s-commitment-to-gritty-realism-activision-makes-shock-call-of-duty-change-for-black-ops-7-we-hear-the-feedback
Millennials Need a Vacation From Family Vacation,2025-08-27 21:00:00 (KST),"Among parents determined to pass down their globe-trotting values, travel has become ever more ambitious and goal-oriented—and exhausting.",https://www.theatlantic.com/family/archive/2025/08/millennial-travel-kids-intensive-parenting/684016/
Money Can't Buy You Love: The Story Behind Elon Musk's Berghain Rejection,2025-08-27 21:07:16 (KST),Comments,https://berlinguide.de/money-cant-buy-you-love-the-story-behind-elon-musks-berghain-rejection/
"Dissecting the Apple M1 GPU, the End – Alyssa Rosenzweig",2025-08-27 10:44:16 (KST),Comments,https://rosenzweig.io/blog/asahi-gpu-part-n.html
Bring Your Own Agent to Zed – Featuring Gemini CLI,2025-08-27 21:25:38 (KST),"From the Zed Blog: Zed now lets you use the agent of your choice through the new Agent Client Protocol, starting with Google's Gemini CLI.",https://zed.dev/blog/bring-your-own-agent-to-zed
The Mediocrity of Curtis Yarvin,2025-08-27 09:39:14 (KST),The provocateur attracts conservatives who prefer cheap solutions instead of confronting complex moral questions.,https://lawliberty.org/the-mediocrity-of-curtis-yarvin/
Security Bite: Viral TikToks promote ‘undetectable’ Find My-enabled GPS trackers for stalking,2025-08-27 10:29:05 (KST),"9to5Mac Security Bite is exclusively brought to you by Mosyle, the only Apple Unified Platform.
Making Apple devices work-ready and enterprise-safe is all we do.
Our unique integrated approach to management and security combines state-of-the-art Apple-specifi…",https://9to5mac.com/2025/08/26/security-bite-viral-tiktoks-promote-undetectable-find-my-enabled-gps-trackers-for-stalking/
"Paradox are ""making adjustments"" to Bloodlines 2's day-one vampire clan DLC plans, following backlash",2025-08-27 18:30:42 (KST),"Well, there you go.
Vampire: The Masquerade - Bloodlines 2 publisher Paradox look like they might be sticking a stake in their rather unpopular plans to sell two of the game's vampire clans as paid day-one DLC.
I say ""might be"" because nothing specific's been…",https://www.rockpapershotgun.com/paradox-are-making-adjustments-to-bloodlines-2s-day-one-vampire-clan-dlc-plans-following-backlash
