Title,Published(Kor),Description,Link
"'제주항공 참사' 국회 특위, 2차가해 방지 결의안 채택",2025-01-16 21:20:00 (KST),"특위는 오늘(16) 국회에서 전체회의를 열고 국민의힘 권영진 의원을 위원장으로 한 조직 구성을 공식화하고, 투명한 사고 조사, 장기적인 유족 지원 방안을 논의했습니다.
또 피해자와 유족을 향한 2차 가해 방지를 위해...",https://ysmbc.co.kr/NewsArticle/1444070
2026여수세계섬박람회 추진상황보고회,2025-01-16 21:20:00 (KST),"섬박람회 조직위원회는 오늘(16), 여수세계박람회장 컨퍼런스홀에서 관련 기관 관계자와 시민 등이 참석한 가운데 섬박람회 추진상황 보고회를 갖고, 지금까지의 예산 확보와 기반공사 추진 현황, 전시 콘텐츠와 향후...",https://ysmbc.co.kr/NewsArticle/1444071
"고흥군, 공직자 공동주택 '흥양관' 입주식 가져",2025-01-16 21:20:00 (KST),"고흥군은 신규 공무원들의 안정적인 주거정착을 위해 9억 8천만 원의 예산으로 옛 KT 사택을 사들여 전체 리모델링 공사를 진행했으며, 오늘(16), 직원 16명의 첫 입주를 축하하는 흥양관 입주식을 개최했습니다.
고흥군은...",https://ysmbc.co.kr/NewsArticle/1444076
"전남 농민들 ""벼 재배면적 강제감축안 즉각 폐기해야""",2025-01-16 21:20:00 (KST),전국농민회총연맹 광주전남연맹 등은 오늘(16) 전남도청 앞에서 기자회견을 열고 재배 감축 면적의 예상 생산량 40만 톤이 수입쌀 양과 같은 것은 우연이 아니라며 전라남도에 농민 영농권을 침해하는 정책을 거부하라고...,https://ysmbc.co.kr/NewsArticle/1444082
"'전통 바둑구단' GS칼텍스팀, 여수로 연고 이전",2025-01-16 21:20:00 (KST),"오늘(16) GS칼텍스팀의 감독과 선수 등은 KB국민은행 바둑리그 여수 투어에 앞서 GS칼텍스 여수 공장을 견학했으며, 여수지역 바둑팬들과 꿈나무들을 대상으로 '지도 다면기'도 열었습니다.
GS칼텍스는 지난 2006년부터...",https://ysmbc.co.kr/NewsArticle/1444079
"대한의사협회 김택우 집행부 확정, 신구조화 방점",2025-01-16 21:18:00 (KST),"인사들을 균형 있게 기용했다""며 ""신구세대가 잘 어울려서 어려운 난국 해결할 수 있도록 노력하겠다""고 밝혔다.
한편, 대한의사협회 제43대 집행부는 오늘(16일) 첫 상임이사회를 개최하고 본격적인 회무를 시작할 예정이다.",http://www.newsmp.com/news/articleView.html?idxno=244885
"차민규, 동계체전 1,000m 금메달 획득...""오늘 경기 바탕으로 아시안게임...",2025-01-16 21:18:00 (KST),"있는데, 오늘 훈련한 대로 좋은 성과가 나와서 기분이 좋다""고 우승 소감을 전했다.
이어 다음 달 열리는 하얼빈동계 아시안게임에서도 ""컨디션 조절을 잘해서 오늘 경기를 바탕으로 최선의 기량을 발휘할 수...",https://m.sports.naver.com/general/article/477/0000530558
[날씨] 찬 공기 점차 약해져…동해안 대기 건조,2025-01-16 21:18:00 (KST),"오늘(16일)은 종일 하늘이 흐렸지만 내일은 맑은 하늘이 드러나겠습니다.
낮에는 햇살이 기온을 끌어올리면서 추위도 한결 낫겠는데요.
찬 공기의 힘이 점차 약해져서 주말에는 추위가 조금 더 풀리겠고, 절기 대한인 다음...",https://n.news.naver.com/mnews/article/055/0001224267?sid=103
"광주관광공사 노조, 상위 직급 축소ㆍ공무직 감축 반발",2025-01-16 21:18:00 (KST),"노조는 오늘(16일) 광주시의회에서 기자회견을 열고 공사 측이 일방적으로 직급 통합을 강행하면서 1급 본부장 정원을 줄이고 2급직 정원을 늘리지 않아 직원들의 승진 기회가 박탈됐다고 주장했습니다.
또, 공무직인...",https://n.news.naver.com/mnews/article/660/0000077525?sid=102
"野, 尹 체포되자 ""다음은 김건희 구속·특검""…이재명은 말 아끼며 '신중...",2025-01-16 21:17:00 (KST),"박주민 / 더불어민주당 의원 (오늘, CBS '김현정의 뉴스쇼' 中) ""검찰이 제대로 수사할 의지가 있었다면 소환을 하든 출국 금지를 하든 했었어야죠."" 박지원 / 더불어민주당 의원 (오늘, KBS '전격시사' 中) ""윤석열이...",https://n.news.naver.com/mnews/article/448/0000502753?sid=004
"체포앞둔 경호처 지휘부, 인사로 보복?…‘영장저지 반대’ 간부들 직무...",2025-01-16 21:17:00 (KST),"김성훈 경호처 차장과 함께 ‘강경파’로 분류되는 이광우 경호본부장은 오늘(16일) 대통령 근접경호를...
박성준 더불어민주당 원내수석부대표는 오늘 소속 의원들에게 “대통령실 내에서 (영장집행 저지 거부에) 협조한...",https://n.news.naver.com/mnews/article/056/0011876324?sid=100
"김용현 첫 재판…""일개 검사가 대통령 권한 판단하나""",2025-01-16 21:17:00 (KST),"서울중앙지법은 오늘(16일) 내란중요임무종사 등 혐의를 받는 김 전 장관의 첫 공판준비기일을 진행했습니다.
준비기일에는 피고인 출석 의무가 없지만, 김 전 장관은 직접 출석했습니다.
김 전 장관 측은 비상계엄...",https://n.news.naver.com/mnews/article/422/0000706086?sid=102
"관악구 신년인사회 개최…박준희 ""내실있는 살림 꾸려나갈 것""",2025-01-16 21:17:00 (KST),"박준희 구청장은 ""오늘 신년인사회에 와주신 모든 분들의 염원을 담아 올해도 더욱 내실있는 관악구 살림을 꾸려나갈 것을 약속드리며, 구민 행복과 민생 안정의 열매를 맺는 희망찬 2025년을 만들어 나가겠다""고 말했다.",https://n.news.naver.com/mnews/article/629/0000357366?sid=102
"'콩콩밥밥' 이광수, 나영석에 ""우리 먹으라고 가져온게 아니고요?"" 황당",2025-01-16 21:16:00 (KST),"과일을 들고 온 나영석은 ""이거 저기 오늘 설현 씨가 사온거랑 박보영 씨가 사온게 좀 남아서 디저트 뭐 필요하실까봐 혹시 몰라서""라고 했고 이광수는 ""아 우리 먹으라고 가져온게 아니고요""라며 황당해 하는 모습을...",https://www.slist.kr/news/articleView.html?idxno=612338
"공감 칼럼(제철경제) I 박시동 ""2시간짜리 계엄으로 평소보다 200~300배 돈...",2025-01-16 21:16:00 (KST),"오늘도 박시동 경제평론가 나오셨습니다.
안녕하세요.
▶네 안녕하세요.
박시동입니다.
▷우리 경제 얘기를...
그래서 어제 오늘 좀 증시가 어땠는지, 환율은 어땠는지 좀 설명해 주시죠.
▶사실 계엄 이후에, 계엄이 어떤...",https://news.cpbc.co.kr/article/1161498?division=NAVER
"HMM, 아시아-남미동안 노선 추가 개설…효성티앤씨, 농어촌 ESG 실천 우수...",2025-01-16 21:16:00 (KST),"HMM의 아시아-남미동안 신규 노선 FL2.
ⓒHMM HMM, 아시아-남미동안 노선 추가 개설 HMM은 오는 4월 컨테이너 서비스 FL2를 추가 개설한다고 16일 밝혔다.
FL2는 'Far East Asia-East Latin America Service 2'의 준말이다.
한국에서...",http://www.sisaon.co.kr/news/articleView.html?idxno=167533
제주항공 채용 개입 의혹 입장표명 요구,2025-01-16 21:16:00 (KST),"국민의힘 제주도당은 오늘(16) 논평을 내고, 이번 논란과 관련해 인사청탁과 관련한 합리적 의심을 제기한다며, 당사자와 도지사는 입장표명을 해야한다고 밝혔습니다.
특히 가장 확실한 의혹 해소 방법은 도지사가...",https://n.news.naver.com/mnews/article/661/0000049544?sid=102
[오늘의포토] 독감 급증…“마스크 꼭 쓰세요”,2025-01-16 21:16:00 (KST),"최근 들어 독감환자가 부쩍 증가하고 있는 가운데 16일 오후 광주 북구청 민원실에 독감 예방을 위한 마스크 착용을 권고하는 포스터가 부착되어 있다.
/김진수 기자 jeans@kwangju.co.kr",http://www.kwangju.co.kr/article.php?aid=1737029700779028096
尹 체포적부심 심문 2시간 만에 종료…이르면 오늘밤 결론,2025-01-16 21:16:00 (KST),"석동현 변호사 ""위법·무효 영장으로 신체 구속"" 윤석열 대통령이 서울중앙지법에 청구한 체포적부심 심문이 2시간 만에 끝났다.
서울중앙지법 형사32단독 소준섭 판사는16일 오후 5시부터 7시 4분께까지 윤 대통령이...",https://n.news.naver.com/mnews/article/629/0000357365?sid=102
"제주∼칭다오 항로, 中 승인 끝.. ""정부 결정 남아""",2025-01-16 21:16:00 (KST),"오늘(15일) 다이빙 신임 주한 중국대사는 오영훈 제주도지사와 면담에서 중국측은 이미 항로를 허가했고, 한국 정부가 승인에 속도를 내야 한다라고 촉구했습니다.
제주도는 항만 세관과 사무실 등 실무 준비를 마친 상태로...",https://n.news.naver.com/mnews/article/661/0000049545?sid=102
