Title,Published(Kor),Description,Link
Plex Will Start Cracking Down on Free Remote Streaming Access This Week,2025-11-27 20:00:00 (KST),"Look out, Roku owners.
You’re up first.",https://www.wired.com/story/plex-cracking-down-free-remote-streaming-access/
The best-selling 10GbE Plex NAS gets an unmissable discount ahead of Black Friday,2025-11-27 12:31:41 (KST),"The DXP4800 Plus is no doubt one of the best 4-bay NAS models available today.
And now, it is down to $559 as part of Black Friday savings, making it a standout choice.",https://www.androidcentral.com/accessories/smart-home/the-best-selling-10gbe-plex-nas-gets-an-unmissable-discount-ahead-of-black-friday
Still using Samsung? This OnePlus deal will convince you to switch to a better phone,2025-11-27 19:49:29 (KST),"There is no phone better than a $699 OnePlus 13, and I should know — I test nearly a hundred phones a year.",https://www.androidcentral.com/phones/oneplus/still-using-samsung-this-oneplus-deal-will-convince-you-to-switch-to-a-better-phone
"I Dug Up 120 Killer Black Friday Deals From Apple, Samsung, Eufy, Ring and More",2025-11-27 19:15:00 (KST),Black Friday's biggest savings are starting to go live and these are the ones worth your time and money.,https://www.cnet.com/deals/best-black-friday-deals-2025-11-27/
"Michel Martin reflects on Thanksgiving. And, revisit Susan Stamberg's cranberry relish",2025-11-27 20:30:00 (KST),"Thanksgiving has a complicated origin story, but it remains a great opportunity to express gratitude.
Morning Edition host Michel Martin explains why that is.",https://www.npr.org/2025/11/27/g-s1-99270/up-first-newsletter-thanksgiving-cranberry-relish-tradition
Mexico Unveils Plans To Build Most Powerful Supercomputer In Latin America,2025-11-27 12:30:00 (KST),An anonymous reader quotes a report from the Associated Press: Mexico unveiled plans Wednesday to build what it claims will be Latin America's most powerful supercomputer -- a project the government says will help the country capitalize on the rapidly evolvin…,https://hardware.slashdot.org/story/25/11/26/2330218/mexico-unveils-plans-to-build-most-powerful-supercomputer-in-latin-america
"Linda Hamilton, 69, says she doesn't want to 'chase longevity'",2025-11-27 14:46:27 (KST),Linda Hamilton said her twin sister's death five years ago pushed her to start checking off her bucket-list goals.,https://www.businessinsider.com/linda-hamilton-aging-gracefully-health-wellness-longevity-beauty-2025-11
Here's what big bank CEOs have said about AI's impact on head count,2025-11-27 20:41:01 (KST),"If you're one of the nearly 2 million bank employees in the US, here's what your industry leaders are saying about how generative AI may impact your job.",https://www.businessinsider.com/ceos-jpmorgan-citi-goldman-bofa-wells-how-ai-impact-headcounts-2025-11
"Mortgage and refinance interest rates today, November 27, 2025: Lowest since October 2024",2025-11-27 20:00:38 (KST),"These are today's mortgage and refinance interest rates, which declined slightly.
Yet, rates are at their lowest point since October 2024.
Lock in your rate ...",https://finance.yahoo.com/personal-finance/mortgages/article/mortgage-refinance-rates-today-thursday-november-27-2025-110038025.html
Scott Galloway assured Americans they can attain financial success by investing in 'forced savings vehicles',2025-11-27 19:27:00 (KST),Build your wealth while limiting your ability to spend.,https://finance.yahoo.com/news/scott-galloway-assured-americans-attain-102700050.html
Here's what Sean Combs will be having for Thanksgiving dinner in jail,2025-11-27 11:09:20 (KST),Combs is serving time at Federal Correctional Institution Fort Dix in New Jersey.,https://ew.com/what-sean-combs-will-be-having-for-thanksgiving-dinner-in-jail-11858276
Zipline's US deliveries have risen 15% every week in 2025: CEO,2025-11-27 09:00:00 (KST),Zipline (ZIPL.PVT) co-founder and CEO Keller Cliffton sits down with Josh Lipton to discuss the delivery drone operator's growth since its first flight in...,https://finance.yahoo.com/video/ziplines-us-deliveries-risen-15-000000813.html
Battlefield 6 Just Scored an Unbelievably Good Black Friday Discount at Amazon,2025-11-27 19:19:55 (KST),"Battlefield 6 is now just $35 on PS5 for Black Friday, and its one of the best deals you can pick up this holiday weekend.",https://www.ign.com/articles/battlefield-6-black-friday-deal-2025
"This Might Be the Best 3-In-1 Charging Stand for Apple Devices, Except for One Thing",2025-11-27 21:05:02 (KST),"Anker's Anker Prime Wireless Charging Station has a screen, fan-assisted 25W wireless charging, and an absurd price.",https://gizmodo.com/anker-prime-wireless-charging-station-review-2000686108
Stranger Things Comes to an Exhausting End,2025-11-27 10:01:00 (KST),"The Netflix show is back for a final season, but its brand is forever.",https://www.theatlantic.com/culture/2025/11/stranger-things-season-5-tv-review/685082/
How Alison Roman Does Thanksgiving,2025-11-27 21:00:00 (KST),"A conversation with the chef about her new book, Something From Nothing",https://www.theatlantic.com/podcasts/2025/11/how-alison-roman-does-thanksgiving/685056/
Inside Trump’s Latest Push for Peace in Ukraine,2025-11-27 12:30:06 (KST),The most consistent thing about Trump’s 10-month search for an end to the war in Ukraine has been his inconsistency.,https://www.theatlantic.com/national-security/2025/11/ukraine-peace-push-russia-trump-zelensky/685045/
Migrating the Main Zig Repository from GitHub to Codeberg,2025-11-27 10:49:00 (KST),Comments,https://ziglang.org/news/migrating-from-github-to-codeberg/
New research highlights a shortage of male mentors for boys and young men,2025-11-27 18:16:06 (KST),"Approximately one in three young men lacks an adult male to consult for help with school or relationships.
New survey data indicates this ""mentorship gap"" is most pronounced for boys living in lower-income families.",https://www.psypost.org/new-research-highlights-a-shortage-of-male-mentors-for-boys-and-young-men/
Principles of Vasocomputation,2025-11-27 14:51:21 (KST),Comments,https://opentheory.net/2023/07/principles-of-vasocomputation-a-unification-of-buddhist-phenomenology-active-inference-and-physical-reflex-part-i/
