Title,Published(Kor),Description,Link
"6 Women Inventors Who Changed Your Life, Even if You Didn’t Know It",2025-11-19 20:30:42 (KST),"These are some of the women behind the technologies that make our modern world go round, from WiFi to windshield wipers.",https://gizmodo.com/6-women-inventors-who-changed-your-life-even-if-you-didnt-know-it-2000687772
"I tested Redmagic's 11 Pro gaming phone, and I'm convinced that liquid cooling is the way forward: It also gets unbeatable battery life, and you won't believe what it costs",2025-11-19 13:28:31 (KST),"Redmagic once again delivers one of the best hardware packages, and at $699, the 11 Pro undercuts other flagships by a lot.",https://www.androidcentral.com/phones/redmagic-11-pro-review
Is AI Purposefully Underperforming in Tests? Open AI Explains Rare But Deceptive Responses,2025-11-19 21:00:51 (KST),"Research reveals some AI models can deliberately underperform in lab tests, however, OpenAI says this is a rarity.",https://www.cnet.com/tech/services-and-software/is-ai-purposefully-underperforming-in-tests-open-ai-explains-rare-but-deceptive-responses/
Poll: Democrats have biggest advantage for control of Congress in 8 years,2025-11-19 19:00:00 (KST),A new NPR/PBS News/Marist poll shows some major warning signs for President Trump and Republicans ahead of the 2026 midterm elections as Americans want the president to focus on lowering prices.,https://www.npr.org/2025/11/19/nx-s1-5611088/poll-democrats-republicans-trump-approval-inflation
3 massive changes you'll see as the climate careens toward tipping points,2025-11-19 19:05:00 (KST),"Scientists are increasingly concerned that the planet is headed for massive, irreversible changes due to global warming.
In some cases, those changes have already begun.",https://www.npr.org/2025/11/19/nx-s1-5593087/climate-tipping-points-cop30-brazil-coral-glaciers-carbon
I made a list of 20 places around the world where I could see myself retiring. One checked every box.,2025-11-19 09:14:01 (KST),"When people ask if Malaysia is his second home, 70-year-old retiree Ward Chartier says, ""No, it's my only home.""",https://www.businessinsider.com/american-retiree-penang-malaysia-mm2h-healthcare-longevity-cancer-survivor-2025-11
Meet the 120 women competing to be Miss Universe 2025,2025-11-19 12:04:03 (KST),"The 74th annual Miss Universe pageant will be held in Bangkok on November 21.
Over 100 women from around the world will be competing.",https://www.businessinsider.com/miss-universe-pageant-contestants-photos-2025-11
"Forty miles from nowhere: A New Mexico case study in misguided, ill-conceived gov’t waste",2025-11-19 14:00:00 (KST),"NEW MEXICO (KRQE) – “Who the heck thought it was a good idea to build it where they built it?” asks State Representative Gail Armstrong.
We don’t know who...",https://www.krqe.com/news/larry-barker/forty-miles-from-nowhere-a-new-mexico-case-study-in-misguided-ill-conceived-govt-waste/
Texas governor declares Muslim civil rights group a terrorist organization,2025-11-19 13:25:40 (KST),"Republican Texas Gov.
Greg Abbott on Tuesday declared one of the largest Muslim civil rights and advocacy groups in the U.S.
a “foreign terrorist...",https://www.yahoo.com/news/articles/texas-governor-declares-muslim-civil-042540956.html
A walk in the dark: New moon in Scorpio tarot horoscopes for every zodiac sign,2025-11-19 21:00:00 (KST),"There's a new moon rising in the sign of sex, death, secrets and power, folks.",https://nypost.com/2025/11/19/astrology/november-2025-new-moon-in-scorpio-tarot-horoscopes-for-everysign/?utm_source=yahoo&amp;utm_campaign=nypost&amp;utm_medium=referral
Could Iran's Khamenei feel threatened enough to strike Israel?,2025-11-19 20:34:06 (KST),"Between domestic dysfunction and Middle East geopolitics, could the Islamic Republic use Israel to rally the nation? Since the end of the 12-Day War between ...",https://www.jpost.com/middle-east/iran-news/article-874438
"Inside Diddy’s New Life in Fort Dix Prison: Strict Routines, Bad Food and Shocking Sex and Violence",2025-11-19 09:00:45 (KST),"They say every picture tells a story.
On November 7, TMZ posted a photo of Sean “Diddy” Combs at the Fort Dix Federal Correctional Institution in New Jersey....",https://www.usmagazine.com/celebrity-news/news/inside-diddys-life-at-fort-dix-prison-fights-filth-and-bad-food-excl/
"Migrants thought they were in court for a routine hearing. Instead, it was a deportation trap",2025-11-19 21:03:26 (KST),"Nearby, a Cuban man who had lived in the United States for years stepped from an elevator and into the courtroom where the government lawyer was waiting for ...",https://www.yahoo.com/news/articles/migrants-thought-were-court-routine-120326269.html
"Top 3 of CFP unchanged; Tide drop, UGA to No. 4",2025-11-19 11:03:55 (KST),"Ohio State, Indiana and Texas A&M remained the top three teams in the latest College Football Playoff rankings released Tuesday, while Alabama dropped six spots to No.
10 and was replaced by Georgia at No.
4.",https://www.espn.com/college-football/story/_/id/47016294/ohio-state-indiana-texas-georgia-top-november-18-cfp-rankings
"Nico Harrison, Mark Cuban and a 'palace coup': Inside a bitter feud for control in Dallas",2025-11-19 20:54:11 (KST),Everything that led to the end of Nico Harrison's tenure with the Dallas Mavericks 11 games into the season.,https://www.espn.com/nba/story/_/id/47014061/inside-mavericks-power-struggle-nico-harrison-vs-mark-cuban
NHL Bubble Watch: Projecting playoff hopes for all 32 teams,2025-11-19 21:24:14 (KST),"At the quarter-season mark, here's a rundown of the locks, teams with work to do and long shots.",https://www.espn.com/nhl/story/_/id/47011737/nhl-2025-26-bubble-watch-playoffs-standings-projections-matchups
I Went to See the Future of the Democratic Party. I Found Something Far More Entertaining.,2025-11-19 19:45:00 (KST),"The Pod Save America bros’ convention started with a message of Democratic unity.
Then things got messy.",https://slate.com/news-and-politics/2025/11/pod-save-america-democratic-party-future.html
'Rascals!' – Battlefield 6 Players Torn as 323 Pack Puts a High Price on Grounded Skins,2025-11-19 18:14:47 (KST),Battlefield 6 players are split after the new 323 cosmetic pack introduced a collection of grounded infantry skins…and a $24 price tag.,https://www.ign.com/articles/rascals-battlefield-6-players-torn-as-323-pack-puts-a-high-price-on-grounded-skins
"Apes Were Kissing Millions of Years Before Humans, Study Suggests",2025-11-19 09:01:02 (KST),"Smooching might be a familiar behavior, but it's more mysterious than you would probably imagine.",https://gizmodo.com/apes-were-kissing-millions-of-years-before-humans-study-suggests-2000687184
"Quantum physicists have shrunk and ""de-censored"" DeepSeek R1",2025-11-19 19:06:09 (KST),They managed to cut the size of the AI reasoning model by more than half—and claim it can now answer politically sensitive questions once off limits in Chinese AI systems.,https://www.technologyreview.com/2025/11/19/1128119/quantum-physicists-compress-and-deconsor-deepseekr1/
