Title,Published(Kor),Description,Link
AI Relationships Are on the Rise. A Divorce Boom Could Be Next,2025-11-13 20:30:00 (KST),Secret chatbot flings are creating new legal challenges for married couples when it comes to infidelity.,https://www.wired.com/story/ai-relationships-are-on-the-rise-a-divorce-boom-could-be-next/
Fossil fuel emissions rise again - but renewables boom offers hope for climate,2025-11-13 12:16:15 (KST),Carbon emissions from burning fossil fuels are forecast to reach a new high in 2025 but could soon peak.,https://www.bbc.com/news/articles/c620q30w0q0o
"I used a Snapdragon 8 Elite Gen 5-powered gaming phone, and I'm convinced Qualcomm has the fastest mobile chipset — there's just one glaring issue",2025-11-13 19:53:45 (KST),"I tested the Snapdragon 8 Elite Gen 5, and it is the fastest mobile platform available today.
There's just one issue — it tends to overheat quite a bit.",https://www.androidcentral.com/phones/i-used-a-snapdragon-8-elite-gen-5-powered-gaming-phone-and-im-convinced-qualcomm-has-the-fastest-mobile-chipset-theres-just-one-glaring-issue
Toyota Opens the Doors To Its First EV Battery Plant In the US,2025-11-13 12:30:00 (KST),"An anonymous reader quotes a report from Electrek: Production is now underway at Toyota's new $13.9 billion battery plant in North Carolina, the company's first outside Japan.
After the first batteries rolled off the production line at its new facility in Lib…",https://tech.slashdot.org/story/25/11/12/2332244/toyota-opens-the-doors-to-its-first-ev-battery-plant-in-the-us
Waymo is proving Elon Musk wrong,2025-11-13 18:44:01 (KST),"Tesla CEO Elon Musk said in August that Waymo's robotaxis can't drive on highways because of the sensors.
Waymo announced freeway rides on Wednesday.",https://www.businessinsider.com/waymo-proves-tesla-ceo-elon-musk-wrong-highway-freeway-2025-11
A six-figure eBay seller who started his side hustle with $0 explains how he sources profitable products,2025-11-13 19:30:01 (KST),"An eBay veteran who's been reselling for 20 years shared where he shops, what he's looking for, and strategies he uses to ensure he'll turn a profit.",https://www.businessinsider.com/side-hustle-how-to-find-profitable-products-resell-on-ebay-2025-11
The new AI warnings popping up in SEC filings,2025-11-13 19:58:01 (KST),"A growing number of SEC filings now list AI as a material risk, reflecting both its rapid adoption and the uncertainty surrounding how to control it.",https://www.businessinsider.com/companies-are-warning-about-risks-of-ai-sec-filings-2025-11
Older Tech In The Browser Stack,2025-11-13 17:00:00 (KST),"There are many existing web features and technologies in the wild that you may never touch directly in your day-to-day work.
Perhaps you’re fairly new to web development and are simply unaware of them because you’re steeped in the abstraction of a specific fr…",https://www.smashingmagazine.com/2025/11/older-tech-browser-stack/
"Mortgage and refinance interest rates today, November 13, 2025: Little movement as Treasurys churn",2025-11-13 20:00:22 (KST),"These are today's mortgage and refinance interest rates, which still without a firm direction.
Yet, rates are generally lower over the past two months.
Lock ...",https://finance.yahoo.com/personal-finance/mortgages/article/mortgage-refinance-interest-rates-today-thursday-november-13-2025-110022987.html
Which Starbucks stores are impacted by Red Cup Day strikes? See a list of cities,2025-11-13 20:33:06 (KST),"The ""overwhelming majority"" of Starbucks locations are expected to remain open on Red Cup Day 2025.
However, strikes are planned in 41 cities.",https://www.usatoday.com/story/money/2025/11/13/starbucks-red-cup-day-strike-stores/87231882007/
"Greenfield police: Missing, endangered man found dead",2025-11-13 13:20:03 (KST),"The Greenfield Police Department said Mark Ziegler, reported missing and endangered on Wednesday, has been located.",https://www.fox6now.com/news/missing-endangered-greenfield-man-mark-ziegler
"Sophie Rain Spends 50,000 Dollars on Groceries for Families Hit by Shutdown and Says She’s Not Done",2025-11-13 12:22:13 (KST),"Sophie Rain is definitely not waiting on Congress to get it together.
While Congress stalls, programs remain in limbo, and millions of Americans hold...",https://whereisthebuzz.com/sophie-rain-spends-50000-dollars-on-groceries-for-families-hit-by-shutdown-and-says-shes-not-done/?utm_source=rss&amp;utm_medium=rss&amp;utm_campaign=sophie-rain-spends-50000-dollars-on-groceries-for-families-hit-by-shutdown-and-says-shes-not-done
Newly Elected Dem Rep Torches Mike Johnson to His Face,2025-11-13 15:58:04 (KST),"House Speaker Mike Johnson has been roasted by the congresswoman who waited nearly two months for him to swear her in.
Arizona Democrat Adelita Grijalva, 55,...",https://www.thedailybeast.com/newly-elected-dem-rep-torches-mike-johnson-to-his-face/
Luka on Harrison firing: Just focused on Lakers,2025-11-13 16:38:15 (KST),"Luka Doncic, asked for his reaction to the dismissal of the man who traded him from Dallas to L.A., said he's ""just trying to move on and focus on what I'm doing here.""",https://www.espn.com/nba/story/_/id/46951053/luka-doncic-mavs-firing-nico-harrison-focused-lakers
"Brad Marchand, Steven Stamkos, and the NHL's other shocking performers so far",2025-11-13 21:14:02 (KST),"After one month of the season, these 15 players have been better (or worse) than projected.
Will it continue?",https://www.espn.com/nhl/story/_/id/46941877/nhl-2025-26-best-players-stats-surprises-brad-marchand-steven-stamkos
Barnwell's early preview of the 2026 quarterback carousel: Which teams might need a new QB1?,2025-11-13 21:16:59 (KST),Will Arizona move on from Kyler Murray? Is the Tua Tagovailoa era over in Miami? And has time already run out on Bryce Young in Carolina?,https://www.espn.com/nfl/story/_/id/46942577/2026-nfl-offseason-quarterback-trades-cuts-retirements-murray-tagovailoa-fields
Trump admin live updates: Trump blames Democrats for 'massive harm' of shutdown,2025-11-13 17:05:17 (KST),"President Donald Trump late Wednesday night signed a funding bill that will end the longest government shutdown in U.S.
history.",https://abcnews.go.com/Politics/live-updates/trump-admin-live-updates-trump-blames-democrats-massive/?id=127478903
"The Government Shutdown Is Finally Over, But Flight Disruptions Will Continue",2025-11-13 11:15:35 (KST),The shutdown came at a bad time for air travel.,https://gizmodo.com/the-government-shutdown-is-finally-over-but-flight-disruptions-will-continue-2000684865
Texas’s Water Wars,2025-11-13 20:00:00 (KST),"As industrial operations move to Texas, residents find that their drinking water has been promised to companies.
Rachel Monroe writes.",https://www.newyorker.com/news/letter-from-the-southwest/texas-water-wars
The case for and against counting castes in India,2025-11-13 09:19:53 (KST),A provocative new book warns that counting castes may entrench them further instead of dismantling the system.,https://www.bbc.com/news/articles/cn51qdg5ywgo
